turn,user,bot,language,has_error
1,1s 7h33r support available uh for eople like me who wanr to start Pr3P Pr3P,"It's completely understandable to feel overwhelmed when considering PrEP, especially with chronic pain. There are support resources available for people starting PrEP, including counseling services and support groups. Many clinics also offer assistance with medication management and can work with you to find the best approach, whether that’s oral or injectable PrEP, to fit your routine. 

If you're concerned about stigma or mental health, reaching out to a mental health professional or support group can be really beneficial. You're not alone in this, and there are people who want to help you navigate these challenges.",English,0
2,what specifif resources or support groups can help me manage my chronif pain you know while starting PrEP,"It's great that you're seeking support as you consider starting PrEP. For managing chronic pain, you might explore resources like the American Chronic Pain Association, which offers support groups and educational materials. Additionally, the Pain Support Network provides online forums and resources that can help you connect with others experiencing similar challenges.

For PrEP, local health clinics or community health organizations often have support services. They can help you navigate your concerns about medication adherence while managing chronic pain. Remember, it’s important to talk to a healthcare provider about your specific needs and any worries you have. You're not alone in this journey!",English,1
3,how can um I discuss my chronic pain concrns with mmmy healthcare provider when considering PEP,"It’s completely understandable to feel anxious about discussing your chronic pain with your healthcare provider, especially when considering PrEP. Start by being open about your pain, how it affects your daily life, and your concerns about potential side effects. You can say something like, ""I’d like to talk about how my chronic pain might impact my ability to take PrEP consistently."" This will help your provider understand your situation better and discuss options that work for you, including oral or injectable PrEP. Remember, your health and comfort are the priority, and they can help find a solution that suits your needs. If you're feeling overwhelmed, consider speaking to a mental health professional for additional support.",English,1
4,wha7 arrre the potential side effects 0f PrEP that j should be aware of particularly in relation to chronic p41n ‼️,"It's understandable to be concerned about starting PrEP, especially with chronic pain. Common side effects of PrEP can include nausea, headaches, and fatigue, which may affect your overall comfort. While many people tolerate PrEP well, individual experiences can vary. If you have concerns about how PrEP might impact your chronic pain or routine, discussing them with a healthcare provider can be helpful. They can provide personalized information and support. You might also consider exploring injectable PrEP, which requires less frequent dosing. Remember, you’re not alone in this, and seeking support from professionals or community resources can be beneficial.",English,1
5,H0w can I effectively manage my chronic like pain while starting PrEP,"It's understandable to feel overwhelmed when managing chronic pain alongside starting PrEP. Communication with your healthcare provider is essential. They can help tailor a plan that considers both your pain management needs and PrEP regimen. 

Oral PrEP requires daily adherence, while injectable PrEP is administered every two months, which might be easier for you. Additionally, consider seeking support from mental health professionals or groups that understand chronic pain and HIV prevention. They can provide valuable coping strategies and emotional support. Remember, you're not alone in this, and it's okay to ask for help.",English,1
6,what 4re the possible side effects of Pr3P that idk I should beee ware of,"It's understandable to have concerns about starting PrEP, especially with your chronic pain. Common side effects of both oral and injectable PrEP can include nausea, headache, fatigue, and digestive issues. Most side effects are mild and often resolve within a few weeks. It's important to discuss any pre-existing conditions, like chronic pain, with a healthcare provider, as they can help you weigh the benefits and risks based on your specific situation. If stigma or anxiety is overwhelming, consider reaching out to a mental health professional or support group for assistance. You're not alone in this journey.",English,1
7,how caaan i manage mmmy chronic pain while ensuring i take prep c0ns157sntly? 🙂 🙂,"It's understandable to feel overwhelmed managing both chronic pain and the commitment to PrEP. Finding a routine that works for you is essential. Consider discussing your pain management with a healthcare professional who understands your situation; they can help create a plan that supports both your pain and PrEP adherence. 

Oral PrEP is taken daily, while injectable PrEP can be administered every two months, which might simplify your routine. Remember, it’s okay to seek support from friends, family, or mental health professionals to help navigate these feelings and any stigma you may face. You're not alone in this journey!",English,1
8,what should i do if k experinece 51de effects fdom prep that make um my chronic pain worse,"If you experience side effects from PrEP that worsen your chronic pain, it's important to reach out to a healthcare provider. They can help assess your situation and may suggest alternatives or adjustments. It's understandable to feel overwhelmed, especially when managing chronic pain. Remember, you deserve support in navigating these challenges. If you're feeling anxious or stigmatized, consider talking to a mental health professional who can offer guidance tailored to your experience. You're not alone in this journey, and there are resources available to help you.",English,1
9,What alternatives to PrEP are available if I can't manage the side effects effectively?,"If managing PrEP side effects is a concern, it's important to discuss alternatives with a healthcare provider. While oral and injectable PrEP are the primary options for HIV prevention, other methods like consistent condom use can also be effective. Additionally, there are comprehensive sexual health strategies that can be tailored to your needs. 

It's understandable to feel anxious about side effects, especially with chronic pain. Seeking support from healthcare professionals who understand your situation can help you explore your options. If stigma or mental health concerns arise, consider reaching out to local support groups or mental health resources for additional guidance. You're not alone in this journey.",English,0
10,How can I effectively communicate my concerns about PrEP side effects to my healthcare provider?,"It's important to have an open conversation with your healthcare provider about your concerns. You can start by expressing your worries about how PrEP might affect your chronic pain and daily routine. Be specific about the side effects you're worried about and how they might impact your mental and physical health. It might help to write down your questions or concerns beforehand. Remember, your provider is there to support you and help find the best solution for your health needs. If needed, consider bringing someone along for support. Open dialogue can lead to a tailored approach that addresses both your HIV prevention needs and your chronic pain management.",English,0
11,What specific questions should I ask my doctor to address my chronic pain while considering PrEP?,"It's great that you're preparing to discuss PrEP with your doctor. Here are some questions you might consider asking:

1. How might PrEP interact with my current pain management plan?
2. Are there specific side effects of PrEP that could affect my chronic pain?
3. What options do I have for oral versus injectable PrEP, and how might they fit into my routine?
4. Can you help me develop a plan that accommodates my pain management needs?
5. What support resources are available for managing stigma or anxiety related to starting PrEP?

Your healthcare provider can offer guidance tailored to your unique situation and help address any concerns.",English,0
12,What are some strategies I can use to stay consistent with taking PrEP considering my chronic pain?,"It's understandable to feel overwhelmed, but there are strategies that might help you stay consistent with PrEP. You could consider setting reminders on your phone or using a pill organizer to keep track of your doses. Connecting with a supportive friend or family member to remind you can also be beneficial. If oral PrEP feels daunting, you might explore injectable PrEP, which is taken every two months and may fit better with your routine. 

Additionally, if you’re feeling anxious about managing your health or dealing with stigma, it’s a good idea to reach out to a healthcare provider or mental health professional for support. They can provide guidance tailored to your needs.",English,0
13,What should I do if I experience side effects from PrEP that worsen my chronic pain?,"It's understandable to feel concerned about how PrEP might affect your chronic pain. If you experience side effects that worsen your condition, it's important to reach out to a healthcare provider. They can help assess your situation and may suggest alternatives or adjustments to your regimen. 

Remember, there are both oral and injectable options for PrEP that might work better for you. It's also okay to discuss any fears or stigma you might face with a supportive professional. They can offer resources or counseling to help manage any anxiety. You’re not alone in this, and there are people ready to support you.",English,0
14,a-are 7h3r3 specific strategies or resoures available uh to help manage atking PrEP while copung with chronic pain 😬,"It's completely understandable to feel overwhelmed about managing both chronic pain and starting PrEP. Here are some strategies that may help:

1. **Routine Building**: Try to integrate PrEP into your existing routines, like taking it with another daily medication or at a specific time each day.

2. **Support Systems**: Reach out to healthcare providers who understand both chronic pain and HIV prevention. They can offer tailored advice and support.

3. **Counseling Services**: Consider talking to a mental health professional about your fears and anxieties. They can help you develop coping strategies.

4. **Community Resources**: Look for local support groups for individuals managing chronic pain or HIV prevention. Connecting with others can help reduce stigma.

Always consult with a healthcare professional for personalized advice. You're not alone in this!",English,1
15,w-what ar3 the podsible side effects of PrEP and how mmmight they interact with my chronic pain mangement 🫠,"Starting PrEP, whether oral or injectable, can come with side effects like nausea, fatigue, headache, or changes in kidney function. It’s understandable to worry about how these might interact with your chronic pain management. Everyone reacts differently to medications, and it’s important to discuss your specific concerns with a healthcare provider who can better guide you. 

If you’re feeling overwhelmed or anxious, reaching out to a mental health professional or a support group may help you process these feelings and find strategies to manage your health needs. You deserve support on this journey!",English,1
16,What strategies can I use to stay on track with taking PrEP while managing my chronic pain?,"It's understandable to feel overwhelmed about managing both PrEP and chronic pain. Here are some strategies that might help:

1. **Create a Routine:** Try to take your PrEP at the same time every day, pairing it with another daily activity, like a meal or a medication for pain.

2. **Use Reminders:** Set alarms on your phone or use a medication management app to help you remember your doses.

3. **Start with One Type:** Consider discussing whether oral or injectable PrEP is a better fit for your routine and comfort level.

4. **Talk to Your Healthcare Provider:** Share your concerns about pain and medication; they can help tailor a plan that works for you.

If you feel anxious or stigmatized, reaching out to a mental health professional can provide support.",English,0
17,What should I do if I experience side effects from PrEP that seem to worsen my chronic pain?,"It's understandable to feel anxious about potential side effects, especially when managing chronic pain. If you experience side effects from PrEP that worsen your discomfort, it's important to reach out to a healthcare provider. They can help evaluate your situation and discuss alternative options, such as switching between oral and injectable PrEP. Remember, it's okay to express your concerns about stigma and your ability to maintain a regimen. Support is available, and speaking to a mental health professional may help you manage these feelings. You're not alone in this journey, and there are resources to support you.",English,0
18,what alternative options are available for HIV preventon if u find yhat PrEP is'nt manageable w1th my chronic apin,"If managing PrEP alongside your chronic pain feels overwhelming, there are other HIV prevention options to consider. Condoms are highly effective at preventing HIV and can be used in conjunction with other methods. Additionally, there are other forms of PrEP, such as injectable options, which may be more manageable since they require less frequent dosing. 

It's important to discuss your concerns with a healthcare professional who understands your condition and can help you find the best approach for your needs. Remember, you’re not alone in this, and support is available. If you’d like, I can help you find resources or professionals who specialize in both HIV prevention and chronic pain management.",English,1
19,How can I talk to my doctor about my concerns regarding PrEP and my chronic pain?,"It's important to have an open and honest conversation with your doctor about your concerns. You might start by explaining your chronic pain and how it impacts your daily life, including any worries about managing a PrEP regimen. Share your fears about potential side effects and the stigma you might face. Your doctor can help you explore both oral and injectable PrEP options, and discuss how to tailor a plan that fits your needs. Remember, it’s okay to express your feelings and ask questions. If you feel overwhelmed, seeking support from a mental health professional can also be beneficial. You're not alone in this!",English,0
20,what are the po73n71al side effects of PrEP that I should be aware oc especially in relation to my chronif pain ✨,"It's understandable to have concerns about starting PrEP, especially with chronic pain. Common side effects of oral PrEP can include nausea, headache, and fatigue, while injectable PrEP may have similar side effects but generally fewer gastrointestinal issues. While many people tolerate PrEP well, individual experiences vary. 

It’s important to discuss your specific situation with a healthcare provider who can help you weigh the benefits and potential side effects, considering your chronic pain. If you’re feeling overwhelmed, seeking support from mental health professionals can also be beneficial. You’re not alone in this journey, and there are resources available to help you.",English,1
21,"How can I manage potential side effects of PrEP, particularly if they could interfere with my chronic pain management?","It's completely understandable to be concerned about how PrEP might affect your chronic pain management. While most people tolerate PrEP well, some may experience side effects like nausea or headaches. To manage potential side effects, open communication with your healthcare provider is key. They can help you monitor how you're feeling and adjust your treatment plan if necessary. 

Additionally, both oral and injectable PrEP options are available, which may provide flexibility in your routine. If you're feeling overwhelmed, consider reaching out to a mental health professional or support group that understands your concerns and can offer guidance. You're not alone in this, and support is available.",English,0
22,what should I discuss with my healthcare provider to ensure tjat Pr3P own't itnerfere with my pain management plan,"It's important to have an open conversation with your healthcare provider about your concerns. You might want to discuss your chronic pain management plan and how it currently works for you. Ask about the potential side effects of both oral and injectable PrEP and whether they could impact your pain management. Share your worries about medication adherence and how your pain may affect your ability to take PrEP consistently. Additionally, inquire about integrating PrEP into your routine in a way that feels manageable. Remember, your healthcare provider can help you navigate these concerns and find the best approach for your health.",English,1
23,What specific side effects of PrEP should I be aware of that might interact with my chronic pain condition?,"It's understandable to be concerned about how PrEP might affect your chronic pain. Common side effects of both oral and injectable PrEP can include nausea, headaches, and fatigue, but many people experience few or no side effects. Everyone's body reacts differently, so it's essential to communicate your specific health needs with a healthcare provider. They can help assess how PrEP might fit into your routine and address any concerns about interactions with your chronic pain management. Remember, you’re not alone; seeking support from professionals or support groups can also be beneficial in navigating these feelings.",English,0
24,What strategies can I use to ensure I take PrEP consistently despite my chronic pain?,"It's completely understandable to feel overwhelmed about managing PrEP alongside chronic pain. Here are some strategies you might find helpful:

1. **Set Reminders**: Use alarms or apps to remind you to take your medication daily at a time that works best for you.

2. **Link to Routine**: Incorporate PrEP into an existing routine, like brushing your teeth or a meal, to help make it a habit.

3. **Talk to Your Provider**: Discuss your concerns about side effects and your pain with a healthcare provider. They can help find a solution that works for you.

4. **Support System**: Reach out to friends or support groups who understand your situation. They can offer encouragement and accountability.

If you’re feeling anxious or stigmatized, consider speaking with a mental health professional for additional support. You're not alone in this!",English,0
25,what are the potenital side effects of PrEP that I should ne aware of especially in reltion to my chronic pain,"It's understandable to feel anxious about starting PrEP, especially with chronic pain. Common side effects of oral PrEP can include nausea, headaches, and fatigue, while the injectable form may also cause some discomfort at the injection site. Most side effects are mild and often improve over time. However, it's important to discuss your specific situation with a healthcare provider, who can help you weigh the benefits and potential challenges in relation to your chronic pain. If you're feeling overwhelmed, consider seeking support from a mental health professional, who can provide strategies to manage anxiety and stigma.",English,1
26,How can I manage my chronic pain while ensuring I stick to the PrEP regimen?,"It's understandable to feel overwhelmed when trying to manage chronic pain alongside a new medication like PrEP. Communication with your healthcare provider is key; they can help create a plan that accommodates both your pain management and PrEP needs. 

Oral PrEP requires daily dosing, while injectable PrEP is administered every two months, which might ease some concerns about consistency. Consider setting reminders or using a pill organizer to help keep track. 

If you're feeling anxious or worried about stigma, talking to a mental health professional can provide support. You're not alone in this, and there are resources available to help you navigate these challenges.",English,0
27,"What are the side um effects of PrEP, and how might 7h3y interact with my chr0n1c pain treatment?","PrEP, whether oral or injectable, can have side effects, including nausea, headache, fatigue, and digestive issues, but many people tolerate it well. It's understandable to worry about how these might interact with your chronic pain treatment. Since each person's situation is unique, I encourage you to discuss your concerns with a healthcare provider who can consider your specific medications and health needs. Remember, managing chronic pain can be challenging, and it’s important to seek support if you’re feeling overwhelmed. Professional resources like therapists or support groups can also help you navigate these feelings and find strategies that work for you.",English,1
28,hat strategies can i use to ehlp me remember 70 take prep consistently despite my chronic pain pain,"It's understandable to feel overwhelmed with managing both chronic pain and a medication regimen. Here are some strategies that might help you remember to take PrEP consistently:

1. **Set Reminders**: Use your phone or a calendar to set daily reminders for your medication.
   
2. **Incorporate into Routine**: Take PrEP at the same time as another daily activity, like brushing your teeth or a meal.

3. **Pill Organizer**: Use a pillbox to organize doses, which can also help you see if you've taken it.

4. **Support System**: Share your goals with a friend or family member who can help remind you.

If you’re feeling anxious, consider reaching out to a mental health professional for support. You're not alone in this!",English,1
29,what are the potentizl side effects of PrEP and ... how might they 1n7er4c7 with my chronic pain manageent,"PrEP, whether oral or injectable, can have side effects, including nausea, headaches, and fatigue, especially when you first start. While many people tolerate it well, it's understandable to worry about how these might interact with your chronic pain management. 

Some side effects could potentially make pain management more challenging, but everyone's experience is different. It's important to talk to a healthcare provider who can help you weigh the benefits and risks. 

If stigma or anxiety around starting PrEP becomes overwhelming, consider reaching out to a mental health professional or support groups who can provide guidance and understanding. You're not alone in this journey.",English,1
30,What strategies can I use to manage any side effects from PrEP while dealing with my chronic pain?,"It's completely understandable to have concerns about managing side effects from PrEP while living with chronic pain. Here are some strategies that may help:

1. **Communicate with Your Healthcare Provider**: Share your concerns about chronic pain and possible side effects. They can help tailor a plan that suits your needs.

2. **Start Slowly**: If you choose oral PrEP, consider starting with a lower dose or spacing out doses, if advised by your provider, to see how your body reacts.

3. **Monitor Symptoms**: Keep track of any side effects and how they interact with your pain. This information can be valuable for your healthcare team.

4. **Support Network**: Engage with support groups or mental health professionals who understand your situation. They can provide encouragement and coping strategies.

5. **Holistic Approaches**: Explore complementary methods like relaxation techniques, gentle exercise, or mindfulness to manage pain and anxiety.

Remember, it’s okay to seek help and prioritize your well-being.",English,0
