turn,user,bot,language,has_error
1,Are there upport resources available for people who might struggle with tbe information information,"Yes, there are support resources available for individuals who may find it challenging to process information. Many clinics and organizations provide tailored counseling and education to help you understand PrEP and the treatment process at your own pace. You can also reach out to local HIV prevention programs, which often have trained staff who can explain things clearly and answer your questions.

Additionally, you might consider speaking with a mental health professional who can help with anxiety and stigma-related concerns. Remember, you're not alone in this, and there are people ready to support you.",English,1
2,What specific questions should I ask my healthcare provider to better understand how PrEP works?,"It's great that you want to learn more about PrEP! Here are some questions you might consider asking your healthcare provider:

1. What is PrEP, and how does it work to prevent HIV?
2. What are the different types of PrEP available (oral and injectable)?
3. How often will I need to take the medication or get an injection?
4. What are the possible side effects, and how can I manage them?
5. How will we monitor my health while I’m on PrEP?
6. What should I do if I miss a dose or appointment?
7. Are there support resources available for people starting PrEP?

Don’t hesitate to ask for clarification if something isn’t clear!",English,0
3,what are the most common side effects of PrEP and uh how long do 7hey usually last?,"Common side effects of PrEP can include nausea, headache, fatigue, and stomach pain. These side effects often occur when you first start taking PrEP and usually improve within a few weeks as your body adjusts. Most people find that they either go away entirely or become much less noticeable over time.

It's important to talk to a healthcare provider about any concerns or side effects you experience. They can help you manage them and ensure that PrEP is working effectively for you. If you ever feel overwhelmed or anxious about starting PrEP, consider reaching out to a mental health professional or support group for guidance. You're not alone in this journey!",English,1
4,How can I make sure I remember to take PrEP consistently every day?,"It's completely normal to feel anxious about remembering to take PrEP consistently. Here are some helpful tips: 

1. **Set Reminders**: Use your phone or a calendar to set daily alarms or reminders.
2. **Routine**: Incorporate taking PrEP into your daily routine, like brushing your teeth or having breakfast.
3. **Visual Cues**: Keep the medication in a visible place, like next to your toothbrush or on the kitchen counter.
4. **Support Network**: Share your goals with a trusted friend or family member who can help remind you.

If you're feeling overwhelmed, consider reaching out to a healthcare professional or a support group for additional guidance. You're taking important steps for your health!",English,0
5,What should I do if I miss a dose of PrEP?,"If you miss a dose of PrEP, it's important not to panic. For oral PrEP, take the missed dose as soon as you remember. If it's close to the time for your next dose, skip the missed one and continue with your regular schedule. For injectable PrEP, talk to your healthcare provider about rescheduling your next injection. 

Always remember that consistent use is key for effectiveness. If you're feeling anxious about managing the regimen, discussing this with a healthcare professional can provide support and clarity. You’re not alone in this, and there are resources available to help you.",English,0
6,what sre some simple tips to help me remember to take my you know PrEP medication on time?,"It's great that you're looking for ways to stay on track with your PrEP medication! Here are some simple tips:

1. **Set Reminders**: Use your phone or a calendar to set daily reminders at the same time each day.
2. **Create a Routine**: Pair taking your medication with a daily activity, like brushing your teeth or having breakfast.
3. **Use a Pill Organizer**: This can help you see if you've taken your dose for the day.
4. **Keep it Visible**: Place your medication in a spot you see regularly, like next to your toothbrush or on the kitchen counter.
5. **Get Support**: Share your goals with a friend or family member who can help remind you.

If you feel anxious about this process, it might help to talk to a healthcare professional or counselor. You're not alone in this!",English,1
7,what should I do if I miss a dose of my Pr3P medication medication,"If you miss a dose of your PrEP medication, it's important to take it as soon as you remember, unless it's almost time for your next dose. If that's the case, skip the missed dose and return to your regular schedule. Do not take a double dose. For oral PrEP, consistency is key for effectiveness. If you’re using injectable PrEP, it’s usually given every two months, so missing a dose may require a discussion with your healthcare provider about your next steps. If you're feeling anxious or overwhelmed, consider reaching out to a healthcare professional who can provide support and guidance tailored to your needs.",English,1
8,How can I keep track of my PrEP doses to avoid missing any?,"It's great that you're thinking about how to stay on track with your PrEP doses! Here are some helpful strategies:

1. **Set Reminders**: Use your phone or a calendar to set daily reminders for oral PrEP or the injection schedule for injectable PrEP.
   
2. **Create a Routine**: Try to take your medication at the same time every day or link it to another daily activity, like brushing your teeth.

3. **Use a Pill Organizer**: For oral PrEP, a weekly pill organizer can help you see if you’ve taken your dose.

4. **Track Progress**: Consider keeping a journal or using an app to note when you take your doses.

If you're feeling overwhelmed, reach out to a healthcare provider or a support group for further assistance. You're not alone in this journey!",English,0
9,What should I do if I miss a dose of PrEP?,"If you miss a dose of PrEP, it's important to take it as soon as you remember. If it's almost time for your next dose, just skip the missed one and continue with your regular schedule. Do not take two doses at once. Consistency is key for PrEP to be effective, so try to take it at the same time each day. If you have concerns or if you miss several doses, it's a good idea to reach out to your healthcare provider for guidance. Remember, you're not alone, and support is available if you need it.",English,0
10,how 0f73n do I ned to see my d0c7or while 0'm on PrEP 😅,"While on PrEP, it’s generally recommended to see your doctor every three months. During these visits, your doctor will check your kidney function, ensure you’re not HIV-positive, and provide you with your next prescription. It’s important to keep these appointments to stay healthy and manage your treatment effectively. If you have any worries or questions, don’t hesitate to talk to your healthcare provider—they're there to help you!",English,1
11,whqt shoudl I d0 it I miss a dose of PrE 🙂,"If you miss a dose of PrEP, it's important to take it as soon as you remember. If it's almost time for your next dose, skip the missed one and continue with your regular schedule. Do not double up on doses. If you're unsure or have specific concerns, consider reaching out to a healthcare provider for guidance. Remember, both oral and injectable PrEP are effective, and it's okay to ask for help in understanding the process. You're taking a positive step for your health, and support is available.",English,1
12,what are the key side effrcts of prep that i should be aware of?,"It's understandable to have concerns about side effects when considering PrEP. Common side effects may include nausea, headaches, and fatigue, especially in the first few weeks of starting the medication. These often lessen over time. Some individuals might experience changes in kidney function, so regular check-ups with a healthcare provider are important. 

If you ever feel overwhelmed or anxious about this process, consider talking to a healthcare professional or a support group. They can provide guidance and reassurance as you navigate your options. You're not alone in this, and it's great that you're seeking information to protect your health!",English,1
13,How often do I need to visit the doctor while on PrEP to monitor my health?,"When you're on PrEP, it's important to visit your healthcare provider every three months. During these visits, they will check your kidney function, test for HIV, and ensure you're tolerating the medication well. This regular monitoring helps keep you safe and healthy while using PrEP. If you have concerns about the visits or feel anxious, that's completely understandable. Talking to a healthcare professional can provide support and help answer any questions you may have. Remember, you're not alone in this!",English,0
14,w-what 5hould I expect during my doctr visits while on PrEP?,"During your doctor visits for PrEP, you can expect a few key things. Initially, your doctor will discuss your health history, sexual practices, and any concerns you have. They will perform tests to check for HIV, kidney function, and sexually transmitted infections (STIs). After starting PrEP, you’ll typically return every 3 months for follow-up visits. These visits will include routine testing and a chance to talk about how you’re feeling on the medication. Don’t hesitate to ask questions or express any worries; your healthcare provider is there to support you. Remember, it’s okay to take your time understanding the process.",English,1
15,What specific questions should I prepare to ask my doctor during my PrEP appointments?,"It's great that you're preparing for your PrEP appointments! Here are some questions you might consider asking:

1. How does PrEP work, and how can it help protect me from HIV?
2. What are the differences between oral and injectable PrEP, and which might be better for me?
3. What can I expect during the initial tests and ongoing follow-ups?
4. How should I take the medication, and what should I do if I miss a dose?
5. What side effects should I be aware of, and how can I manage them?
6. How will my privacy and confidentiality be protected during this process?

Remember, it's okay to take your time and ask for clarification if needed!",English,0
16,What steps can I take to better understand the information my doctor shares about PrEP?,"It's great that you're seeking to understand more about PrEP! Here are some helpful steps:

1. **Take Notes**: Write down key points during your appointment. This can help you remember important information later.

2. **Ask Questions**: Don’t hesitate to ask your doctor to explain things in simpler terms or to repeat anything you don’t understand.

3. **Use Visual Aids**: Sometimes diagrams or pamphlets can make things clearer. Ask if your doctor has any resources.

4. **Bring a Friend**: Having someone with you can provide support and help you process the information.

5. **Follow-Up**: If you’re still unsure after your visit, consider reaching out to your doctor’s office for clarification.

Remember, it’s okay to take your time with this information!",English,0
17,what specific questions should i ask my doctor abotu the prep treatment regimen to ensure i fully understand it,"It's great that you're taking the step to learn more about PrEP! Here are some specific questions you can ask your doctor:

1. What are the differences between oral and injectable PrEP?
2. How often do I need to take the medication or get the injections?
3. What are the possible side effects, and how can I manage them?
4. How will we monitor my health while I'm on PrEP?
5. What should I do if I miss a dose or an appointment?
6. Can you explain how PrEP works in simple terms?

Feel free to take notes during your appointment or ask for written information to help you remember. It's okay to ask for clarification if anything is confusing!",English,1
18,What resources are available to help me understand how to take PrEP correctly?,"It's great that you're seeking information about PrEP! To help you understand how to take it correctly, consider these resources:

1. **Healthcare Provider**: Speak with a doctor or nurse who specializes in HIV prevention. They can provide personalized guidance and answer your questions.

2. **Local Clinics**: Many community health clinics offer PrEP education. They often have resources tailored for individuals with different learning needs.

3. **Online Resources**: Websites like the CDC and AIDSVu offer clear, easy-to-understand information about PrEP.

4. **Support Groups**: Connecting with others who are on PrEP can help you feel less alone and provide practical tips.

If you’re feeling anxious, consider reaching out to a mental health professional for support as well. You're not alone in this journey!",English,0
19,What should I expect during my doctor visits while on PrEP?,"During your doctor visits while on PrEP, you can expect a few key things. Initially, your doctor will assess your health, including testing for HIV and other sexually transmitted infections (STIs). You'll also have a kidney function test since PrEP can affect kidney health. 

Once you start PrEP, regular follow-ups every 3 months are typical. These visits include ongoing HIV testing, STI screenings, and checking in on how you’re feeling about the medication. Remember, it’s okay to ask questions during these visits; your healthcare provider is there to support you. If you're feeling anxious or worried about stigma, consider reaching out to a mental health professional for additional support.",English,0
20,what specific questions should i ask my doctor during my prep appointments to make sure i understand everything?,"It’s great that you want to be proactive about your health! Here are some questions you might consider asking your doctor during your PrEP appointments:

1. How does PrEP work to prevent HIV?
2. What are the differences between oral and injectable PrEP?
3. How often will I need to come in for check-ups?
4. What are the possible side effects, and what should I watch for?
5. How can I manage my medication schedule effectively?
6. What should I do if I miss a dose?
7. Are there any interactions with other medications I should know about?

Feel free to write these down and take them with you. Your health matters, and it’s okay to ask for clarification if you don’t understand something.",English,1
21,what are ths key sigbs that I should looo out uh for if k experienceee side effects frrrom PrEP,"It's great that you're seeking information about PrEP! Common side effects can include nausea, headache, fatigue, and changes in kidney function. Most side effects are mild and often improve over time. However, if you experience severe symptoms like significant abdominal pain, yellowing of the skin or eyes, or unusual fatigue, it's important to reach out to a healthcare provider. Remember, it’s okay to ask for help to understand any part of the process. If you have concerns about stigma or anxiety, consider speaking with a mental health professional who can provide support. You're taking a positive step for your health!",English,1
22,"how 0f73n will I need to see a doooctor while on PrEP, and ... what can I expect during those visits? visits?","When you're on PrEP, you typically need to see a healthcare provider every three months. During these visits, you'll have a blood test to check your kidney function and ensure you're HIV-negative. You'll also discuss any side effects or concerns and receive a prescription for your medication.

It's normal to feel anxious about these appointments, but remember that healthcare providers are there to support you. If you have trouble processing information or feel overwhelmed, consider bringing a friend or asking questions until you feel comfortable. If you’re feeling stigma or anxiety, reaching out to a mental health professional can be helpful.",English,1
23,w-what specific questions should i ask my doctor during my prep appointments 70 better understand my treatment,"It’s great that you want to prepare for your PrEP appointments! Here are some questions you might consider asking your doctor:

1. How does PrEP work to prevent HIV?
2. What are the differences between oral and injectable PrEP?
3. How often will I need to come in for check-ups?
4. What side effects should I be aware of?
5. How should I take the medication (daily for oral, schedule for injectable)?
6. What should I do if I miss a dose?
7. Are there any interactions with other medications I’m taking?
8. How can I manage any feelings of anxiety or stigma related to taking PrEP?

Remember, it’s okay to take your time and ask for clarification if you need it.",English,1
24,Can you explain how to take the medication properly and what to do if I miss a dose?,"Absolutely! PrEP is available in two forms: oral tablets and injectable medications. 

For oral PrEP, you usually take one pill daily, at the same time each day. If you miss a dose, take it as soon as you remember. If it's almost time for your next dose, skip the missed one—don’t double up.

For the injectable form, you typically receive an injection every two months. If you miss an injection, contact your healthcare provider to discuss rescheduling.

If you ever feel anxious or uncertain about your treatment, consider reaching out to a healthcare professional or a support group. You're not alone in this journey!",English,0
25,What should I do if I experience side effects from taking PrEP?,"If you experience side effects from taking PrEP, the first step is to reach out to your healthcare provider. They can help you understand what you’re feeling and determine if it’s related to the medication. It’s important to communicate openly about any side effects, as they can offer support and potential solutions. Remember, many people experience few or no side effects, and your health is the priority. If you ever feel overwhelmed or anxious about this process, consider talking to a mental health professional who can provide support. You're taking a responsible step in protecting your health, and that’s commendable!",English,0
26,How often do I need to visit my doctor while on PrEP?,"While on PrEP, you typically need to visit your doctor every three months. During these visits, your healthcare provider will check your kidney function, test for HIV, and discuss any side effects or concerns you may have. It’s a chance to ask questions and ensure you’re managing your treatment comfortably. If you're feeling anxious about these visits, remember that healthcare providers are there to support you without judgment. If you need help managing anxiety or stigma, consider reaching out to a mental health professional for support. You’re not alone in this!",English,0
27,What should I do if I miss a dose of PrEP?,"If you miss a dose of PrEP, try to take it as soon as you remember. If it's close to the time of your next dose, skip the missed one and continue with your regular schedule. It’s important not to double up on doses. If you find yourself missing doses often, consider talking to a healthcare provider about your concerns. They can provide support and strategies to help you manage your regimen. Remember, you're not alone in this, and it's okay to reach out for help.",English,0
28,hkw c4n I maek sure I remember to take my PrEP medication evefy day,"It's completely understandable to feel anxious about remembering to take your PrEP. Here are a few tips that might help:

1. **Set Reminders**: Use your phone or a calendar to set daily reminders.
2. **Routine**: Try to take it at the same time every day, like with a meal or before bed.
3. **Pill Organizer**: Consider using a pill organizer to keep track of your doses.
4. **Support**: Share your plan with a trusted friend or family member who can help remind you.

If you have any feelings of anxiety or fear about starting PrEP, talking to a healthcare provider or counselor can be very helpful. You're not alone in this!",English,1
29,what should i do if k miss 4 dose of my prep medication?,"If you miss doses of your PrEP medication, it's important to reach out to your healthcare provider as soon as possible for guidance tailored to your situation. Generally, if you miss a dose, take it as soon as you remember. If it's almost time for your next dose, skip the missed one and continue with your regular schedule. Missing doses can reduce effectiveness, so staying consistent is key. Remember, it's okay to feel anxious about this; many people share similar concerns. If you're feeling overwhelmed, consider speaking with a mental health professional or a support group for additional help. You’re not alone in this!",English,1
30,how do i kkknow if prep us the rigtn choice for me?,"Choosing PrEP can be a personal decision. It's designed for people at high risk of HIV to help prevent infection. Consider factors like your sexual health, partners, and any potential exposure to HIV. If you're unsure, talking to a healthcare provider can help clarify if it's right for you. They can explain both oral and injectable options, their effectiveness, and how to take them. Remember, it's completely normal to feel anxious about starting PrEP, and you deserve support. If you're feeling overwhelmed, consider reaching out to a counselor or support group who understands these concerns. You're not alone in this journey.",English,1
