turn,user,bot,language,has_error
1,c0mm3n7 pu15-e abordre la conversation 5ur la PrEP avec mkn médecin sans m3 sehtir jugée ? 🙄,"Il est tout à fait normal de se sentir anxieuse à l'idée de parler de la PrEP avec votre médecin. Pour aborder ce sujet, vous pourriez commencer par exprimer votre désir de protéger votre santé sexuelle. Dites-lui que vous avez des préoccupations spécifiques, notamment en raison de votre douleur chronique. Cela peut ouvrir la conversation dans un cadre sûr et empathique. 

Rappelez-vous que les professionnels de la santé sont là pour vous aider, sans jugement. Si vous ressentez de la stigmatisation ou de la peur, envisagez de consulter un professionnel de la santé mentale qui peut vous soutenir. Vous méritez des soins adaptés à vos besoins.",French,1
2,Quelles sont les ressources disponibles en France pour m'aider à accéder à la PrEP malgré ma douleur chronique ?,"En France, plusieurs ressources peuvent vous aider à accéder à la PrEP même en tenant compte de votre douleur chronique. Tout d'abord, vous pouvez vous adresser à des centres de santé sexuelle, comme les Cegidd, qui offrent des consultations gratuites et confidentielles. Ils peuvent vous accompagner dans l'accès à la PrEP, en tenant compte de votre situation.

De plus, des associations comme AIDES ou Act Up Paris proposent des services d'information et de soutien. N'hésitez pas à leur parler de vos préoccupations concernant la douleur chronique et la stigmatisation ; ils sont là pour vous écouter et vous aider. Vous méritez de prendre soin de votre santé sexuelle dans un environnement sans jugement.",French,0
3,Quels sont les moyens de surmonter la stigmatisation que je pourrais rencontrer en demandant de l'aide pour la PEP ?,"C'est tout à fait compréhensible de ressentir des appréhensions face à la stigmatisation. Pour surmonter cela, il peut être utile de se rappeler que demander de l'aide pour la PrEP est un acte courageux et responsable pour votre santé. Cherchez des professionnels de santé qui sont bien informés et sensibles aux questions de stigmatisation. Participer à des groupes de soutien peut aussi offrir un espace sûr pour partager vos expériences. Enfin, l'éducation sur la PrEP et le VIH peut aider à réduire la stigmatisation, tant pour vous que pour ceux qui vous entourent. N’hésitez pas à chercher un soutien professionnel pour vos préoccupations émotionnelles.",French,1
4,cokment puis-je trouver des professionnels de santé qu1 comprennent idk ma situation et sont sensibles à me5 bdsoins ?,"Il peut être difficile de trouver des professionnels de santé qui comprennent vos besoins spécifiques, mais il existe des ressources pour vous aider. Vous pouvez commencer par contacter des centres de santé communautaires ou des cliniques spécialisées dans la santé sexuelle. Ils ont souvent des équipes formées pour traiter des questions comme la douleur chronique et la PrEP. 

N'hésitez pas à poser des questions sur leur approche et leur sensibilité à votre situation. Parler à un professionnel de santé qui comprend vos préoccupations peut vraiment faire une différence. Si vous avez besoin de soutien émotionnel, envisagez de consulter un thérapeute qui peut vous aider à naviguer ces défis.",French,1
5,quels sont les critères pour accéder like à la PrEP et c0m3nt puis-je les remplir malgré mes douleurs chronique ?,"Pour accéder à la PrEP, il faut généralement avoir un risque accru d'infection par le VIH, être testé négatif au VIH, et ne pas avoir de contre-indications médicales. 

Concernant vos douleurs chroniques, il est compréhensible que cela complique l'accès aux soins. Vous pourriez envisager de parler à un professionnel de santé qui comprend votre situation. Ils peuvent vous aider à trouver des solutions adaptées à vos besoins et à vos défis, tout en respectant votre santé globale.

N'hésitez pas à demander du soutien auprès de groupes ou de services spécialisés qui peuvent offrir des ressources et un accompagnement. Vous méritez d'accéder à des soins sans jugement.",French,1
6,quels tttypes de prfoessionnels de santé devrais-je consulter pour discuter de la prep en tenant compte de ma douleur chronique 😭 😭,"Il est important de choisir des professionnels de santé qui comprennent votre situation. Vous pourriez commencer par consulter un médecin généraliste ou un spécialiste en santé sexuelle, comme un infectiologue, qui peut vous parler de la PrEP. Un neurologue ou un spécialiste de la douleur chronique pourrait également vous aider à gérer votre douleur tout en abordant vos préoccupations liées à la santé sexuelle. N'hésitez pas à leur parler de vos appréhensions concernant la stigmatisation et à exprimer vos besoins spécifiques. Si vous ressentez le besoin d’un soutien émotionnel, envisager de parler à un professionnel de la santé mentale peut être bénéfique. Vous n'êtes pas seule dans ce parcours.",French,1
7,Cimment puis-je surmonter la stimgatisation liée à ma douleur chronique pour mieux aborder la question de la rEP avec les professionnels de snaté ? ?,"Il est compréhensible de se sentir appréhensive face à la stigmatisation. Pour aborder la PrEP avec des professionnels de santé, essayez de vous concentrer sur votre santé globale et vos besoins. Préparez-vous en notant vos questions et préoccupations à l'avance. Choisissez un professionnel de santé avec lequel vous vous sentez à l'aise et qui est sensible aux questions de stigmatisation. Vous pouvez également rechercher des groupes de soutien locaux ou en ligne, où vous trouverez des personnes partageant des expériences similaires. N'hésitez pas à demander des recommandations pour des ressources spécialisées en santé mentale si vous en ressentez le besoin. Votre bien-être est important, et vous méritez un soutien adapté.",French,1
8,Q-Quels sont llles critères pour ccéder à la PrwP en France et comment puis-je les remplri malgré ma douleur chr0n1qur,"En France, l’accès à la PrEP (profilaxie pré-exposition) est ouvert aux personnes à risque d’infection par le VIH. Cela inclut les hommes ayant des rapports sexuels avec des hommes, les personnes ayant des partenaires séropositifs, et d’autres groupes à risque. 

Pour commencer, vous devrez consulter un professionnel de santé qui pourra évaluer vos besoins et vous prescrire la PrEP. Concernant votre douleur chronique, il est essentiel de communiquer ouvertement avec votre médecin. Ils peuvent vous aider à trouver des solutions pour faciliter l'accès aux soins. 

N’hésitez pas à demander du soutien, que ce soit par des professionnels de santé, des groupes de soutien ou des lignes d’écoute. Vous méritez de prendre soin de votre santé sans stigmatisation.",French,1
9,Quelles sont les options pour obtenir des conseils médicaux sur la PrEP si je ne peux pas me déplacer facilement en raison de ma douleur chronique ?,"Il existe plusieurs options pour obtenir des conseils médicaux sur la PrEP sans avoir à vous déplacer. Vous pouvez envisager des consultations en ligne avec des professionnels de la santé, qui peuvent vous fournir des informations et répondre à vos questions. De nombreux centres de santé offrent également des services de télémédecine.

De plus, certaines organisations communautaires peuvent proposer des services de soutien à domicile ou des consultations à distance. N'hésitez pas à rechercher des ressources locales qui se spécialisent dans la santé sexuelle et le soutien aux personnes vivant avec des douleurs chroniques. Si vous ressentez de la stigmatisation ou des émotions difficiles, envisager de parler à un professionnel de la santé mentale pourrait aussi vous aider.",French,0
10,coment puis-je trouvvver un professionnel de santé qui comprend les défis liés à ma d0ul3ur chronique 70u7 en me conseillant suuur la prep,"Il est important de trouver un professionnel de santé qui comprend vos besoins spécifiques. Vous pouvez envisager de rechercher des cliniques spécialisées dans la santé sexuelle ou des centres de santé communautaires qui offrent des services liés à la PrEP. N'hésitez pas à demander si le personnel a de l'expérience avec des patients vivant avec des douleurs chroniques. Les plateformes en ligne peuvent également vous aider à lire des avis ou à trouver des recommandations. Si vous ressentez de la stigmatisation ou des émotions difficiles, il peut être utile de parler à un thérapeute ou à un conseiller qui se spécialise dans ces domaines. Prenez soin de vous.",French,1
11,Quels sont les critères à considérer pour choisir un professionnel de santé qui me soutiendra à la fois dans la gestion de ma douleur chronique et dans l'accès à la PrEP ?,"Choisir un professionnel de santé pour vous soutenir dans la gestion de votre douleur chronique et l'accès à la PrEP est essentiel. Voici quelques critères à considérer :

1. **Compétence** : Recherchez un professionnel ayant de l'expérience dans la gestion de la douleur et la prévention du VIH, notamment la PrEP.
2. **Empathie** : Un bon praticien doit être compréhensif et prêt à écouter vos préoccupations sans jugement.
3. **Accessibilité** : Vérifiez la proximité du cabinet et la disponibilité pour des rendez-vous adaptés à votre emploi du temps.
4. **Approche holistique** : Préférez un professionnel qui considère à la fois votre santé physique et mentale.
5. **Confidentialité** : Assurez-vous qu'il respecte votre vie privée, surtout concernant la stigmatisation.

N'hésitez pas à poser des questions lors de votre première consultation pour évaluer si vous vous sentez à l'aise.",French,0
12,Quels sont les moyens de surmonter la stigmatisation liée à la prise de PrEP en tant que femme vivant avec une douleur chronique ?,"Il est compréhensible de ressentir des appréhensions face à la stigmatisation. Pour surmonter cela, il peut être utile de s'informer et de partager vos expériences avec des personnes de confiance ou des groupes de soutien. Parler de votre situation à des professionnels de santé qui comprennent la douleur chronique et la PrEP peut également aider. Ils peuvent vous fournir un espace sûr pour discuter de vos préoccupations.

Envisagez de consulter des ressources professionnelles en santé mentale si vous ressentez le besoin d'un soutien supplémentaire. La PrEP, qu'elle soit orale ou injectable, est un outil efficace de prévention du VIH, et votre santé est importante.",French,0
13,Comment puis-je trouver un professionnel de santé qui comprenne à la fois la douleur chronique et l'accès à la PrEP ?,"Il est essentiel de trouver un professionnel de santé qui soit à l'écoute de vos besoins spécifiques. Vous pouvez commencer par consulter des centres de santé communautaires, des cliniques spécialisées dans la santé sexuelle, ou des associations qui se consacrent à la douleur chronique et à la prévention du VIH. N'hésitez pas à poser des questions sur leur expérience avec la PrEP et la douleur chronique lors de la prise de rendez-vous. En outre, des ressources en ligne, comme des forums ou des groupes de soutien, peuvent être utiles pour obtenir des recommandations. Prenez soin de vous et sachez que vous n'êtes pas seule dans cette démarche.",French,0
14,"Quels sont les effets secondaires de la PrEP que je devrais considérer, surtout en lien avec ma douleur chronique ?","La PrEP, qu'elle soit orale ou injectable, peut avoir des effets secondaires. Les effets les plus courants incluent des nausées, de la fatigue, des maux de tête et des douleurs abdominales, mais ils sont généralement temporaires. Pour quelqu'un vivant avec une douleur chronique, il est compréhensible de s'inquiéter de l'impact potentiel sur votre bien-être. Il est important de discuter de vos préoccupations avec un professionnel de santé qui pourra vous fournir des informations adaptées à votre situation. Si vous ressentez de l'anxiété ou de la stigmatisation, envisagez de parler à un spécialiste qui pourra vous offrir un soutien émotionnel. Vous méritez de prendre soin de votre santé sexuelle sans jugement.",French,0
15,Comment puis-je trouver des ressources ou des professionnels de santé qui comprennent à la fois la PrEP et la gestion de la douleur chronique ?,"Il est important de trouver des professionnels de santé qui comprennent bien vos besoins spécifiques. Vous pourriez commencer par consulter votre médecin généraliste ou un spécialiste en santé sexuelle, qui pourrait vous orienter vers des cliniques spécialisées en PrEP. Des organisations locales de santé sexuelle ou des associations de lutte contre le VIH peuvent également offrir des ressources et des recommandations. N'hésitez pas à poser des questions sur leur expérience avec la douleur chronique et la PrEP. Si vous ressentez de l'anxiété ou de la stigmatisation, des professionnels de la santé mentale peuvent vous apporter un soutien précieux. Prenez soin de vous, et sachez que vous n’êtes pas seule dans cette démarche.",French,0
16,q-quels sont les effets secondaires de la PrEP et commet peuvent-ils interagir avec ma douleur chronique ? 😬,"Les effets secondaires de la PrEP, qu'elle soit orale ou injectable, peuvent inclure des nausées, des maux de tête, et des douleurs abdominales, mais ils sont généralement légers et temporaires. Concernant votre douleur chronique, il est important de discuter de votre situation avec un professionnel de santé. Ils peuvent vous aider à évaluer comment la PrEP pourrait interagir avec vos traitements actuels et votre état de santé général. N’oubliez pas que vous méritez de prendre soin de votre santé sexuelle sans jugement. Si vous ressentez du stress ou de l'anxiété, envisager de parler à un professionnel de la santé mentale peut également être bénéfique.",French,1
17,où puis-je trouver des ressources ou des pr0f35510nn3l5 de santé qui comprebnent les dfé15 iés à la douleur chronique et à l'accès à la prep ‼️,"Il existe plusieurs ressources pour vous aider à trouver des professionnels de santé sensibles à votre situation. Vous pouvez consulter des associations locales, comme AIDES ou le Sidaction, qui offrent des informations sur l'accès à la PrEP et peuvent vous orienter vers des médecins formés à la douleur chronique. Les centres de santé communautaires ou les cliniques spécialisées en santé sexuelle sont également de bonnes options. N'hésitez pas à leur poser des questions sur votre douleur et vos préoccupations. Si vous ressentez le besoin de parler de vos émotions, envisager de consulter un psychologue ou un thérapeute spécialisé peut être bénéfique. Vous méritez un soutien adapté à vos besoins.",French,1
18,uQels xont les effets secondaires de la PrEP surtout pour quelqu'un qui souffre de douleur chronique,"La PrEP, qu'elle soit orale ou injectable, peut provoquer des effets secondaires, bien que beaucoup de gens ne les ressentent pas. Les effets les plus courants incluent des nausées, des maux de tête ou des douleurs abdominales. Pour ceux qui vivent avec une douleur chronique, il est compréhensible d'avoir des préoccupations concernant la gestion de ces effets. Il est essentiel de discuter de vos préoccupations avec un professionnel de santé qui pourra vous aider à évaluer les bénéfices et les risques dans votre situation. N'hésitez pas à demander un soutien pour vos émotions liées à la stigmatisation ou à la santé mentale, car cela peut aussi être très bénéfique.",French,1
19,Comment puis-je trouver des ressources ou des professionnels de santé compréhensifs qui peuvent m'aider à accéder à la PrEP malgré ma douleur chronique ?,"Il est important de trouver des professionnels de santé qui comprennent vos besoins spécifiques. Vous pouvez commencer par rechercher des centres de santé communautaires ou des cliniques spécialisées dans la santé sexuelle. Beaucoup de ces établissements ont des équipes formées pour aborder des questions de douleur chronique et de santé sexuelle avec empathie. 

Des organisations comme AIDES en France peuvent également vous orienter vers des ressources adaptées. N'hésitez pas à discuter ouvertement de vos préoccupations avec des professionnels, car ils sont là pour vous soutenir sans jugement. Si vous ressentez le besoin d'un accompagnement émotionnel, il existe des lignes d'écoute et des services de santé mentale qui peuvent vous aider.",French,0
20,"Quels sont les critères pour être éligible à la PrEP en France, surtout pour quelqu'un ayant des douleurs chroniques comme moi ?","En France, la PrEP est accessible aux personnes à risque élevé de contracter le VIH. Les critères d'éligibilité incluent un test VIH négatif récent, l'absence de maladies sexuellement transmissibles et une évaluation de votre risque, qui peut tenir compte de votre situation personnelle, y compris des douleurs chroniques. 

Il est important de discuter de vos préoccupations et de vos besoins avec un professionnel de santé qui peut vous offrir un soutien adapté. N’oubliez pas que des ressources existent pour vous aider à surmonter les stigmates et à prendre soin de votre santé, même avec des douleurs chroniques. Vous méritez un accès aux soins sans jugement.",French,0
21,quelles ressource ou i mean options de soutien existen ;our les persones 50uffr47n de douleurs chroniques qui wouhaitent accéder à la PrEP en France ? 🙄,"En France, plusieurs ressources peuvent vous aider à accéder à la PrEP tout en gérant la douleur chronique. Vous pouvez consulter des centres de santé sexuelle où des professionnels sont formés pour vous accompagner dans votre parcours. Les associations comme AIDES ou Le Planning Familial offrent également des conseils et du soutien. 

N’hésitez pas à parler de vos appréhensions et de votre douleur avec un professionnel de santé, qui peut vous orienter vers des solutions adaptées. Si vous ressentez le besoin d'un soutien émotionnel, des psychologues ou des groupes de soutien peuvent également être bénéfiques pour aborder le stigma et vos préoccupations. Prenez soin de vous.",French,1
22,Comment puis-je aborder la question de la PrEP avec mon médecin tout en lui parlant de ma douleur chronique ?,"Il est tout à fait normal de se sentir préoccupée par la façon d'aborder ce sujet. Vous pourriez commencer par expliquer à votre médecin comment votre douleur chronique affecte votre quotidien et votre capacité à accéder aux soins. Ensuite, mentionnez votre intérêt pour la PrEP, en soulignant son importance pour votre santé sexuelle. N'hésitez pas à poser des questions sur les options, comme la PrEP orale ou injectable, pour voir ce qui vous conviendrait le mieux. Votre santé et votre bien-être sont prioritaires, et un bon médecin comprendra vos préoccupations. Si vous ressentez des émotions difficiles, envisagez de parler à un professionnel de la santé mentale pour obtenir du soutien supplémentaire.",French,0
23,Quelles ressources ou organisations peuvent m'aider à obtenir des informations sur la PrEP tout en tenant compte de ma douleur chronique ?,"Il existe plusieurs ressources qui peuvent vous aider à obtenir des informations sur la PrEP tout en tenant compte de votre douleur chronique. Vous pouvez consulter des organisations comme AIDES ou le Centre de lutte contre le sida, qui offrent des conseils et un soutien adaptés. Les professionnels de santé spécialisés dans la santé sexuelle peuvent également vous orienter vers des solutions qui prennent en compte votre situation. N'hésitez pas à aborder vos préoccupations concernant la douleur et la stigmatisation ; des ressources en santé mentale, comme SOS Suicide ou des groupes de soutien locaux, peuvent offrir une écoute et un soutien précieux. Vous n'êtes pas seule dans ce parcours.",French,0
24,comemnt puis-je trouevr un médecin qui ocmprend ma situation et qui petu m'aider à accéder à l4 PrEP ?,"Il est important de trouver un professionnel de santé qui comprend vos besoins et votre situation. Vous pouvez commencer par consulter votre médecin généraliste, qui pourra vous orienter vers un spécialiste en santé sexuelle ou un centre de santé communautaire. Il existe aussi des lignes d'assistance téléphonique ou des sites internet dédiés à la santé sexuelle qui peuvent vous aider à localiser des médecins sensibilisés à la PrEP. N'hésitez pas à exprimer vos préoccupations concernant la douleur chronique et la stigmatisation. Vous méritez un soutien adapté. Si vous ressentez le besoin de parler de vos émotions, envisager de consulter un professionnel de la santé mentale peut aussi être bénéfique.",French,1
25,Quelles sont les ressources disponibles en France pour les personnes vivant avec une douleur chronique qui souhaitent accéder à la PrEP ?,"En France, il existe plusieurs ressources pour les personnes vivant avec une douleur chronique et souhaitant accéder à la PrEP. Vous pouvez vous adresser à des centres de santé sexuelle ou des consultations spécialisées en VIH, qui offrent des informations et un soutien. De plus, des associations comme AIDES et le Planning Familial peuvent vous aider à naviguer dans le système de santé et à discuter de vos préoccupations.

N'hésitez pas à parler de votre douleur chronique lors de vos consultations, car les professionnels de santé sont là pour vous soutenir sans jugement. Si vous ressentez le besoin de parler de vos émotions ou de la stigmatisation, envisagez de contacter un professionnel de la santé mentale.",French,0
26,Comment puis-je aborder le sujet de ma douleur chronique avec un professionnel de santé lorsqu'il s'agit de discuter de la PrEP ?,"Il est important d'aborder votre douleur chronique avec un professionnel de santé de manière ouverte et honnête. Vous pouvez commencer par expliquer comment cette douleur impacte votre quotidien et votre capacité à accéder aux soins, y compris la PrEP. Mentionnez vos préoccupations concernant la stigmatisation et comment cela pourrait affecter votre santé sexuelle. Un bon professionnel de santé comprendra et sera là pour vous soutenir. N’hésitez pas à poser des questions sur les options de PrEP, qu'elles soient orales ou injectables, et sur la manière dont elles peuvent s'intégrer dans votre routine. Si nécessaire, envisagez de consulter un professionnel de la santé mentale pour vous aider à gérer ces émotions complexes.",French,0
27,quels sonr les centres de santé en France qui offretn la PrEP et qui sont 53n51ble5 aux besoins des personnes souffrant de douleur chronique ? 💀,"En France, de nombreux centres de santé proposent la PrEP, notamment les Centres de santé sexuelle (CSS), les hôpitaux et certaines cliniques. Il est important de trouver un lieu qui comprend vos besoins spécifiques liés à la douleur chronique. Vous pouvez consulter le site web de l'ANRS ou de Sida Info Service pour des informations sur les centres près de chez vous. N'hésitez pas à appeler à l'avance pour discuter de vos préoccupations. Si vous ressentez de la stigmatisation ou des émotions complexes, envisager de parler à un professionnel de santé mentale peut être bénéfique. Vous méritez de prendre soin de votre santé sans jugement.",French,1
28,comment puis-je aborder l4 question de la PrEP avec un professionnel de santé tout en exprimant mes préoccupations concernant ma douleur chronique ?,"Il est important d'être honnête et ouvert lors de votre conversation avec un professionnel de santé. Vous pourriez commencer par expliquer votre douleur chronique et comment elle impacte votre vie quotidienne. Mentionnez ensuite votre intérêt pour la PrEP et vos préoccupations à ce sujet. Cela permettra au professionnel de comprendre votre situation et de vous accompagner de manière adaptée. Vous pouvez aussi poser des questions sur les options, comme la PrEP orale ou injectable, et comment elles peuvent s'intégrer dans votre vie. N'hésitez pas à aborder vos craintes concernant la stigmatisation ; un bon professionnel de santé doit être là pour vous soutenir. Si besoin, des ressources de santé mentale peuvent également vous aider à gérer ces émotions.",French,1
29,q-quelles sonnnt les options pour accéder à la PrEP en Francr 51 j3 rencontre des difficultés à me déplacer à cauee de ma douldur chronique ? ?,"En France, vous avez plusieurs options pour accéder à la PrEP, même en cas de difficultés de déplacement. Vous pouvez demander une prescription à votre médecin traitant ou à un spécialiste en santé sexuelle. Il existe aussi des centres de santé ou des cliniques qui offrent des consultations à distance, ce qui pourrait faciliter l'accès à la PrEP. 

Concernant votre douleur chronique, n'hésitez pas à en parler à votre professionnel de santé, qui peut vous aider à trouver des solutions adaptées. Si vous ressentez de la stigmatisation ou de l'anxiété, envisager de parler à un professionnel de la santé mentale peut être bénéfique. Votre santé sexuelle est importante, et des ressources sont là pour vous soutenir.",French,1
