turn,user,bot,language,has_error
1,e-est-il courant de ressentir de k'4nx1é7é à l'idée d3 c0mm3ncer uh traitement comme la prep,"Il est tout à fait normal de ressentir de l'anxiété ou des craintes à l'idée de commencer un traitement comme la PrEP, surtout après un événement traumatisant. La PrEP, qu'elle soit orale ou injectable, est un outil efficace pour réduire le risque de contracter le VIH, mais il est essentiel de se sentir à l'aise avec votre décision. 

Si vous avez des préoccupations sur l'impact émotionnel de la PrEP sur votre santé mentale, je vous recommande d'en discuter avec un professionnel de la santé ou un thérapeute. Ils peuvent vous offrir un soutien et des conseils adaptés à votre situation. N'oubliez pas, vous n'êtes pas seule dans ce parcours.",French,1
2,quels sont les effets secondaires de lw PrEP like qui pourraienr affecter ma santé mentale et comment les gérer ❓,"Il est compréhensible de s'inquiéter des effets de la PrEP sur la santé mentale, surtout dans le cadre d'un TSPT. Les effets secondaires de la PrEP peuvent inclure des maux de tête, des nausées ou des troubles gastro-intestinaux, mais les effets sur la santé mentale sont généralement rares. Certaines personnes peuvent ressentir de l'anxiété ou des préoccupations face à la prise de médicaments. Il est essentiel de discuter de vos préoccupations avec un professionnel de la santé qui pourra vous aider à évaluer vos options et à trouver des solutions adaptées. Si vous ressentez un stress intense, envisagez de consulter un thérapeute ou un conseiller pour un soutien supplémentaire.",French,1
3,La PrEP peut-elle aggraver mes symptômes de TSPT ou provoquer des réactions émotionnelles inattendues,"Je comprends que vous ayez des inquiétudes concernant l'impact de la PrEP sur votre santé mentale, surtout après un événement traumatisant. La PrEP, qu'elle soit orale ou injectable, est généralement bien tolérée, mais chaque personne réagit différemment aux médicaments. Il est important de discuter de vos préoccupations avec un professionnel de la santé qui peut vous fournir des conseils adaptés à votre situation. 

Quant à la stigmatisation, sachez que de nombreuses personnes prennent la PrEP pour se protéger, et il existe des ressources et des communautés qui peuvent vous soutenir. N’hésitez pas à chercher de l'aide auprès de thérapeutes ou de groupes de soutien spécialisés. Votre santé mentale est importante.",French,1
4,Quels sont les effets secondaires possibles de la PrEP sur la santé mentale et comment puis-je les gérer ?,"La PrEP, qu'elle soit orale ou injectable, est généralement bien tolérée, mais certaines personnes peuvent ressentir des effets secondaires, notamment des troubles de l'humeur ou de l'anxiété. Il est important de discuter de vos préoccupations avec un professionnel de santé qui peut vous fournir des informations adaptées à votre situation. 

En ce qui concerne la gestion des effets sur la santé mentale, envisager un soutien psychologique peut être bénéfique. Des thérapeutes spécialisés peuvent vous aider à aborder vos peurs et vos préoccupations. N'oubliez pas que votre bien-être est une priorité, et il n'y a pas de honte à chercher de l'aide.",French,0
5,Comment puis-je trouver un professionnel de santé qui comprend mes préoccupations émotionnelles liées à la PrEP ?,"Il est important de trouver un professionnel de santé qui soit à l'écoute de vos préoccupations émotionnelles. Vous pouvez commencer par demander à votre médecin généraliste des recommandations. Cherchez des cliniques spécialisées en santé sexuelle ou des centres de santé communautaires qui offrent des services de PrEP, car ils sont souvent sensibilisés aux enjeux émotionnels et psychologiques. 

En outre, des lignes d'assistance téléphonique ou des groupes de soutien peuvent offrir des conseils et du soutien. N'hésitez pas à partager vos craintes concernant la PrEP et votre santé mentale, car un bon professionnel sera là pour vous accompagner sans jugement.",French,0
6,quels sont les effets secondaires se l4 PrEP qqqui pourraient affecter ma santé mentale ?,"La PrEP, qu'elle soit orale ou injectable, peut entraîner des effets secondaires, mais ceux-ci varient d'une personne à l'autre. Les effets secondaires courants incluent des nausées, des maux de tête et de la fatigue, qui peuvent influencer votre bien-être émotionnel. Bien que certains utilisateurs signalent des changements d'humeur, des études n'ont pas montré de lien direct entre la PrEP et des troubles de santé mentale. Il est important d'en parler avec un professionnel de santé qui peut vous guider dans ce processus et vous soutenir. Si vous ressentez de la stigmatisation ou des préoccupations émotionnelles, envisagez de consulter un thérapeute ou un groupe de soutien pour vous aider.",French,1
7,Est-ce que la prise de PrEP pourrait aggraver mes symptômes de TSPT ?,"Il est compréhensible de s'inquiéter de l'impact émotionnel de la PrEP, surtout dans le cadre d'un TSPT. La PrEP, qu'elle soit orale ou injectable, est généralement bien tolérée, mais chaque personne réagit différemment. Il est important de discuter de vos préoccupations avec un professionnel de santé qui peut vous fournir des informations adaptées à votre situation. Sachez également que le soutien psychologique, comme la thérapie, peut être bénéfique pour gérer vos émotions et réduire la stigmatisation. N'hésitez pas à demander de l'aide si vous en ressentez le besoin.",French,0
8,Quels sont les effets secondaires possibles de la PrEP et comment pourraient-ils influencer mon état mental ?,"La PrEP, qu'elle soit orale ou injectable, peut entraîner des effets secondaires comme des nausées, des maux de tête ou une fatigue, mais beaucoup de gens ne ressentent aucun effet indésirable. Concernant votre santé mentale, il est important de considérer que chaque personne réagit différemment aux médicaments. Si vous ressentez des inquiétudes spécifiques, cela pourrait être utile d'en parler avec un professionnel de santé qui comprend vos expériences. 

N'hésitez pas à chercher du soutien auprès de thérapeutes ou de groupes de parole pour gérer les émotions liées à votre situation. Vous méritez un espace sûr pour explorer ces préoccupations.",French,0
9,Est-ce que la prise de PrEP pourrait aggraver mes symptômes de TSPT ou provoquer des réactions émotionnelles inattendues ?,"Je comprends que vous soyez préoccupée par l'impact émotionnel de la PrEP sur votre santé mentale, surtout après un événement traumatisant. La PrEP, qu'elle soit orale ou injectable, est généralement bien tolérée, mais chaque personne réagit différemment. Certaines personnes peuvent ressentir des effets secondaires, mais cela dépend de chacun. Il est important de discuter de vos inquiétudes avec un professionnel de la santé qui peut vous fournir des informations spécifiques à votre situation. Concernant la stigmatisation, sachez que de nombreuses personnes choisissent la PrEP pour se protéger, et vous n'êtes pas seule dans ce choix. Si vous ressentez le besoin de soutien, envisagez de parler à un thérapeute ou à un groupe de soutien.",French,0
10,Quels sont les effets secondaires de la PrEP que je devrais surveiller en lien avec mon TSPT ?,"Il est compréhensible que vous ayez des inquiétudes concernant la PrEP et son impact sur votre santé mentale. Les effets secondaires courants de la PrEP, qu'elle soit orale ou injectable, incluent des nausées, des maux de tête et de la fatigue, mais chaque personne réagit différemment. Bien que la PrEP ne soit pas directement liée aux symptômes du TSPT, il est essentiel d’en discuter avec un professionnel de santé qui peut vous accompagner et vous rassurer. Concernant la stigmatisation, sachez que prendre soin de votre santé est une décision personnelle et importante. N'hésitez pas à consulter des ressources professionnelles pour discuter de vos préoccupations émotionnelles. Vous n'êtes pas seule dans ce parcours.",French,0
11,comment puis-je en prler à mob médecin pour qu'il comprenne mes craintes émotionnelles l1é35 à la PrPE,"Il est important d'aborder vos préoccupations avec votre médecin de manière ouverte. Vous pourriez commencer par expliquer que vous avez récemment été diagnostiquée avec un TSPT et que vous ressentez des craintes liées à la prise de médicaments, y compris la PrEP. Mentionnez spécifiquement vos inquiétudes sur les effets émotionnels potentiels et la stigmatisation. N’hésitez pas à partager comment ces préoccupations affectent votre bien-être quotidien. Votre médecin est là pour vous écouter et trouver des solutions adaptées à votre situation. Si vous ressentez le besoin d'un soutien supplémentaire, envisagez de consulter un professionnel de la santé mentale.",French,1
12,quels sont les effets s3c0ndaire5 émotionnels potentiels de la PrEP chez leees personnes aynat un TSPT ?,"Il est compréhensible d'être préoccupé par l'impact émotionnel de la PrEP, surtout avec un TSPT. Bien que la PrEP soit généralement bien tolérée, certaines personnes peuvent ressentir des effets émotionnels comme l'anxiété ou des variations d'humeur, mais ces effets varient d'une personne à l'autre. Il est essentiel de discuter de vos préoccupations avec un professionnel de santé qui peut vous fournir des conseils adaptés à votre situation. Vous pourriez également envisager de rechercher un soutien psychologique pour gérer votre TSPT et vos craintes concernant la médication. N'oubliez pas que choisir la prévention est une décision personnelle et que vous méritez d'être soutenue sans jugement.",French,1
13,La PrEP pourrait-elle aggraver mes symptômes de TSPT ou affecter ma santé mentale de manière inattendue ?,"Il est compréhensible d'avoir des inquiétudes concernant l'impact de la PrEP sur votre santé mentale, surtout après un événement traumatisant. La PrEP, qu'elle soit orale ou injectable, est conçue pour prévenir l'infection par le VIH, et la plupart des personnes ne ressentent pas d'effets secondaires graves. Cependant, chacun réagit différemment aux médicaments, et il est important de discuter de vos préoccupations avec un professionnel de santé qui connaît votre situation. En ce qui concerne la stigmatisation, sachez que vous n'êtes pas seule, et il existe des ressources et des groupes de soutien qui peuvent vous aider. Vous méritez de vous sentir soutenue et en sécurité dans vos choix de santé.",French,0
14,quels pr0fe5si0nn3l5 de santé puis-je you know consulter puor discuter de l'impact émotionnel potentiel de la prep sur mon tspt ?,"Il est important de discuter de vos préoccupations avec des professionnels de santé qualifiés. Vous pouvez consulter un médecin généraliste, un psychologue ou un psychiatre qui a de l'expérience dans la santé sexuelle et les troubles de santé mentale. Ces professionnels peuvent vous aider à comprendre comment la PrEP pourrait interagir avec votre TSPT et vous soutenir dans votre parcours. N'hésitez pas à exprimer vos craintes et à poser des questions. Vous méritez un soutien empathique et sans jugement. Si nécessaire, des groupes de soutien ou des lignes d'écoute peuvent également offrir un espace pour partager vos préoccupations.",French,1
15,La PrEP a-t-elle des effets secondaires qui pourraient aggraver mon TSPT ou affecter ma santé mentale ?,"La PrEP, qu'elle soit orale ou injectable, peut avoir des effets secondaires, mais ceux-ci varient d'une personne à l'autre. Certaines personnes rapportent des nausées ou des maux de tête, mais il n'existe pas de lien direct démontré entre la PrEP et l'aggravation des symptômes du TSPT. Il est compréhensible d'avoir des préoccupations concernant l'impact émotionnel des médicaments. Si vous ressentez de l'anxiété ou de la peur, je vous encourage à en parler avec un professionnel de santé ou un thérapeute, qui peut vous donner des conseils adaptés à votre situation. Rappelez-vous que votre santé mentale est importante et qu'il existe des ressources pour vous soutenir.",French,0
16,Comment puis-je aborder le sujet de la PrEP avec mon médecin sans me sentir jugée ?,"Il est normal de se sentir nerveuse à l'idée d'aborder la PrEP avec votre médecin, mais sachez que les professionnels de santé sont là pour vous soutenir, pas pour vous juger. Vous pourriez commencer par expliquer vos préoccupations concernant la prévention du VIH et comment elles s'inscrivent dans votre état de santé général. Posez des questions sur les options de PrEP, qu'il s'agisse des formes orales ou injectables, et exprimez vos inquiétudes concernant votre santé mentale. N'hésitez pas à demander des recommandations pour des ressources de soutien si vous ressentez le besoin d'en parler plus. Vous méritez un espace sûr pour discuter de vos choix.",French,0
17,quels sont you know les fefets secondaires de la prep sur la santé mentale et comment puis-je les géfer 🤔 🤔,"La PrEP, qu'elle soit orale ou injectable, est généralement bien tolérée, mais certaines personnes peuvent ressentir des effets secondaires, notamment des troubles d'humeur ou de l'anxiété. Chaque individu réagit différemment, et il est important d'en discuter avec un professionnel de santé qui peut vous guider.

Pour gérer vos inquiétudes, envisagez de parler à un thérapeute ou à un conseiller qui peut vous aider à naviguer à travers vos émotions. N'oubliez pas que la stigmatisation autour de la PrEP existe, mais de plus en plus de personnes la choisissent pour se protéger. Vous méritez un soutien et des informations claires.",French,1
18,c-comment puis-je trouver like un professionnel ds santé qui c0mpr3n3 mes préoccupations concernant la PrEP et la santé m3n4le m3n4le,"Il est important de trouver un professionnel de santé qui comprend vos préoccupations. Vous pouvez essayer les options suivantes :

1. **Consulter votre médecin généraliste** : Ils peuvent vous orienter vers un spécialiste en santé mentale ou un expert en prévention du VIH.
2. **Chercher des centres de santé communautaires** : Beaucoup offrent des services spécifiques pour les personnes vivant avec le TSPT et qui s'intéressent à la PrEP.
3. **Groupes de soutien** : Rejoindre des groupes en ligne ou en personne peut vous aider à partager vos préoccupations et à trouver des recommandations.

N'hésitez pas à exprimer vos besoins et vos craintes lors de vos rendez-vous. Votre bien-être émotionnel est important.",French,1
19,q-quels like sont les effets secondaires potentiels de la PrEl sur la saté mentale qu3 je devrais cnnaître ?,"Il est compréhensible d'avoir des inquiétudes concernant la PrEP et son impact sur la santé mentale, surtout dans le contexte d'un TSPT. Les effets secondaires de la PrEP, qu'elle soit orale ou injectable, peuvent inclure des nausées, des maux de tête ou de la fatigue, mais des études ne montrent pas d'impact direct significatif sur la santé mentale. 

C'est important de discuter de ces préoccupations avec un professionnel de la santé, qui peut vous fournir des informations adaptées à votre situation. N'oubliez pas qu'il existe des ressources pour vous soutenir dans votre santé mentale, comme des thérapeutes spécialisés. Vous méritez un soutien bienveillant et informé.",French,1
20,e-est-ce que parlr de ja prise de PrEP avec mooon 7hérap3ut3 pourrait m'aider à moeux gérer mee préoccupations émotionnelles ? ?,"Oui, discuter de la prise de PrEP avec votre thérapeute peut être très bénéfique. Ils peuvent vous aider à explorer vos préoccupations émotionnelles et à comprendre comment la PrEP pourrait s'intégrer dans votre vie. Cela peut également vous aider à réduire la peur et l'anxiété liées à la prise de médicaments. En ce qui concerne la stigmatisation, il est normal d'avoir des inquiétudes, mais votre santé et votre bien-être doivent passer en premier. N’hésitez pas à partager vos sentiments avec des professionnels qui peuvent vous apporter soutien et conseils adaptés. Vous n'êtes pas seule dans ce processus.",French,1
21,quels sont les effets secodnaires de la PrEP qii pourraient affecter ma santé mentale ?,"La PrEP, qu'elle soit orale ou injectable, est généralement bien tolérée. Les effets secondaires les plus courants incluent des problèmes gastro-intestinaux, des maux de tête et de la fatigue. Bien que des effets sur la santé mentale ne soient pas couramment signalés, les réactions peuvent varier d'une personne à l'autre. Il est normal d'avoir des préoccupations, surtout après un traumatisme. Si vous ressentez une anxiété ou des effets émotionnels, il peut être utile d'en parler à un professionnel de santé ou à un thérapeute qui peut vous soutenir. N'oubliez pas que vous méritez de vous sentir bien et en sécurité dans votre choix de prévention.",French,1
22,cmoment puis-je savoir si la Pr3P est le bon choix pour moi sns aggravdr mon TSPT ‼️,"Il est compréhensible de se sentir inquiet à propos de la PrEP et de ses effets sur votre santé mentale, surtout après un événement traumatisant. La PrEP, qu'elle soit orale ou injectable, est une méthode préventive efficace contre le VIH. Il est important de discuter de vos préoccupations avec un professionnel de santé qui peut évaluer votre situation personnelle, vos symptômes de TSPT et vous aider à prendre une décision éclairée. Concernant la stigmatisation, sachez que choisir la PrEP est une démarche proactive pour votre santé. Vous n'êtes pas seule, et il existe des ressources, comme des groupes de soutien, pour vous accompagner. Votre bien-être est essentiel.",French,1
23,qu3ll3s stratégies puis-je adopter pour i mean gérer moh anxiété liée à la prise de PrEP tout en respectant m4 santé mentale,"Il est tout à fait normal de ressentir de l'anxiété face à la prise de médicaments, surtout après un événement traumatisant. Pour gérer votre anxiété, envisagez les stratégies suivantes : 

1. **Éducation** : Informez-vous sur la PrEP, tant orale qu'injectable. Cela peut réduire l'incertitude.
2. **Support** : Parlez de vos préoccupations avec un professionnel de la santé ou un thérapeute. Ils peuvent vous aider à naviguer vos sentiments.
3. **Groupes de soutien** : Rejoindre un groupe peut réduire le sentiment de stigmatisation et vous connecter à d'autres personnes partageant des expériences similaires.
4. **Pratiques de relaxation** : Des exercices de respiration, la méditation ou le yoga peuvent aider à apaiser l'anxiété.

N'hésitez pas à chercher des ressources professionnelles pour vous soutenir.",French,1
24,La PrEP peut-elle réellement affecter mes émotions ou mon humeur de manière significative ?,"La PrEP, qu'elle soit orale ou injectable, est généralement bien tolérée par la plupart des personnes. Cependant, certaines personnes peuvent ressentir des effets secondaires, qui peuvent inclure des changements d'humeur, bien que cela ne soit pas commun. Il est important de discuter de vos préoccupations avec un professionnel de la santé qui pourra vous fournir des informations adaptées à votre situation. 

Concernant la stigmatisation, sachez que de nombreuses personnes prennent la PrEP pour se protéger et qu'il existe des communautés de soutien pour partager vos expériences. N'hésitez pas à consulter des ressources professionnelles pour votre santé mentale, cela peut vraiment aider. Vous n'êtes pas seule dans ce parcours.",French,0
25,queks sont les moyens de minimiser les effets émotionnels négatifs potentiels d3 la prep sur ma santé mentale ?,"Il est compréhensible d'avoir des inquiétudes concernant l'impact émotionnel de la PrEP, surtout dans le cadre d'un TSPT. Pour minimiser ces effets, il est important de rester informée et de discuter ouvertement de vos préoccupations avec un professionnel de la santé. Ils peuvent vous fournir des informations précises sur les effets secondaires, tant physiques qu'émotionnels. 

Entourez-vous de soutien, que ce soit des amis, de la famille ou des groupes de soutien. Enfin, n'hésitez pas à consulter un thérapeute qui peut vous aider à gérer vos émotions et vos peurs liées à la prise de médicaments. Vous n'êtes pas seule dans ce parcours.",French,1
26,est-ce que la prep peut aggraver mes symptômes de tspt ou provoquer des effets secondaires émotionnels supplémentaires,"Il est compréhensible d’avoir des préoccupations concernant la PrEP et votre santé mentale, surtout après un événement traumatisant. La PrEP, qu'elle soit orale ou injectable, est généralement bien tolérée, mais certaines personnes peuvent ressentir des effets secondaires. Il est important de discuter de vos inquiétudes spécifiques avec un professionnel de la santé qui peut vous fournir des informations personnalisées et un soutien adapté. En ce qui concerne la stigmatisation, rappelez-vous que la prévention est un choix important pour votre santé. Si vous ressentez le besoin de parler de vos émotions, envisagez de consulter un thérapeute spécialisé dans les traumatismes. Vous méritez du soutien et de l'écoute.",French,1
27,Comment puis-je trouver un professionnel de la santé qui comprenne mes préoccupations liées à la PrEP et au TSPT ?,"Pour trouver un professionnel de la santé qui comprend vos préoccupations liées à la PrEP et au TSPT, vous pouvez commencer par contacter des cliniques spécialisées en santé sexuelle ou en santé mentale. Cherchez des professionnels qui ont de l'expérience avec la PrEP et qui sont formés à la gestion des traumatismes. Les associations locales sur le VIH ou les groupes de soutien peuvent également recommander des médecins ou des thérapeutes sensibles à ces questions. N'hésitez pas à poser des questions lors de la prise de rendez-vous pour vous assurer que vous vous sentez à l'aise. Votre bien-être émotionnel est important et il existe des ressources pour vous soutenir.",French,0
28,La PrEP peut-elle aggraver mes symptômes de TSPT ou affecter ma santé mentale d'une manière que je devrais craindre ?,"Il est compréhensible d'avoir des préoccupations concernant la PrEP et ses effets potentiels sur votre santé mentale, surtout après avoir été diagnostiquée avec un TSPT. En général, la PrEP, qu'elle soit orale ou injectable, est bien tolérée et n'est pas connue pour aggraver les symptômes de troubles mentaux. Cependant, chaque personne réagit différemment. Il est essentiel de discuter de vos préoccupations avec un professionnel de la santé qui pourra vous fournir un soutien adapté et des recommandations. Vous n'êtes pas seule dans ce parcours, et il existe des ressources pour vous aider à gérer le stress et l'anxiété.",French,0
29,Y a-t-il des études ou des témoignages de personnes ayant pris la PrEP qui partagent leurs expériences sur l'impact émotionnel ?,"Oui, il existe des études et des témoignages de personnes ayant pris la PrEP qui abordent l'impact émotionnel. Beaucoup rapportent que la PrEP leur a apporté une plus grande tranquillité d'esprit et un sentiment de contrôle concernant leur santé sexuelle, ce qui peut contribuer positivement à leur bien-être mental. Cependant, certaines personnes expriment des préoccupations ou des effets secondaires émotionnels, soulignant l'importance d'en discuter avec des professionnels de santé. Si vous ressentez de l'anxiété ou de la peur, il peut être utile de parler à un thérapeute ou à un professionnel de santé mental pour obtenir du soutien. N'oubliez pas que chaque expérience est unique.",French,0
30,Quels sont les effets secondaires émotionnels possibles de la PrEP que je devrais surveiller ?,"Il est important de savoir que la PrEP (profilaxie pré-exposition), qu'elle soit prise par voie orale ou injectable, est généralement bien tolérée. Cependant, certaines personnes peuvent ressentir des effets émotionnels tels que l'anxiété ou des variations d'humeur. Ces effets peuvent varier d'une personne à l'autre. Si vous ressentez des symptômes qui affectent votre santé mentale, il est essentiel d'en parler à un professionnel de santé qui pourra vous accompagner. Vous n'êtes pas seule dans ce processus, et il existe des ressources et des soutiens pour vous aider à gérer vos préoccupations et à faire face à la stigmatisation.",French,0
