turn,user,bot,language,has_error
1,y a-t-il dws témkignages de personnes dans ma situation um qui ont trouvé la PrEP bbbénéfique 😕,"Il existe des témoignages de personnes vivant avec des conditions médicales chroniques, comme la sclérose en plaques, qui ont trouvé la PrEP bénéfique pour leur santé sexuelle. Beaucoup d'entre elles soulignent l'importance de consulter leur médecin pour discuter des interactions possibles avec leurs traitements. La PrEP, qu'elle soit orale ou injectable, peut être adaptée à vos besoins. 

Il est compréhensible de ressentir de l'anxiété face à ces décisions. Si vous avez des préoccupations sur la stigmatisation ou votre santé mentale, envisagez de parler à un professionnel de la santé ou à un conseiller qui peut vous offrir un soutien. Vous n'êtes pas seule dans ce parcours.",French,0
2,Quels sont les effets secondaires de la PrEP qui pourraient interagir avec mes médicaments pour la sclérose en plaques ?,"Il est compréhensible d'être inquiet concernant les interactions potentielles entre la PrEP et vos médicaments pour la sclérose en plaques. Les effets secondaires de la PrEP peuvent inclure des nausées, des maux de tête ou des problèmes gastro-intestinaux, mais la plupart des gens ne rencontrent pas d'effets graves. Il est essentiel de discuter avec un professionnel de la santé qui connaît bien votre situation pour évaluer les interactions possibles avec vos traitements actuels. Si vous ressentez de l'anxiété ou de la stigmatisation, n'hésitez pas à chercher un soutien émotionnel. Des ressources comme des groupes de soutien ou des conseillers en santé peuvent être très utiles.",French,0
3,Comment puis-je aborder le sujet de la PrEP avec mon médecin tout en lui expliquant ma situation avec la sclérose en plaques ?,"Il est important d'aborder ce sujet ouvertement avec votre médecin. Vous pourriez commencer par expliquer votre diagnostic de sclérose en plaques et vos préoccupations concernant les interactions possibles avec vos traitements actuels. Posez des questions sur la PrEP, en mentionnant à la fois les options orales et injectables, et comment elles pourraient s’intégrer à votre plan de soins. N’hésitez pas à exprimer vos craintes concernant les effets secondaires et la stigmatisation. Votre médecin est là pour vous aider et peut vous fournir des informations précises et des conseils adaptés à votre situation unique. Si vous ressentez de l'anxiété, pensez à consulter un professionnel de la santé mentale pour un soutien supplémentaire.",French,0
4,quels son7 les eff3t5 secondaires possiblesss ee laaa prep qui pourraient 1n7erag1r avec mes traitements plur la sclérose en pl4qu35 ?,"La PrEP, qu'elle soit orale ou injectable, peut avoir des effets secondaires, mais ceux-ci varient d'une personne à l'autre. Les effets secondaires courants incluent des nausées, des maux de tête et de la fatigue, mais ils sont souvent temporaires. Concernant l'interaction avec vos traitements pour la sclérose en plaques, il est essentiel de discuter de vos préoccupations avec un professionnel de santé. Ils pourront vous fournir des conseils adaptés à votre situation spécifique. 

N'hésitez pas à vous adresser à un médecin ou un pharmacien pour obtenir des informations précises et rassurantes. Votre santé mentale est également importante, alors si vous ressentez de l'anxiété, envisagez de consulter un professionnel.",French,1
5,Comment puis-je savoir si la PrEP est sûre pour moi en tenant compte de ma sclérose en plaques ?,"Il est compréhensible de vous sentir anxieuse à propos de la PrEP, surtout en tenant compte de votre sclérose en plaques. La PrEP, qu'elle soit orale ou injectable, est généralement considérée comme sûre pour de nombreuses personnes, mais il est essentiel de discuter de vos préoccupations avec un professionnel de la santé qui connaît bien votre état. Ils pourront vous donner des informations sur les interactions possibles avec vos traitements actuels et évaluer votre situation spécifique. N'hésitez pas à poser des questions sur les effets secondaires et l'accès aux soins. Votre santé mentale est tout aussi importante, alors envisagez de parler à un professionnel si vous ressentez du stress ou de l'anxiété.",French,0
6,quels effets secondaires de la PrEP devrais-je surveiller surtout en lien avec mes mdéicaments pour la sclérose en plaques,"La PrEP, qu'elle soit orale ou injectable, est généralement bien tolérée, mais comme tout médicament, elle peut avoir des effets secondaires. Les plus fréquents incluent des nausées, des maux de tête et des douleurs abdominales. En ce qui concerne vos traitements pour la sclérose en plaques, il est crucial de discuter avec votre médecin ou un spécialiste de la santé qui connaît votre dossier médical. Ils pourront vous fournir des informations spécifiques sur les interactions potentielles et vous aider à évaluer les risques. N'oubliez pas que vos préoccupations sont valables, et il est important de se sentir à l'aise avec vos choix de santé.",French,1
7,like comment la prep pourrait-elle affecter l'efficacité de mes médicaments pour la sclérose en plaques ?,"Il est compréhensible de vous soucier de l'interaction entre la PrEP et vos médicaments pour la sclérose en plaques. La PrEP, qu'elle soit orale ou injectable, est généralement bien tolérée, mais chaque personne est différente. Les interactions médicamenteuses dépendent de nombreux facteurs, y compris les médicaments spécifiques que vous prenez. Il est donc essentiel de discuter de vos préoccupations avec votre médecin ou un spécialiste des soins de santé. Ils pourront vous fournir des informations précises et adaptées à votre situation. Si vous ressentez de l'anxiété ou de la stigmatisation, n'hésitez pas à contacter un professionnel de la santé mentale pour un soutien supplémentaire.",French,1
8,quels sont les effets secondaires possibles d3 la PrP que je devrais surveiller ?,"Les effets secondaires de la PrEP peuvent varier d'une personne à l'autre, mais certains des plus courants incluent des nausées, des maux de tête, de la fatigue et des douleurs abdominales. Ces effets sont souvent temporaires et s'estompent avec le temps. Il est également important de surveiller des changements dans la fonction rénale, surtout si vous prenez d'autres médicaments, comme ceux pour la sclérose en plaques. N'hésitez pas à discuter de vos préoccupations avec un professionnel de santé qui peut vous fournir des conseils adaptés à votre situation. Si vous ressentez de l'anxiété ou des inquiétudes liées à la stigmatisation, sachez qu'il existe des ressources pour vous soutenir.",French,1
9,"comment pu15-je m'assurer que l4 PrEP n'interfère pas avec ,es médicaments pour l4 sclérose en plaqqques ?","Il est compréhensible de vous inquiéter des interactions potentielles entre la PrEP et vos médicaments pour la sclérose en plaques. La meilleure façon de vous assurer que la PrEP ne nuira pas à votre santé est de consulter votre médecin ou un spécialiste en santé. Ils pourront évaluer vos traitements actuels et vous donner des conseils personnalisés. 

La PrEP est disponible sous forme orale et injectable, et votre professionnel de santé pourra vous expliquer les deux options. N'oubliez pas que vos préoccupations sont valables, et vous méritez un soutien. Si vous ressentez de l'anxiété ou du stress, envisager de parler à un professionnel de la santé mentale pourrait également vous aider.",French,1
10,Quels sont les effets secondaires de la PrEP qui pourraient m'inquiéter en tenant compte de ma sclérose en plaques ?,"Il est compréhensible d'avoir des inquiétudes concernant les effets secondaires de la PrEP, surtout en lien avec votre sclérose en plaques. Les effets secondaires courants de la PrEP orale incluent des nausées, des maux de tête ou des douleurs abdominales, mais ils varient d'une personne à l'autre. Pour la PrEP injectable, les effets peuvent inclure douleur au site d'injection ou fatigue. 

Étant donné vos médicaments pour la sclérose en plaques, il est crucial de discuter de vos préoccupations avec un professionnel de santé qui connaît bien votre situation. Ils pourront vous aider à évaluer les interactions potentielles et à prendre une décision éclairée. N'hésitez pas à leur poser toutes vos questions.",French,0
11,comment puis-je m'assurer que la PrEP n'1n73rfèr3 pas avec mes i mean traitements pou la sclérose en pl4que5 pl4que5,"Il est compréhensible d'avoir des préoccupations concernant les interactions entre la PrEP et vos traitements pour la sclérose en plaques. La PrEP, qu'elle soit orale ou injectable, est généralement bien tolérée, mais il est essentiel de consulter un professionnel de santé. Ils peuvent évaluer vos médicaments actuels et vous conseiller sur les éventuelles interactions.

N'oubliez pas que votre santé mentale est tout aussi importante. Si vous ressentez de l'anxiété ou de la stigmatisation, envisagez de parler à un professionnel qui peut vous soutenir. Des ressources sont disponibles pour vous aider à naviguer dans ces préoccupations.",French,1
12,quelles interactions 5pécifiqu35 devrais-je surveiller entre la PrEP et mes médic4m3n75 pour la sclérose en plaques ? ?,"Il est compréhensible d'être préoccupée par les interactions entre la PrEP et vos traitements pour la sclérose en plaques. Les interactions peuvent varier en fonction des médicaments spécifiques que vous prenez. Il est essentiel de discuter de ces préoccupations avec votre médecin ou un spécialiste en santé, qui pourra évaluer vos traitements et vous fournir des conseils personnalisés.

La PrEP, qu'elle soit orale ou injectable, est généralement bien tolérée, mais chaque personne réagit différemment. Votre professionnel de santé pourra également vous rassurer sur les effets secondaires potentiels et l'accès aux soins. N'hésitez pas à lui poser toutes vos questions pour vous sentir plus à l'aise.",French,1
13,q-quels sont les efets secondaires potentiels de la pr3p que js devrais connaître en tant que persssonne vivant avec la sclérose en plaques ✨,"La PrEP, qu'elle soit orale ou injectable, peut avoir des effets secondaires, bien que beaucoup de personnes ne ressentent rien. Les effets courants incluent des nausées, des douleurs abdominales, ou des maux de tête. Il est important de discuter de vos préoccupations spécifiques avec votre médecin, surtout en raison de la sclérose en plaques et des traitements que vous suivez, car chaque situation est unique. Cela peut aider à évaluer les interactions possibles et à trouver la meilleure option pour vous. Si vous ressentez de l'anxiété ou de la stigmatisation, envisagez de parler à un professionnel de la santé mentale pour obtenir un soutien supplémentaire.",French,1
14,Comment puis-je m'assurer que la PrEP n'interfère pas avec mes traitements pour la sclérose en plaques ?,"Il est important de discuter de vos préoccupations avec un professionnel de la santé, comme votre médecin ou un spécialiste en VIH. Ils pourront évaluer vos traitements actuels pour la sclérose en plaques et déterminer si la PrEP, qu'elle soit orale ou injectable, est une option sûre pour vous. Ils connaissent bien les interactions médicamenteuses potentielles et pourront vous fournir des conseils personnalisés. N'hésitez pas à exprimer vos inquiétudes concernant les effets secondaires ou la stigmatisation. Vous méritez de vous sentir soutenue et informée dans votre parcours de santé.",French,0
15,Quels sont les effets secondaires possibles de la PrEP que je devrais surveiller ?,"Les effets secondaires de la PrEP peuvent varier d'une personne à l'autre. Les plus courants incluent des nausées, des maux de tête, de la fatigue et des troubles gastro-intestinaux, qui tendent à diminuer avec le temps. Dans de rares cas, il peut y avoir des effets sur la fonction rénale. Il est important de discuter de vos préoccupations avec un professionnel de santé, notamment en ce qui concerne vos traitements pour la sclérose en plaques, afin de mieux comprendre les interactions potentielles. Si vous ressentez de l'anxiété ou du stress lié à ces sujets, envisagez de consulter un spécialiste en santé mentale pour obtenir du soutien.",French,0
16,omment la prep p0urr41t-3ll3 interagir avec mes méicaments pour p4 sclérose en pl4qu35,"Il est compréhensible de s’inquiéter des interactions entre la PrEP et vos médicaments pour la sclérose en plaques. Actuellement, il n’y a pas de données spécifiques sur les interactions entre la PrEP et les traitements pour la sclérose en plaques. Il est essentiel de discuter de vos préoccupations avec votre médecin ou un professionnel de la santé qui connaît bien votre histoire médicale. Ils pourront vous fournir des informations adaptées à votre situation. En ce qui concerne la stigmatisation, sachez que vous n'êtes pas seule et que des ressources sont disponibles pour vous soutenir. Prenez soin de vous et n’hésitez pas à poser toutes vos questions à votre médecin.",French,1
17,Quels sont les effets secondaires possibles de la PrEP que je devrais connaître ?,"Les effets secondaires de la PrEP, qu'elle soit orale ou injectable, peuvent varier. Certaines personnes peuvent ressentir des nausées, des maux de tête ou de la fatigue, surtout au début du traitement. En général, ces effets diminuent avec le temps. D'autres effets plus rares peuvent inclure des modifications de la fonction rénale. Il est important de discuter de vos préoccupations concernant la PrEP et son interaction avec vos médicaments pour la sclérose en plaques avec un professionnel de santé. Ils pourront vous fournir des informations adaptées à votre situation. N'hésitez pas à parler de vos inquiétudes, y compris celles liées à la stigmatisation. Vous n'êtes pas seule dans ce parcours.",French,0
18,Comment la PrEP pourrait-elle interagir avec mes médicaments pour la sclérose en plaques ?,"Il est compréhensible de s'inquiéter des interactions médicamenteuses. La PrEP, qu'elle soit orale ou injectable, est généralement bien tolérée, mais les interactions peuvent varier selon les médicaments. Il est important de discuter avec votre médecin ou votre pharmacien de vos traitements actuels pour la sclérose en plaques. Ils pourront vous fournir des informations spécifiques sur la compatibilité des médicaments et vous aider à évaluer les avantages et les risques potentiels. N'hésitez pas à aborder vos préoccupations avec eux, car ils sont là pour vous soutenir dans votre santé globale.",French,0
19,quels fefets secondaaaires de la PrEP devrais-je sssurveiller surtout 3n lien avec ma sclérose en plaques,"Il est compréhensible d'être préoccupée par les effets secondaires de la PrEP, surtout en lien avec la sclérose en plaques. Les effets secondaires courants de la PrEP orale peuvent inclure des nausées, des maux de tête et des troubles gastro-intestinaux, tandis que l'injection peut entraîner des douleurs au site d'injection. Chaque personne réagit différemment, et il est essentiel de discuter de vos préoccupations avec un professionnel de la santé qui connaît votre historique médical. Ils pourront évaluer les interactions potentielles avec vos traitements actuels. N'hésitez pas à chercher du soutien, car il est important de vous sentir à l'aise et informée dans ce processus.",French,1
20,La PrEP peut-elle interagir avec mes médicaments pour la sclérose en plaques ?,"Il est compréhensible d'être préoccupée par les interactions médicamenteuses. La PrEP, qu'elle soit orale ou injectable, peut avoir des interactions avec certains médicaments. Il est essentiel de discuter de vos traitements spécifiques pour la sclérose en plaques avec votre médecin ou un professionnel de santé qui connaît bien votre situation. Ils pourront vous donner des informations précises et adaptées à votre cas. N'hésitez pas à exprimer vos inquiétudes concernant la santé et la stigmatisation, car il existe des ressources professionnelles pour vous soutenir dans ce processus. Prenez soin de vous !",French,0
21,quels sont l35 effets secondaires possibles de la rPEP que j3 devrais connaître avant de commencer ?,"La PrEP, qu'elle soit orale ou injectable, peut avoir des effets secondaires. Les plus courants incluent des nausées, des douleurs abdominales, des maux de tête et de la fatigue. La plupart des effets secondaires sont légers et temporaires. Cependant, des effets rares mais plus graves, comme des problèmes rénaux ou des réactions allergiques, peuvent survenir. Il est important de discuter de votre situation spécifique, surtout en lien avec votre sclérose en plaques et vos médicaments, avec un professionnel de santé qui pourra vous donner des conseils adaptés à votre cas. N'hésitez pas à poser toutes vos questions et à exprimer vos préoccupations lors de votre consultation.",French,1
22,La PrEP pourrait-elle interagir avec mes médicaments pour la sclérose en plaques ?,"Je comprends vos préoccupations concernant les interactions entre la PrEP et vos médicaments pour la sclérose en plaques. La PrEP, qu'elle soit orale ou injectable, est généralement bien tolérée, mais chaque personne est différente. Il est essentiel de discuter de vos médicaments actuels avec un professionnel de santé qui connaît bien votre situation. Ils pourront vous donner des informations précises et rassurantes. N'hésitez pas à en parler, car votre santé et votre bien-être sont prioritaires. Si vous ressentez de l'anxiété à ce sujet, des ressources professionnelles peuvent également vous aider à faire face à ces sentiments.",French,0
23,Quels sont les effets secondaires possibles de la PrEP et comment puis-je les gérer ?,"La PrEP, qu'elle soit orale ou injectable, peut avoir des effets secondaires, bien que beaucoup de personnes ne ressentent rien. Les effets secondaires les plus courants incluent des nausées, des maux de tête ou des douleurs abdominales, souvent temporaires. Il est important de discuter de vos préoccupations avec un professionnel de santé, surtout en lien avec votre sclérose en plaques et vos traitements actuels. Ils pourront vous fournir des conseils adaptés à votre situation. Si vous avez des inquiétudes concernant la stigmatisation ou l'impact sur votre santé mentale, n'hésitez pas à chercher du soutien auprès de professionnels de la santé mentale ou de groupes de soutien. Vous méritez de vous sentir bien informée et soutenue.",French,0
24,La PrEP peut-elllle affecter l'efficacité you know de mes médicaments pour la sclérose eeen plaquuues ? ?,"Il est compréhensible de se préoccuper des interactions entre la PrEP et vos médicaments pour la sclérose en plaques. Actuellement, des études montrent que la PrEP, qu'elle soit orale ou injectable, est généralement bien tolérée et n'interfère pas avec les traitements pour la sclérose en plaques. Cependant, il est crucial de consulter un professionnel de santé qui connaît bien votre dossier médical pour discuter de vos préoccupations spécifiques. 

N'oubliez pas que vous n'êtes pas seule dans ce parcours, et des ressources sont disponibles pour vous soutenir dans vos inquiétudes et vous aider à prendre des décisions éclairées.",French,1
25,Quels effets secondaires potentiels de la PrEP devrais-je connaître en lien avec ma sclérose en plaques ?,"Il est compréhensible d'avoir des préoccupations concernant l'interaction entre la PrEP et vos traitements pour la sclérose en plaques. Les effets secondaires de la PrEP peuvent varier, mais ils incluent souvent des nausées, des maux de tête et des douleurs abdominales. Pour des personnes ayant des conditions médicales spécifiques, comme la sclérose en plaques, il est essentiel de discuter de ces préoccupations avec un médecin ou un spécialiste qui connaît bien votre situation. Ils pourront vous fournir des informations personnalisées et vous rassurer. N'oubliez pas que le soutien psychologique peut également être bénéfique si vous ressentez de l'anxiété à ce sujet.",French,0
26,sEt-ce que la PrEP pourrait interférer avec mes médicamemts pour l4 sclérose en plaques ?,"Il est compréhensible d'être préoccupée par l'interaction entre la PrEP et vos médicaments pour la sclérose en plaques. La PrEP, qu'elle soit orale ou injectable, est généralement bien tolérée, mais les interactions médicamenteuses peuvent varier d'une personne à l'autre. Il est essentiel d'en discuter avec votre médecin ou un professionnel de la santé qui connaît bien votre traitement actuel. Ils pourront vous fournir des conseils personnalisés et vous rassurer sur vos préoccupations. N'hésitez pas à poser toutes vos questions, car votre santé et votre bien-être sont prioritaires.",French,1
27,quels 3ff375 secondaires de a PrEP ddd3vr4i5-j3 surveiller surtout en lien avec ma sclérose en plaques,"Il est compréhensible d'être préoccupée par les effets secondaires de la PrEP, surtout en lien avec votre sclérose en plaques. Les effets secondaires les plus courants de la PrEP orale incluent des troubles gastro-intestinaux, des maux de tête et des changements dans la fonction rénale. Pour la PrEP injectable, les effets secondaires peuvent inclure des douleurs au site d'injection et des réactions allergiques.

Il est essentiel de discuter de vos préoccupations avec un professionnel de santé qui connaît votre situation médicale. Ils pourront vous fournir des conseils adaptés à votre état de santé. N’hésitez pas à poser des questions et à exprimer vos inquiétudes.",French,1
28,la PrEP pourrait-elle interférer avec mes méidcaments puor la sclérose en plaques ?,"Il est compréhensible d'avoir des préoccupations concernant les interactions entre la PrEP et vos médicaments pour la sclérose en plaques. La PrEP, qu'elle soit orale ou injectable, est généralement bien tolérée, mais chaque personne est différente. Il est essentiel de discuter de vos traitements actuels et de vos préoccupations avec votre médecin ou un spécialiste qui connaît bien votre situation. Ils pourront vous fournir des informations spécifiques sur les interactions possibles et vous aider à prendre une décision éclairée. N'oubliez pas que vos préoccupations sont valables et qu'il existe des ressources professionnelles pour vous soutenir dans ce processus.",French,1
29,Quels sont les effets secondaires potentiels de la PrEP que je devrais surveiller ?,"La PrEP, qu'elle soit orale ou injectable, est généralement bien tolérée, mais comme tout médicament, elle peut avoir des effets secondaires. Parmi les effets courants, on trouve des nausées, des maux de tête et des douleurs abdominales, surtout au début du traitement. Des effets plus rares, mais graves, peuvent inclure des problèmes rénaux ou des réactions allergiques. Il est important de discuter de vos préoccupations avec votre médecin, surtout en lien avec vos traitements pour la sclérose en plaques, afin d'évaluer les interactions potentielles. Si vous ressentez une anxiété ou une stigmatisation, n'hésitez pas à chercher du soutien professionnel pour vous aider à traverser ces sentiments.",French,0
30,l-la PrEP pourrait-elle interagir avec m3s médicaments pour la 5clér05e en plaques ? ✨,"Il est compréhensible de s'inquiéter des interactions entre la PrEP et d'autres médicaments, comme ceux pour la sclérose en plaques. La PrEP, qu'elle soit orale ou injectable, est généralement bien tolérée, mais chaque personne est différente. Il est essentiel de discuter de vos préoccupations avec un professionnel de la santé qui connaît bien votre historique médical et vos médicaments actuels. Ils pourront vous fournir des informations précises et vous aider à évaluer les risques et bénéfices. N'hésitez pas à poser des questions et à exprimer vos craintes, c'est important pour votre bien-être.",French,1
