turn,user,bot,language,has_error
1,comment parler à mon méd3cin de mes préoccupations concernant le PrEP,"C'est tout à fait normal d'avoir des préoccupations, surtout concernant un traitement comme le PrEP. Pour en parler à votre médecin, vous pourriez commencer par exprimer vos inquiétudes concernant les effets secondaires et votre anxiété. N'hésitez pas à poser des questions sur le fonctionnement du PrEP, les différentes options disponibles (orales et injectables) et les éventuels effets indésirables. Votre médecin est là pour vous écouter et vous soutenir, et il peut vous aider à clarifier vos doutes. Si vous ressentez le besoin de parler à un professionnel de la santé mentale à propos de votre anxiété, cela peut également être une bonne idée. Vous méritez de vous sentir à l'aise et soutenue dans vos décisions de santé.",French,1
2,Quels sont les effets secondaires les plus courants du PrEP et comment puis-je les gérer si je les ressens ?,"Les effets secondaires les plus courants du PrEP, qu'il soit oral ou injectable, incluent des nausées, des maux de tête et des douleurs abdominales. La plupart des effets secondaires sont légers et peuvent diminuer après quelques jours. Il est important de rester en contact avec un professionnel de santé qui peut vous guider sur la gestion de ces effets. 

Je comprends que ces préoccupations peuvent être anxiogènes. Pensez à parler de vos inquiétudes avec un médecin ou un conseiller en santé mentale, qui peut vous aider à traverser ces moments difficiles. Vous n'êtes pas seule dans ce processus.",French,0
3,Quelles sont les alternatives au PrEP si je suis trop anxieuse à l'idée de le prendre ?,"Il est compréhensible de se sentir anxieuse à propos du PrEP. Si vous hésitez à le prendre, d'autres options de prévention contre le VIH existent, comme les préservatifs, qui sont efficaces et ne nécessitent pas de traitement quotidien. De plus, le dépistage régulier et l'éducation sur le VIH peuvent renforcer votre sécurité. Vous pouvez également envisager de parler à un professionnel de la santé qui peut vous soutenir dans votre parcours et vous aider à gérer votre anxiété. N'oubliez pas que votre santé mentale est importante, et des ressources sont disponibles pour vous accompagner.",French,0
4,quels sont les eff37s secondzires courants du PrEP 37 comment les yérer ? ?,"Les effets secondaires courants du PrEP, qu'il soit oral ou injectable, peuvent inclure des nausées, des maux de tête, de la fatigue et des douleurs abdominales. Ces effets sont généralement temporaires et s'estompent souvent après quelques semaines. Pour gérer ces effets, il est conseillé de rester en contact avec un professionnel de santé qui peut offrir un soutien et des conseils adaptés. 

Si l'anxiété ou la peur des effets secondaires vous pèse, envisagez de parler à un thérapeute ou un conseiller qui peut vous aider à naviguer vos préoccupations. Vous n'êtes pas seule, et il existe des ressources pour vous soutenir dans votre parcours.",French,1
5,Comment puis-je trouver un professionnel de santé qui comprend mes préoccupations et peut m'aider à gérer mon anxiété concernant le PrEP ?,"Il est important de trouver un professionnel de santé avec qui vous vous sentez à l'aise. Vous pouvez commencer par rechercher des cliniques spécialisées en santé sexuelle ou en prévention du VIH, car elles sont souvent plus sensibles aux préoccupations des patients. Vous pouvez également demander des recommandations à des amis de confiance ou à des groupes de soutien en ligne. N’hésitez pas à poser des questions sur leur approche du PrEP et sur la façon dont ils gèrent l’anxiété des patients. Si vous ressentez le besoin d'un soutien supplémentaire, envisager de parler à un thérapeute peut également être bénéfique. Prenez soin de vous !",French,0
6,Quels 50nt lea effets secondaires courants du PrEP et comment pu15-j3 les gggérer si je déc1d3 de l'essayer ? ✨,"Les effets secondaires courants du PrEP peuvent inclure des nausées, des maux de tête, une fatigue et des douleurs abdominales. Ces symptômes sont souvent temporaires et peuvent s'atténuer avec le temps. Il est important de rester en contact avec un professionnel de la santé qui peut vous fournir des conseils adaptés et vous soutenir tout au long de votre expérience avec le PrEP. 

Si vous ressentez de l'anxiété ou de la peur liée à votre santé, envisager de parler à un professionnel de la santé mentale peut aussi être bénéfique. Ils peuvent vous aider à gérer ces sentiments et à prendre des décisions éclairées concernant votre santé. Vous n’êtes pas seule dans ce processus !",French,1
7,comment puisj-3 trouver un professionnel de la santé qui comprend mes préoccupations et peut m'a15er qvec e PrEP ❓,"Il est important de trouver un professionnel de la santé qui écoute vos préoccupations et vous soutienne. Vous pouvez commencer par rechercher des cliniques ou des centres de santé spécialisés dans la prévention du VIH et le PrEP. Les ressources en ligne, comme les sites de santé publique ou les associations locales, peuvent également vous orienter vers des praticiens compréhensifs. N'hésitez pas à poser des questions sur leur approche et leur expérience avec des patients ayant des préoccupations similaires. Si vous ressentez de l'anxiété, envisager de parler à un thérapeute ou un conseiller peut également vous aider à gérer ces émotions.",French,1
8,q-quela sssont les effets sefondaire les plus cour47n5 di PrEP et c0mm3n77t puis-je les gérer si je déciiie de commencer cs 7r4i73m3n7 ?,"Les effets secondaires du PrEP peuvent inclure des nausées, des maux de tête, de la fatigue ou des douleurs abdominales, mais beaucoup de gens ne ressentent pas d'effets indésirables majeurs. Ces symptômes tendent à diminuer avec le temps. Pour gérer ces effets, il est important de rester en contact avec un professionnel de santé qui peut vous soutenir et ajuster le traitement si nécessaire. Si vous ressentez de l'anxiété ou du stress à propos de votre santé, envisagez de parler à un conseiller ou à un thérapeute. Ils peuvent vous fournir un soutien précieux. Vous méritez de vous sentir bien et en sécurité dans vos choix de santé.",French,1
9,Comment puis-je trouver un médecin qui comprendra mes préoccupations et me soutiendra dans ma décision de commencer le PrEP ?,"Il est important de trouver un professionnel de santé avec qui vous vous sentez à l'aise. Vous pouvez commencer par demander des recommandations à des amis de confiance ou à des groupes de soutien locaux. De nombreux centres de santé communautaires et cliniques spécialisées dans la santé sexuelle offrent des services de PrEP et sont souvent sensibles aux préoccupations des patients. N'hésitez pas à poser des questions sur leur approche et leur expérience avec le PrEP lors de la prise de rendez-vous. Cela peut vous aider à vous sentir plus en sécurité et soutenue. Si l’anxiété persiste, envisagez de consulter un professionnel de la santé mentale.",French,0
10,Quels sont les effets secondaires les plus courants du PrEP et comment peuvent-ils être gérés ?,"Les effets secondaires du PrEP, qu'il soit oral ou injectable, peuvent inclure des nausées, des maux de tête et des douleurs abdominales, bien que beaucoup de personnes ne ressentent aucun effet secondaire. La plupart des effets secondaires sont légers et s'estompent généralement au fil du temps. Pour les gérer, il est utile de parler à un professionnel de la santé qui peut fournir des conseils personnalisés. 

Je comprends que l'anxiété et la peur peuvent rendre ces discussions difficiles. N'hésitez pas à rechercher des ressources ou un soutien professionnel pour vous aider à naviguer dans ces sentiments. Votre santé est importante, et vous méritez un soutien approprié.",French,0
11,Comment pu15-je trouver un professionnel d3 santé qu1 compeenne mes préoccup4710ns et me soutienne dana mz décisiooon ds prendre l3 PrEP ? ?,"Il est important de trouver un professionnel de santé qui écoute et respecte vos préoccupations. Vous pouvez commencer par demander des recommandations à des amis, des membres de votre famille ou des groupes de soutien. Recherchez des cliniques spécialisées dans la santé sexuelle ou le VIH, car elles sont souvent plus sensibilisées aux questions de stigmatisation et d’anxiété.

N’hésitez pas à poser des questions lors de votre première consultation pour voir si le professionnel vous convient. Si vous ressentez le besoin de soutien, envisager de consulter un psychologue ou un conseiller peut aussi vous aider à gérer votre anxiété. Vous méritez d’être soutenue dans votre parcours de santé.",French,1
12,Quels sont les effets secondaires courants du PrEP et comment puis-je les gérer si je décide de commencer le traitement ?,"Les effets secondaires courants du PrEP, qu'il soit oral ou injectable, incluent des nausées, des maux de tête et des douleurs abdominales. Ces effets sont souvent temporaires et peuvent s'estomper après quelques semaines. Pour les gérer, il est important de rester en contact avec un professionnel de santé qui peut vous soutenir et ajuster le traitement si nécessaire.

Si vous ressentez de l'anxiété ou de la peur à propos de votre santé, envisagez de parler avec un thérapeute ou un conseiller qui peut vous aider à naviguer ces émotions. N'oubliez pas que vous n'êtes pas seule et que des ressources sont disponibles pour vous soutenir.",French,0
13,Quelles sont les ressources disponibles pour m'aider à surmonter mon anxiété liée à la prise du PrEP ?,"Il existe plusieurs ressources pour vous aider à surmonter votre anxiété liée à la prise du PrEP. Vous pouvez envisager de consulter un professionnel de la santé mentale, comme un psychologue ou un thérapeute, qui peut vous offrir un espace sûr pour exprimer vos préoccupations. 

De plus, des groupes de soutien, en personne ou en ligne, peuvent être très utiles pour partager des expériences et recevoir du soutien de personnes ayant des préoccupations similaires. N'oubliez pas que parler à un professionnel de la santé concernant vos inquiétudes sur les effets secondaires du PrEP peut également vous apporter des informations rassurantes. Prenez soin de vous et avancez à votre rythme.",French,0
14,Quels sont les effets secondaires courants du PrEP et comment puis-je les gérer ?,"Les effets secondaires courants du PrEP, qu'il soit oral ou injectable, peuvent inclure des nausées, des maux de tête et de la fatigue, mais beaucoup de gens ne ressentent pas ces effets. Si vous en ressentez, il peut être utile de parler à un professionnel de la santé qui pourra vous aider à les gérer et à répondre à vos inquiétudes.

Il est normal d'avoir des appréhensions, surtout avec un trouble anxieux. Pensez à vous entourer de personnes de confiance ou à consulter un professionnel de la santé mentale pour obtenir un soutien supplémentaire. Vous méritez de vous sentir bien dans votre santé.",French,0
15,q-quelles 50nr les étapes à 5u1vr3 pour commencer le prep tout en gérant mon anxiété ?,"Commencer le PrEP peut sembler intimidant, mais il existe des étapes pour vous aider à gérer votre anxiété :

1. **Informez-vous** : Renseignez-vous sur le PrEP (oral et injectable). Comprendre son fonctionnement peut réduire l'incertitude.
2. **Parlez-en à un professionnel** : Prenez rendez-vous avec un médecin ou un conseiller en santé. Ils peuvent répondre à vos questions sans jugement.
3. **Établissez un réseau de soutien** : Parlez de vos inquiétudes à des amis ou à des groupes de soutien. Cela peut alléger le poids de votre anxiété.
4. **Planifiez des consultations** : Choisissez un moment où vous vous sentez calme pour discuter de votre santé.
5. **Pratiquez des techniques de gestion de l'anxiété** : Cela peut inclure la méditation, la respiration profonde, ou d'autres méthodes qui vous apaisent.

N'hésitez pas à chercher une aide professionnelle si vos sentiments deviennent trop lourds à gérer. Vous n'êtes pas seule dans ce processus.",French,1
16,Quels sont les effets secondaires courants du PrEP et comment peuvent-ils être gérés ?,"Les effets secondaires courants du PrEP, qu'il soit oral ou injectable, incluent des nausées, des maux de tête et des douleurs abdominales. Ces effets sont souvent temporaires et peuvent s'atténuer avec le temps. Pour les gérer, il est utile de discuter avec un professionnel de santé qui peut vous accompagner dans la prise de décision et ajuster le traitement si nécessaire. 

Il est normal de ressentir de l'anxiété à propos de votre santé. Si cela devient trop lourd, envisager de parler à un professionnel de la santé mentale peut vraiment aider. Vous méritez d'avoir des informations claires et un soutien adapté à vos besoins.",French,0
17,comment puis-je trouver un professionnel de santé qui comprenne mes préoccupations et m'aide à surmonter mon 4nx1é7é concernant le PrEP,"Il est important de trouver un professionnel de santé avec qui vous vous sentez à l'aise. Vous pouvez commencer par demander des recommandations à des amis de confiance, ou à des associations locales qui travaillent sur la santé sexuelle. Cherchez des cliniques spécialisées en santé LGBTQ+ ou en prévention du VIH, car elles sont souvent plus sensibles aux préoccupations liées au PrEP et à la santé mentale. N'hésitez pas à poser des questions sur leur approche et leur expérience avec des patients ayant des préoccupations similaires. Si vous ressentez le besoin d'un soutien supplémentaire, envisager de parler à un psychologue ou à un conseiller peut aussi être bénéfique.",French,1
18,Quels sont les effets secondaires courants du PrEP et comment puis-je les gérer si je les ressens ?,"Les effets secondaires courants du PrEP peuvent inclure des nausées, des maux de tête et des douleurs abdominales. Pour beaucoup de personnes, ces effets s'estompent après quelques semaines. Il est important de consulter un professionnel de santé pour discuter de vos préoccupations et envisager des solutions. Si vous ressentez une anxiété importante à propos de votre santé, il peut être utile de parler à un thérapeute ou à un conseiller. N'oubliez pas que vous n'êtes pas seule dans ce processus, et il existe des ressources pour vous aider à gérer votre anxiété et à prendre des décisions éclairées concernant votre santé.",French,0
19,Comment puis-je trouver un professionnel de santé qui comprenne jes pré0ccup4710n5 et soit b13nv31ll4n7 envers mes anxiétés ?,"Il est important de trouver un professionnel de santé qui soit à l'écoute et compréhensif. Vous pouvez commencer par demander des recommandations à des amis de confiance ou à des groupes de soutien locaux. Les cliniques spécialisées dans la santé sexuelle peuvent également être de bonnes options, car elles sont souvent plus familières avec les préoccupations liées au PrEP et à l'anxiété. N'hésitez pas à poser des questions sur leur approche lors du premier contact. Rappelez-vous, il est essentiel de vous sentir à l'aise avec votre professionnel de santé. Si vous ressentez le besoin de parler de votre anxiété, des professionnels en santé mentale peuvent également vous apporter un soutien précieux.",French,1
20,queles sont les effets seocndaires l35 pluuus fréqu3nt5 su PrEP et comment puis-je les idk gérer,"Les effets secondaires du PrEP peuvent inclure des nausées, des maux de tête, et parfois des troubles gastro-intestinaux. Ces effets sont généralement temporaires et s'estompent souvent après quelques semaines. Pour les gérer, il est important de rester en contact avec un professionnel de la santé qui peut vous soutenir et vous donner des conseils adaptés à votre situation.

Si vous vous sentez anxieuse à propos de votre santé, envisagez de parler à un professionnel de la santé mentale. Ils peuvent vous aider à gérer vos préoccupations. N'oubliez pas que vous n'êtes pas seule et que des ressources sont disponibles pour vous soutenir.",French,1
21,comm3n7 puis-je truver un professionnel de la santé qui comprsnd m35 inquiétudes et peut m'aider à gérer m0n 4nx1é7é par rapport au PrEP,"Il est important de se sentir compris et soutenu. Pour trouver un professionnel de la santé qui peut vous aider, vous pouvez commencer par :

1. **Consulter votre médecin traitant** : Il pourra vous orienter vers un spécialiste.
2. **Chercher des cliniques de santé sexuelle** : Elles sont souvent mieux équipées pour aborder les préoccupations liées au PrEP et à l'anxiété.
3. **Contacter des associations locales** : Beaucoup offrent des ressources et des groupes de soutien pour les personnes vivant avec des inquiétudes similaires.

N'hésitez pas à poser des questions lors de votre première rencontre pour vous sentir à l'aise. Vous méritez d'être soutenue dans votre parcours.",French,1
22,Quells sont lex options pour gérer oes effets secondaires du PrEP si je dcide d3 le prendre 💀,"Il existe deux options principales pour la PrEP : orale, à prendre quotidiennement, et injectable, généralement administrée tous les deux mois. En ce qui concerne les effets secondaires, ils varient d'une personne à l'autre. Beaucoup de gens ne ressentent pas d'effets secondaires significatifs, mais si cela se produit, il est important de consulter un professionnel de santé qui pourra vous aider à gérer ces préoccupations. Vous pouvez également discuter de vos inquiétudes et de votre anxiété avec un conseiller ou un thérapeute qui peut offrir un soutien. N'oubliez pas que vous n'êtes pas seule et qu'il existe des ressources pour vous aider.",French,1
23,quels sont les effets secondaires les pluz courants du PrEP et comment puis-je les reconnaître ?,"Les effets secondaires du PrEP, qu'il soit oral ou injectable, peuvent inclure des nausées, des douleurs abdominales, des maux de tête, et une fatigue. Ces effets sont généralement légers et disparaissent souvent après quelques semaines. Il est important de consulter un professionnel de la santé si vous ressentez des symptômes persistants ou inquiétants. 

Je comprends que l'anxiété et la crainte du jugement peuvent rendre ces discussions difficiles. Vous n'êtes pas seule dans cette situation, et il pourrait être utile de parler à un professionnel de la santé ou à un conseiller qui peut vous soutenir. Prenez soin de vous et avancez à votre rythme.",French,1
24,Comment puis-je trouver un professionnel de la santé qui comprend mes préoccupations et peut m'accompagner dans mon parcours avec le PrEP ?,"Pour trouver un professionnel de santé qui comprend vos préoccupations, vous pouvez commencer par consulter des cliniques spécialisées dans la santé sexuelle ou les infections transmissibles. Recherchez des centres qui offrent des services d'éducation sur le PrEP et qui sont réputés pour leur approche empathique. Vous pouvez aussi demander des recommandations à des amis ou à des groupes de soutien. N'hésitez pas à poser des questions sur leurs expériences et leur approche lors de votre première consultation. Si vous ressentez le besoin de soutien émotionnel, envisager de parler à un thérapeute ou de rejoindre un groupe de soutien peut aussi être bénéfique.",French,0
25,quels sont les effets secooondaires les plus idk courants du prep et comment peuvent-ils être gérés gérés,"Les effets secondaires les plus courants du PrEP peuvent inclure des nausées, des douleurs abdominales, des maux de tête et de la fatigue. Ces effets sont généralement légers et s'estompent souvent après quelques semaines. Pour les gérer, il est conseillé de prendre le médicament avec de la nourriture pour réduire les nausées. 

Il est également important de rester en contact avec votre professionnel de santé, qui peut vous aider à surveiller vos réactions et ajuster votre traitement si nécessaire. N'hésitez pas à partager vos préoccupations ou vos sentiments d'anxiété avec eux ; ils sont là pour vous soutenir. Si l'anxiété persiste, envisagez de consulter un professionnel de la santé mentale.",French,1
26,Comment puis-je gérer mon anxiété avant de consulter un professionnel de santé au sujet du PrEP ?,"Il est tout à fait normal de ressentir de l'anxiété avant une consultation médicale, surtout sur des sujets sensibles comme le PrEP. Voici quelques conseils qui pourraient vous aider :

1. **Préparation** : Notez vos questions ou préoccupations à l'avance pour vous sentir plus organisée.
2. **Respiration** : Pratiquez des exercices de respiration profonde pour calmer votre esprit.
3. **Support** : Parlez-en à un ami de confiance ou à un proche qui peut vous accompagner ou vous soutenir.
4. **Professionnels de santé** : N'oubliez pas que les médecins sont là pour vous aider, sans jugement. 

Si votre anxiété devient trop lourde, envisagez de consulter un professionnel de la santé mentale pour un soutien supplémentaire. Vous méritez de vous sentir en sécurité et à l'aise dans vos choix de santé.",French,0
27,Quels sont les effets secondaires les plus courants du PrEP et comment les gérer ?,"Les effets secondaires les plus courants du PrEP peuvent inclure des nausées, des maux de tête et des douleurs abdominales, mais beaucoup de personnes ne ressentent aucun effet secondaire. Ces symptômes sont souvent temporaires et s'améliorent avec le temps. Il est important d'en parler avec un professionnel de santé qui peut te fournir des conseils adaptés et des stratégies pour les gérer. Si tu te sens anxieuse à propos de ta santé, envisage de parler à un thérapeute ou un conseiller qui peut t'apporter un soutien émotionnel. N'hésite pas à poser des questions et à chercher des informations qui te rassurent.",French,0
28,Comment puis-je trouver un professionnel de santé qui comprenne mes préoccupations et ne me juge pas ?,"Il est important de trouver un professionnel de santé avec qui vous vous sentez à l'aise. Vous pouvez commencer par demander des recommandations à des amis de confiance ou à des groupes de soutien. Les cliniques spécialisées dans la santé sexuelle et les centres communautaires sont souvent plus inclusifs et sensibles aux préoccupations des patients. En ligne, des plateformes comme Doctolib permettent de lire les avis d'autres patients. N'hésitez pas à poser des questions lors de votre première consultation pour vous assurer que le professionnel comprend vos préoccupations. Si l'anxiété persiste, envisager de parler à un thérapeute pourrait également être bénéfique.",French,0
29,Quels 50nt es effets secondaires l35 plus courants du PrEP et comment peuvent-ils êtee géré5 😬,"Il est compréhensible d'avoir des inquiétudes concernant les effets secondaires du PrEP. Les effets secondaires les plus courants incluent des nausées, des maux de tête et des douleurs abdominales. Ces symptômes sont souvent temporaires et peuvent s'atténuer avec le temps. Pour les gérer, il est conseillé de rester hydraté et de prendre le médicament avec de la nourriture si cela aide.

Si vous ressentez des effets secondaires persistants, il est important d'en parler avec un professionnel de la santé qui peut vous soutenir et vous proposer des solutions. N'oubliez pas que votre bien-être mental est également essentiel. Si l'anxiété persiste, envisagez de consulter un professionnel de la santé mentale pour obtenir de l'aide.",French,1
30,Comment puis-je sumonter mon 4nx1été 4v4n7 de con5ul73r un professionnel de santé auuu you know sujer du PrEP ? ✨ ✨,"Il est compréhensible de se sentir anxieuse à l'idée de consulter un professionnel de santé. Prenez un moment pour vous rappeler que ces professionnels sont là pour vous soutenir et vous aider, sans jugement. Vous pourriez commencer par écrire vos questions ou préoccupations afin de vous sentir plus préparée. 

Pour le PrEP, il existe des options orales et injectables, chacune ayant ses propres avantages. N'hésitez pas à demander des informations spécifiques lors de votre consultation. Si votre anxiété devient trop difficile à gérer, envisager de parler à un thérapeute ou à un conseiller peut être bénéfique. Vous n'êtes pas seule dans cette démarche.",French,1
