turn,user,bot,language,has_error
1,"como p05s0 ildar co, a ansiedaer sobre meu relacionamento enquanro procuro acessar o PrEP?","Entendo que você esteja se sentindo ansiosa e insegura em relação ao seu relacionamento e ao acesso ao PrEP. É importante priorizar sua saúde e segurança. O PrEP é uma forma eficaz de prevenção do HIV, disponível tanto em comprimidos quanto em injeções. 

Se você se sentir confortável, considere buscar apoio em grupos de terapia ou profissionais de saúde que possam oferecer um ambiente seguro para discutir suas preocupações. A comunicação aberta com pessoas de confiança pode ajudar a aliviar a ansiedade. Lembre-se de que sua saúde e bem-estar são prioridades. Se precisar, posso ajudar a encontrar recursos locais.",Portuguese,0
2,Quais são as opções de PrEP disponíveis no Brasil e como posso acessá-las sem que meu parceiro saiba?,"No Brasil, as opções de PrEP incluem a PrEP oral, que é um comprimido tomado diariamente, e a PrEP injetável, que é uma injeção administrada a cada dois meses. Para acessar a PrEP de forma discreta, você pode procurar centros de saúde, unidades de saúde da família ou serviços de saúde especializados em HIV e prevenção. Esses locais têm profissionais capacitados e podem oferecer apoio em um ambiente seguro.

Entendo que a situação com seu parceiro é preocupante. É importante priorizar sua saúde e segurança. Considere buscar apoio de profissionais de saúde ou grupos de apoio que possam ajudar a lidar com o medo e a insegurança que você sente. Você não está sozinha.",Portuguese,0
3,Quais são os serviços de saúde no Brasil que oferecem PrEP e garantem sigilo para proteger minha privacidade?,"No Brasil, a PrEP está disponível em centros de saúde pública, como as Unidades de Saúde da Família (USF) e os Centros de Testagem e Aconselhamento (CTA). Esses serviços geralmente garantem sigilo e confidencialidade. Além disso, algumas organizações não governamentais (ONGs) também oferecem acesso à PrEP com foco na privacidade.

É importante lembrar que você merece se sentir segura e protegida ao buscar cuidados de saúde. Se você estiver enfrentando dificuldades emocionais devido à sua situação, considere procurar apoio profissional, como psicólogos ou grupos de apoio, que podem ajudar a lidar com esse momento difícil.",Portuguese,0
4,como psso me proteger idk ao buscar informações sobre PrEP sem que meu parceiro d35cybra,"É compreensível sentir-se insegura em falar sobre PrEP, especialmente em um relacionamento difícil. A PrEP, que pode ser oral ou injetável, é uma forma eficaz de prevenir a infecção pelo HIV. Você pode buscar informações de forma discreta, como através de sites confiáveis ou aplicativos de saúde, que não deixem rastros. 

Se você sentir necessidade de apoio emocional, considere entrar em contato com serviços de apoio ou profissionais de saúde que entendam sua situação. Sua saúde e segurança são importantes, e existem recursos disponíveis para ajudá-la. Se precisar, posso ajudar a encontrar informações específicas.",Portuguese,1
5,Quais são os sinais de que meu parceiro pode reagir de forma violenta se eu mencionar PrEP?,"É compreensível ter preocupações sobre como seu parceiro pode reagir a esse tipo de conversa. Alguns sinais que podem indicar uma possível reação negativa incluem comportamento agressivo em discussões anteriores, desinteresse em questões de saúde sexual, ou uma postura crítica em relação à prevenção do HIV. Se você já perceber sinais de controle ou ciúmes excessivos, isso também pode ser um motivo de preocupação.

É importante priorizar sua segurança e saúde mental. Considere buscar apoio de profissionais, como conselheiros ou grupos de apoio, que possam ajudá-la a lidar com essa situação de forma segura e informada. Lembre-se de que você merece um relacionamento saudável e respeitoso.",Portuguese,0
6,quais estratégias posso usar para 4b0rd4r o assunto da aaúde like sexual com meu parceiro sem povocar uma reação negativa,"É compreensível que você se sinta ansiosa ao abordar questões de saúde sexual, especialmente em um relacionamento difícil. Aqui estão algumas estratégias que podem ajudar:

1. **Escolha um momento tranquilo:** Tente falar em um ambiente calmo, onde ambos se sintam seguros e confortáveis.

2. **Use ""eu"" em vez de ""você"":** Falar sobre como você se sente pode ajudar a evitar que o seu parceiro se sinta atacado. Por exemplo, ""Eu me preocupo com nossa saúde"".

3. **Educação compartilhada:** Apresente informações sobre PrEP como algo que pode beneficiar ambos, enfatizando a saúde e o bem-estar.

4. **Seja honesta sobre seus sentimentos:** Se você se sente insegura, pode mencionar isso de maneira vulnerável.

Se a situação se tornar muito difícil, considere buscar apoio profissional, como um terapeuta ou um grupo de apoio. Você merece se sentir segura e cuidada.",Portuguese,1
7,Como posso me proteger emocionalmente e fisicamente enquanto busco informações sobre PrEP?,"Proteger-se emocionalmente e fisicamente é muito importante. Primeiro, busque um ambiente seguro e acolhedor para se informar sobre PrEP, seja através de amigos de confiança ou profissionais de saúde que respeitem sua privacidade. Existem opções de PrEP, como a oral, que você toma diariamente, e a injetável, que é administrada a cada dois meses.

Se você sentir medo de como seu parceiro pode reagir, considere entrar em contato com serviços de apoio, como linhas de ajuda ou grupos de suporte, que podem oferecer orientação e segurança. Lembre-se de que sua saúde e bem-estar são prioridade. Não hesite em buscar ajuda profissional se sentir necessidade.",Portuguese,0
8,quais são as opções de aoio disponíveis parq mmmulheres que enfrentma violência no relacionametno e desejam 53 informar sobre prep?,"Entendo que você está em uma situação muito delicada. É importante priorizar sua segurança. Em relação ao PrEP, existem opções orais e injetáveis. O PrEP oral é tomado diariamente, enquanto o injetável é administrado a cada dois meses. 

Se você se sentir insegura discutindo isso com seu parceiro, considere buscar apoio em grupos de apoio ou profissionais de saúde que respeitem sua privacidade. Organizações locais podem oferecer recursos e assistência de forma segura. Lembre-se, sua saúde e segurança são prioridades. Você não está sozinha e há ajuda disponível.",Portuguese,1
9,como p03s0 encontrar um profissional de zaúde que respeite m1nha privacidade e me aaajude com informações sbor PrEP?,"É compreensível que você queira encontrar um profissional de saúde que respeite sua privacidade. Para isso, você pode considerar os seguintes passos:

1. **Procure Centros de Saúde Locais**: Muitas cidades têm centros especializados em saúde sexual, que são mais acolhedores e informados sobre PrEP.
   
2. **Consulte ONGs**: Organizações que trabalham com saúde sexual podem indicar profissionais de confiança.

3. **Verifique a Confidencialidade**: Ao agendar uma consulta, pergunte sobre as políticas de privacidade e como suas informações serão protegidas.

4. **Busque Recomendações**: Conversar com amigos ou grupos de apoio pode ajudar a encontrar profissionais respeitosos.

Lembre-se de que sua saúde é importante e você merece um atendimento seguro e respeitoso. Se você se sentir insegura, considerar apoio psicológico pode ser útil.",Portuguese,1
10,quais são ooos sinais de que um profissional de saúde é r34lm3n73 confiável e respeita a privacidade dos pacientes?,"É importante se sentir seguro e respeitado ao buscar cuidados de saúde. Alguns sinais de que um profissional de saúde é confiável incluem: 

1. **Ouvir com atenção**: Ele escuta suas preocupações e perguntas sem interromper.
2. **Respeito à privacidade**: Ele garante que suas informações pessoais sejam mantidas em sigilo.
3. **Empatia**: Demonstra compreensão e apoio às suas circunstâncias.
4. **Informação clara**: Explica as opções de tratamento, como PrEP oral ou injetável, de maneira compreensível.
5. **Consentimento informado**: Busca seu consentimento antes de qualquer procedimento.

Se você sentir insegurança, considere procurar serviços que ofereçam suporte a pessoas em situações de violência. Você não está sozinha e merece cuidados respeitosos.",Portuguese,1
11,Como po55o encontfar um profissional de saúde wueee ofereça suporte a mulheres em situações de violênciw e que respeite minha confidencialidade?,"É importante encontrar um profissional de saúde que seja sensível às suas necessidades e respeite sua confidencialidade. Você pode começar buscando clínicas de saúde comunitárias ou organizações que trabalham com saúde da mulher e violência doméstica. Muitas vezes, elas têm profissionais treinados para oferecer apoio às mulheres em situações difíceis. 

Além disso, considere entrar em contato com serviços de apoio psicológico ou grupos de apoio, que podem ajudar a lidar com os sentimentos de medo e insegurança. Lembre-se de que você não está sozinha e há recursos disponíveis para te ajudar. Se precisar, posso ajudar a encontrar informações sobre esses serviços na sua região.",Portuguese,1
12,Quais são os sinais de you know que meu paceiro pode reagir de flrma violenta 5e eu discutir sobre PrEP?,"É compreensível sentir-se insegura sobre esse assunto. Sinais de que seu parceiro pode reagir de forma violenta incluem comportamentos agressivos, desdém por suas preocupações, ciúmes excessivos ou tentativas de controlar suas decisões. É importante priorizar sua segurança e bem-estar. Se você se sentir em risco, considere buscar apoio de profissionais, como terapeutas ou serviços de apoio a vítimas de violência. Sobre a PrEP, existem opções orais e injetáveis que podem ajudar a proteger sua saúde. Se precisar de mais informações sobre PrEP, estou aqui para ajudar.",Portuguese,1
13,Quais estratégias posso usar para abordar o assunto da PrEP sem desencadear uma reação violenta?,"Compreendo que essa situação é delicada e é importante priorizar sua segurança. Aqui estão algumas sugestões:

1. **Escolha um momento calmo**: Tente abordar o assunto quando vocês estiverem tranquilos, longe de estresse ou conflitos.
2. **Use uma abordagem educacional**: Fale sobre a PrEP como uma maneira de cuidar da saúde, sem mencionar diretamente o uso pessoal.
3. **Foque na saúde de ambos**: Enfatize que é uma questão de proteção e bem-estar, e não apenas sua saúde.
4. **Seja sutil**: Você pode mencionar informações que ouviu ou leu, gerando uma conversa sem pressão.

Se você sentir que a situação é muito arriscada, considere buscar apoio de profissionais de saúde ou organizações que lidam com violência doméstica. Sua segurança é a prioridade.",Portuguese,0
14,Como posso encontrar um profissional de saúde que entenda minha situação e possa me ajudar a iniciar o uso da PrEP sem que meu parceiro fique sabendo?,"É compreensível que você se sinta insegura em discutir sua saúde sexual em um relacionamento complicado. Para encontrar um profissional de saúde que possa te apoiar, você pode procurar clínicas de saúde sexual ou centros de saúde comunitária na sua região. Muitos oferecem serviços de forma confidencial e têm experiência em lidar com questões sensíveis. Você também pode considerar entrar em contato com organizações locais que trabalham com HIV e saúde sexual; elas podem te ajudar a encontrar recursos e profissionais que compreendam sua situação. Lembre-se de que sua saúde e segurança são prioridades. Se você estiver enfrentando dificuldades emocionais, considere buscar apoio psicológico.",Portuguese,0
15,Quais são os sinais de que meu parceiro pode reagir de forma violenta se eu mencionar o uso da PrEP?,"É compreensível sentir medo em situações assim. Sinais de que seu parceiro pode reagir de forma violenta incluem comportamentos controladores, desinteresse nas suas preocupações, reações agressivas a tópicos de saúde sexual ou desvalorização dos seus sentimentos. É importante priorizar sua segurança e bem-estar. Considere conversar com um profissional ou um grupo de apoio que entenda seu contexto e possa ajudar. 

Sobre a PrEP, existem opções orais e injetáveis que podem ajudar na prevenção do HIV. Se precisar de mais informações, estou aqui para ajudar.",Portuguese,0
16,c-commmo ppposso iniciar o uso da PErP sem que meu parceiro perceba e reajjja negativamente?,"Entendo que você está em uma situação delicada e que a segurança é uma prioridade. A PrEP (profilaxia pré-exposição) pode ser tomada de forma discreta. Você pode optar pelo PrEP oral, que é um comprimido tomado diariamente, ou pela forma injetável, que é administrada a cada dois meses. 

É importante lembrar que sua saúde e segurança são fundamentais. Se você sentir que a conversa sobre saúde sexual pode ser arriscada, considere buscar apoio de profissionais de saúde ou grupos de suporte. Eles podem oferecer orientações e recursos que respeitam sua situação. Você não está sozinha nessa jornada.",Portuguese,1
17,qu415 são os efeitos colatetais do uso da prep e como posso gerenciá-los se eu começar a tlmar? 💀 💀,"Os efeitos colaterais da PrEP (profilaxia pré-exposição) podem incluir náuseas, dor de cabeça, fadiga e problemas gastrointestinais, mas muitas pessoas não experienciam efeitos significativos. Se você começar a tomar PrEP, é importante monitorar como se sente e comunicar qualquer desconforto ao seu profissional de saúde. Eles podem ajudar a gerenciar os efeitos colaterais e oferecer apoio.

Lembre-se de que é fundamental se sentir segura ao discutir sua saúde sexual. Se você estiver enfrentando temores relacionados à sua segurança ou saúde mental, considere procurar apoio de profissionais ou grupos de apoio que possam oferecer um espaço seguro para você. Você não está sozinha nessa.",Portuguese,1
18,como posso me protegerrr e acessar a prep sem que meu parceiro descubra,"Entendo que essa situação é muito difícil e pode causar muita ansiedade. A PrEP (Profilaxia Pré-Exposição) é uma forma eficaz de prevenção do HIV e está disponível tanto em forma oral quanto injetável. Para acessar a PrEP, você pode procurar serviços de saúde locais, como clínicas de saúde pública ou organizações que oferecem apoio à saúde sexual. 

Se você se sentir insegura, considere entrar em contato com profissionais de saúde que respeitem sua privacidade. É importante cuidar de sua saúde mental e física. Se precisar, busque apoio de grupos ou serviços de apoio psicológico, que podem ajudar a lidar com o medo e a violência. Você não está sozinha.",Portuguese,1
19,Quais são os serviços de saúde que oferecem PrEP de forma discreta e segura?,"É importante que você encontre um serviço de saúde que possa oferecer PrEP de forma discreta e segura. Em muitas cidades, clínicas de saúde sexual, centros de controle de doenças e unidades de saúde pública oferecem PrEP. Você pode buscar informações online sobre serviços na sua região ou consultar organizações que trabalham com saúde sexual.

Além disso, algumas clínicas oferecem consultas virtuais, o que pode ajudar a manter a privacidade. Se você se sentir confortável, também pode entrar em contato com grupos de apoio locais, que podem fornecer informações e recursos durante esse processo. Lembre-se de que sua segurança é prioridade.",Portuguese,0
20,u-uQQQais são os snais de que esotu emmm um relacionamento abusivo e como isso pode ipac74r minha saúde you know sexual,"Reconhecer sinais de um relacionamento abusivo é fundamental. Alguns sinais incluem controle excessivo, ciúmes, críticas constantes, desvalorização e ameaças. Esses comportamentos podem afetar sua saúde sexual, pois o medo e a falta de comunicação podem dificultar o acesso a cuidados como a PrEP, que é uma forma eficaz de prevenção do HIV. 

Existem opções de PrEP oral e injetável, que podem ser discutidas com um profissional de saúde quando você se sentir pronta. É importante priorizar sua segurança e bem-estar. Se você estiver se sentindo insegura ou precisar de apoio, considere buscar ajuda de profissionais ou organizações que trabalham com violência doméstica. Você não está sozinha.",Portuguese,1
21,"como posso me proteger e acessar informações sobre PrEP sem qu3 ,eu parceiro descubra?","Entendo que você está em uma situação difícil. A PrEP (Profilaxia Pré-Exposição) é uma forma eficaz de prevenir a infecção pelo HIV e pode ser tomada em forma de comprimidos diários ou injeções mensais. 

Para acessar informações sem que seu parceiro descubra, você pode buscar recursos online, como sites confiáveis de saúde sexual, ou procurar serviços de saúde que ofereçam atendimento confidencial. Muitas vezes, organizações locais têm apoio e recursos para pessoas em situações de violência. 

Se você estiver se sentindo insegura, considere entrar em contato com serviços de apoio a vítimas de violência, que podem oferecer orientação e suporte emocional. Você não está sozinha.",Portuguese,1
22,quais são os serviços ddde saúde que ofer3c3m prep d3 forma confidencial no brasssil,"No Brasil, você pode encontrar serviços de saúde que oferecem PrEP de forma confidencial em centros de saúde pública, como os Centros de Testagem e Aconselhamento (CTA) e Unidades de Saúde da Família (USF). Além disso, algumas ONGs e clínicas privadas também oferecem PrEP, garantindo a privacidade dos usuários. É importante buscar um local onde você se sinta segura para discutir suas necessidades. Se você estiver enfrentando dificuldades emocionais ou medo, considerar o apoio de um profissional de saúde mental pode ser útil. A sua saúde e segurança são prioridades.",Portuguese,1
23,Quais são os efeitos colaterais da PrEP e como posso lidar com eles?,"A PrEP, que pode ser oral ou injetável, pode ter alguns efeitos colaterais, como náuseas, dor de cabeça e fadiga, especialmente nos primeiros dias. Muitas pessoas se adaptam rapidamente e esses sintomas costumam diminuir com o tempo. É importante consultar um profissional de saúde para discutir qualquer efeito colateral e estratégias para lidar com eles.

Se você estiver preocupada com a reação do seu parceiro, lembre-se de que sua saúde é fundamental e existem recursos de apoio disponíveis, como grupos de apoio ou profissionais de saúde que podem oferecer orientação e suporte. Você não está sozinha nessa.",Portuguese,0
24,Quais são os recursos disponíveis para uh me ajudra a iscutir PrEP com meu kédico sem que meu parceiro descubra?,"É compreensível sentir-se insegura em discutir PrEP com seu médico. Você pode considerar algumas opções:

1. **Consultas Privadas**: Muitas clínicas oferecem consultas confidenciais, onde você pode discutir sua saúde sem a presença do seu parceiro.

2. **Telemedicina**: Algumas plataformas de saúde oferecem consultas online, permitindo que você fale sobre PrEP de forma discreta.

3. **Serviços de Saúde Comunitária**: Procure organizações locais que oferecem serviços de saúde sexual. Elas podem ter profissionais treinados para lidar com questões de violência e discriminação.

Se precisar de apoio emocional ou estiver lidando com a violência, considere entrar em contato com profissionais de saúde mental ou grupos de apoio. Você merece se sentir segura e cuidada.",Portuguese,1
25,Quais são os sinais de que meu relacionamento pode se tornar mais violento se eu falar sobre PrEP?,"É compreensível sentir-se insegura ao abordar tópicos delicados em um relacionamento tenso. Sinais de que a conversa pode ser problemática incluem reações agressivas a discussões sobre saúde, desinteresse em ouvir suas preocupações ou tentativas de controlar suas decisões pessoais. Se você sentir que seu parceiro pode reagir de forma violenta, é importante priorizar sua segurança. Considere conversar com um profissional de saúde ou um conselheiro que possa oferecer apoio e estratégias para lidar com sua situação. A PrEP, tanto oral quanto injetável, é uma opção eficaz para prevenir o HIV, e você merece acesso a essa informação sem medo.",Portuguese,0
26,Como posso me proteger e acessar informações sobre PrEP sem que meu parceiro descubra?,"Entendo que você está enfrentando uma situação difícil e é importante priorizar sua segurança e bem-estar. A PrEP (Profilaxia Pré-Exposição) é uma opção eficaz para prevenir a infecção pelo HIV. Você pode optar por PrEP oral, que deve ser tomada diariamente, ou injetável, que é administrado a cada dois meses.

Para acessar informações sem que seu parceiro saiba, considere procurar centros de saúde locais ou clínicas que ofereçam serviços de saúde sexual. Muitas vezes, esses locais têm opções de atendimento confidencial. Se precisar de apoio emocional, profissionais de saúde mental podem ajudar a lidar com o medo e a insegurança que você sente. Você não está sozinha nessa.",Portuguese,0
27,Quais são os sintomas de HIV e como posso me informar sobre testes sem que meu parceiro perceba?,"Os sintomas de HIV podem variar, mas muitas pessoas não apresentam sinais nas primeiras semanas. Os sintomas iniciais podem incluir febre, dor de garganta e fadiga. É importante fazer testes regulares para saber seu status, especialmente se você tem preocupações.

Para se informar sobre testes de HIV sem que seu parceiro perceba, considere procurar serviços de saúde locais que ofereçam testes anônimos ou confidenciais. Além disso, você pode acessar informações em sites confiáveis sobre saúde sexual. Se você se sentir insegura, procurar apoio de profissionais de saúde ou grupos comunitários pode ser útil. Lembre-se de que sua saúde e segurança são prioridades.",Portuguese,0
28,onde posso encontear locais seguros e anônimos para fazeeer o teste de HIV ha minha cidade?,"É importante encontrar um local seguro e anônimo para fazer o teste de HIV. Em muitas cidades brasileiras, você pode procurar por unidades de saúde, como o SUS, que oferecem testes gratuitos e em sigilo. Além disso, algumas ONGs e centros de saúde comunitários também realizam esses testes com foco na privacidade. 

Se você estiver preocupada com a segurança, considere ligar antes para entender como funciona o atendimento e garantir que se sinta confortável. Se precisar de mais suporte emocional, há profissionais que podem ajudar. Cuide-se!",Portuguese,1
29,como posso conversar sobre a peep clm im profissioal um de aúde 53m que mej parceiro descubra,"É compreensível sentir-se ansiosa sobre como abordar o tema da PrEP com um profissional de saúde. Lembre-se de que os profissionais estão lá para ajudar e fornecer informações em um ambiente seguro e confidencial. Você pode iniciar a conversa dizendo que tem interesse em saber mais sobre opções de prevenção ao HIV, como a PrEP oral ou injetável.

Se você estiver preocupada com a reação do seu parceiro, considere buscar apoio de grupos de saúde ou serviços de apoio psicológico que possam ajudá-la a lidar com esses sentimentos. Sua saúde e segurança são prioridades.",Portuguese,1
30,Quais são os passos para encontrar um profissional de saúde que entenda minha situação e me ofereça apoio sem que meu parceiro saiba?,"Encontrar um profissional de saúde que respeite sua privacidade é importante. Aqui estão alguns passos que podem ajudar:

1. **Pesquise clínicas locais**: Procure por clínicas de saúde sexual ou centros de saúde comunitários que ofereçam serviços de PrEP. Muitas vezes, eles têm profissionais treinados em lidar com questões sensíveis.

2. **Verifique a confidencialidade**: Ao entrar em contato, pergunte sobre políticas de confidencialidade e como eles protegem a privacidade dos pacientes.

3. **Considere telemedicina**: Algumas consultas podem ser feitas online, o que pode ajudar a manter sua situação em sigilo.

4. **Busque apoio emocional**: Se você se sentir sobrecarregada, considere procurar grupos de apoio ou profissionais de saúde mental que entendam sua situação.

Lembre-se, seu bem-estar é prioridade.",Portuguese,0
