turn,user,bot,language,has_error
1,w-what supprot resources are availbale for soemone like uh me consdiering prep? prep?,"It's completely understandable to feel anxious about starting PrEP, especially while managing chronic pain. There are several resources available to help you:

1. **Local Health Clinics**: Many clinics offer free or low-cost consultations for PrEP and can help coordinate your care with your pain management.

2. **National HIV/AIDS Hotline**: You can call 1-800-CDC-INFO for information and support.

3. **Online Support Groups**: Websites like PrEP4All and The Well Project provide resources and community support.

4. **Mental Health Professionals**: If stigma or anxiety feels overwhelming, consider speaking with a counselor who specializes in chronic illness or sexual health.

You're taking a brave step, and support is available for you!",English,1
2,How can I manage my chronic pain while taking PrEP effectively?,"It's understandable to be concerned about managing chronic pain while starting PrEP. Both oral and injectable PrEP are effective options for HIV prevention, and many people successfully incorporate them into their health routines. It's important to communicate with your healthcare provider about your chronic pain and any potential interactions with your current treatments. They can help develop a plan that addresses both your pain management and PrEP adherence. 

If you’re feeling anxious or facing stigma, consider reaching out to a mental health professional or support groups that focus on chronic pain or HIV prevention. You're not alone, and there are resources available to help you navigate this journey.",English,0
3,w-what specific side um effefts of PrEP should I be aware of tjat could impact my chr0n1c p14n management? ❓,"It's understandable to be concerned about how PrEP might affect your chronic pain management. Common side effects of PrEP, whether oral or injectable, can include nausea, fatigue, and headaches, which may impact your overall well-being. Additionally, some individuals may experience changes in kidney function, although this is usually monitored by healthcare providers. 

It's essential to discuss your chronic pain management plan with your healthcare provider before starting PrEP, as they can tailor recommendations to your specific needs. If you’re feeling anxious or worried about stigma, consider reaching out to a mental health professional who can provide support during this process. You're taking a positive step for your health!",English,1
4,How can I b357 communicate my concerns abouttt PrEP and chronic pain to my healthcare provider?,"It’s important to communicate openly with your healthcare provider about your concerns. Consider preparing a list of specific questions and feelings regarding how PrEP may interact with your chronic pain management. You might say, “I’m interested in starting PrEP, but I’m worried about how it might affect my pain levels and treatment. Can we discuss potential side effects and how to manage them?” 

Sharing your experiences and feelings can help your provider understand your situation better. Remember, you deserve support and guidance tailored to your needs. If you feel overwhelmed, consider speaking with a mental health professional for additional support.",English,1
5,What potential side effects of PrEP should I be aware of that could impact my chronic pain management?,"It's understandable to have concerns about how PrEP might affect your chronic pain management. Common side effects of PrEP can include nausea, headaches, and gastrointestinal issues, which could potentially impact your overall comfort. However, many people tolerate PrEP well. It’s important to communicate your concerns with your healthcare provider, as they can help tailor your treatment plan to minimize any impact on your pain management. If you ever feel overwhelmed by stigma or anxiety about starting PrEP, consider reaching out to a mental health professional or support group for guidance. You’re not alone in this journey!",English,0
6,Are there 5p3c1f1c strategies or medications I can use to i mean manage any potential side effects of Pr3P while ealing wtih chronic pain,"Managing chronic pain while starting PrEP is important. Both oral and injectable PrEP can have side effects, but many people tolerate them well. Common side effects may include nausea or headaches, and they often resolve on their own. 

To manage potential side effects, consider discussing your current pain management plan with your healthcare provider. They can help ensure that your medications don’t interact and may suggest strategies tailored to your needs. 

If you’re feeling anxious about stigma or the emotional aspects of this journey, connecting with a mental health professional or support group can be beneficial. You don’t have to navigate this alone.",English,1
7,What should I discuss with my healthcare provider to ensure that PrEP fits well into my current pain management plan?,"It's important to have an open conversation with your healthcare provider about your chronic pain management and how it may intersect with starting PrEP. You can discuss your current medications, any side effects you're experiencing, and how they impact your daily life. Ask about potential interactions between your pain management regimen and PrEP, whether oral or injectable. Also, express any concerns about stigma or anxiety you may have regarding taking PrEP. This will help your provider understand your specific needs and tailor a plan that supports both your health and well-being. If you're feeling overwhelmed, consider reaching out to a mental health professional for additional support.",English,0
8,Are there specific pain management strategies I can use while starting PrEP to minimize any potential side effects?,"It's understandable to feel concerned about managing chronic pain while starting PrEP. Both oral and injectable PrEP are generally well-tolerated, but it's important to discuss any concerns with a healthcare provider who understands your specific situation. They can help create a plan that considers your pain management needs. 

In terms of strategies, many people find relief through a combination of medication, physical therapy, and mindfulness techniques. Connecting with support groups for chronic pain or PrEP can also be beneficial. If stigma or anxiety arises, speaking with a mental health professional may provide additional support. Your health and comfort are important, so take it one step at a time.",English,0
9,What potential side effects 0f PrEP shoyld I be aware of that could impact my chronic paib management,"It's understandable to be concerned about how starting PrEP might affect your chronic pain management. Common side effects of oral PrEP (like Truvada or Descovy) can include nausea, headache, and fatigue, while injectable PrEP (like Apretude) might cause injection site pain or reactions. These side effects can vary in intensity and duration. It's important to discuss your existing pain management plan with a healthcare provider, who can help you monitor any changes and adjust your treatment as needed. If you experience stigma or anxiety about starting PrEP, consider speaking with a mental health professional for support. You're not alone in this journey.",English,1
10,How can I effectively communicate my concerns about chronic pain and PrEP to my healthcare provider?,"It's great that you're planning to communicate with your healthcare provider about your concerns. To effectively express your feelings, consider the following steps: 

1. **Be Honest**: Share your experiences with chronic pain and how you feel about starting PrEP. 

2. **Prepare Questions**: Write down specific questions or concerns regarding how PrEP might interact with your pain management.

3. **Discuss Your Goals**: Explain what you hope to achieve with both your pain management and PrEP.

4. **Seek Support**: If you're feeling anxious, consider bringing a trusted friend or family member to your appointment for moral support.

Remember, your healthcare provider is there to help you navigate these concerns.",English,0
11,w-what specific side effects 0f PrEP should I be aware ot hat might agfect my chronic pain manaement?,"It's understandable to have concerns about how PrEP might interact with your chronic pain management. Common side effects of oral PrEP (like Truvada) can include nausea, headaches, and fatigue, while injectable PrEP (like Apretude) may cause injection site reactions or mild flu-like symptoms. While many people tolerate PrEP well, it's important to discuss your specific situation with a healthcare provider who can tailor advice based on your chronic pain and treatment needs. If you experience any emotional distress or stigma related to this, consider reaching out to a mental health professional for support. Your health and well-being are important!",English,1
12,h-how c4n I effectively communicate my concern about PrEP 4nd cheonic pain to my healthcare provider? 🙂,"It's great that you want to communicate your concerns! Here are some tips: 

1. **Be Honest**: Start by expressing your feelings about chronic pain and how it affects your daily life and health decisions. 
2. **List Your Concerns**: Write down specific questions or worries about how PrEP may interact with your pain management. 
3. **Discuss Treatment Options**: Ask about both oral and injectable PrEP, and how they might fit into your current treatment plan. 
4. **Seek Support**: If you're feeling anxious, consider bringing a friend or family member to the appointment for support. 

Remember, your healthcare provider is there to help you find a solution that works for both your pain management and HIV prevention.",English,1
13,What specific side effects of PrEP shouuuld I be aare 0f that might impact mmmy chronic pain manageemnt,"It's understandable to be concerned about how PrEP might affect your chronic pain management. Common side effects of PrEP can include nausea, headache, and fatigue, which may temporarily impact your overall well-being. However, many people tolerate PrEP well, and side effects often improve over time. 

It's crucial to discuss your chronic pain management plan with a healthcare provider who can help monitor any potential interactions or adjustments needed. If you experience stigma or anxiety around this process, consider reaching out to support groups or mental health professionals who specialize in these areas. You're taking a positive step for your health, and there are resources to help you along the way.",English,1
14,h-how can uh i communicate my chronic paaain c0nc3rn5 to my healthcare providr when discussing starting prep? 🫠,"It's completely understandable to feel anxious about discussing your chronic pain with your healthcare provider. When you're ready, you can start by being honest about your pain levels and how it affects your daily life. You might say something like, ""I'm interested in starting PrEP, but I have concerns about managing my chronic pain alongside it."" This opens the door for a supportive conversation. Remember, your provider is there to help you find a treatment plan that works for both your HIV prevention and pain management. If you feel overwhelmed, consider seeking support from a mental health professional who understands both chronic pain and stigma. You're not alone in this.",English,1
15,what specific questions should i ask my healthcare provider about potential interactions between prep and .. my pain management medications? ✨,"It's great that you're preparing to discuss your health with your provider! Here are some specific questions you might consider asking:

1. Are there any known interactions between PrEP and my pain management medications?
2. How can we monitor for potential side effects or complications while taking both?
3. Are there alternative pain management options that might work better with PrEP?
4. What should I do if I experience increased pain or side effects after starting PrEP?
5. How should I manage my medication schedule to minimize any risks?

These questions can help ensure you feel supported in managing both your chronic pain and your PrEP regimen.",English,1
16,What are the potential side effects of PrEP that I should be aware of while managing my chronic pain?,"It's understandable to have concerns about starting PrEP, especially while managing chronic pain. Common side effects of both oral and injectable PrEP include nausea, headache, fatigue, and changes in kidney function. While many people experience mild side effects that improve over time, it's important to communicate with your healthcare provider about your chronic pain and any potential interactions with your current treatments. They can help you navigate your options and monitor any side effects. If you ever feel overwhelmed, consider seeking support from a mental health professional or a support group for individuals facing similar challenges. You're taking a proactive step for your health, and that's commendable!",English,0
17,how can i mean I find 4 healthcare provider who understands both PrEP and chronic pain management,"Finding a healthcare provider who understands both PrEP and chronic pain management is important. Here are some steps you can take:

1. **Start with your current provider:** Discuss your concerns and ask if they can refer you to someone experienced in both areas.

2. **Search online:** Look for local clinics or providers specializing in sexual health, HIV prevention, or chronic pain management. Websites like the CDC or local health departments may have resources.

3. **Support groups:** Joining online or local support groups for those on PrEP or chronic pain can provide recommendations.

4. **Telehealth options:** Consider virtual consultations, which may widen your options for finding knowledgeable providers.

Don’t hesitate to reach out to a mental health professional if stigma or anxiety becomes overwhelming.",English,1
18,What specific questions should I ask a potential provider to ensure they can effectively manage both my chronic pain and PrEP treatment?,"It's great that you're planning to discuss your health needs with a provider. Here are some questions to consider:

1. How will you coordinate my chronic pain management with PrEP treatment?
2. Are there specific medications or therapies you recommend to minimize potential interactions or side effects?
3. How often will I need to come in for appointments while on PrEP?
4. What side effects should I watch for regarding both my pain management and PrEP?
5. How do you address stigma related to both chronic pain and HIV prevention treatments?

These questions can help ensure your provider is equipped to support your unique needs. Remember, it's important to find someone who makes you feel comfortable and heard.",English,0
19,What strategies can I use to communicate my concerns about pain management and stigma to my provider?,"It's great that you're looking to communicate openly with your provider. Here are some strategies: 

1. **Prepare**: Write down your concerns about pain management and stigma before your appointment. This can help you stay focused.

2. **Be Honest**: Share your feelings about managing chronic pain alongside starting PrEP. Let them know your worries about potential complications.

3. **Ask Questions**: Inquire about how PrEP may interact with your current treatment and discuss any specific fears related to stigma.

4. **Express Your Needs**: Clearly articulate what kind of support you're seeking, whether it's pain relief strategies or emotional support.

5. **Follow-Up**: If you feel comfortable, schedule a follow-up appointment to reassess how things are going.

Your health and comfort matter, and a supportive provider will want to help.",English,0
20,What potential side effects of PrEP should I be aware of that might impact my chronic pain management?,"It's understandable to have concerns about how PrEP may affect your chronic pain management. Common side effects of PrEP, such as nausea, headaches, and fatigue, could potentially impact your overall well-being. However, many people experience minimal side effects or none at all. It's also important to consider how PrEP may positively influence your mental health by reducing anxiety about HIV risk. Open communication with your healthcare provider can help tailor a plan that accommodates both your PrEP needs and chronic pain management. If you're feeling overwhelmed, consider connecting with a mental health professional or support group for additional support.",English,0
21,How can I communicate my concerns about PrEP and chronic pain management with my healthcare provider effectively?,"It's great that you're looking to communicate openly with your healthcare provider. Here are a few tips: 

1. **Prepare Your Thoughts:** Write down your concerns about how PrEP might affect your chronic pain management and any specific questions you have.

2. **Be Honest:** Share your experiences with chronic pain and how it impacts your daily life. 

3. **Discuss Options:** Ask about both oral and injectable PrEP, and how they might fit into your current treatment plan.

4. **Express Your Fears:** Don’t hesitate to mention any stigma or anxiety you feel about starting PrEP.

Your provider is there to support you, and open dialogue is key to finding the best plan for your health.",English,0
22,what speciifc sdie effects of PrEP should I be 4w4er of that might 1mp4ct my chronic pain management? 😕,"It's understandable to feel concerned about how PrEP might affect your chronic pain management. Common side effects of oral PrEP (like tenofovir/emtricitabine) can include nausea, fatigue, and headaches, while injectable PrEP (like cabotegravir) might cause injection site reactions or fatigue. These could potentially impact your overall comfort. It’s essential to discuss your specific health concerns with a healthcare provider, who can help tailor a plan that considers your chronic pain and PrEP. Remember, addressing stigma and emotional challenges is important too, and support from professionals can be beneficial. If you’re feeling overwhelmed, consider reaching out to a mental health resource.",English,1
23,How can I discuss my concerns about PrEP and chronic pain with my healthcare provider to ensure I receive the best support?,"It’s great that you want to communicate openly with your healthcare provider. Start by preparing a list of your concerns regarding how PrEP might affect your chronic pain management. Be honest about your experiences, including any fears of increased pain or complications. Ask specific questions about how PrEP could fit into your current treatment plan and discuss any potential side effects. It may also help to inquire about both oral and injectable PrEP options, as one may be more manageable for you. Remember, your feelings are valid, and seeking support is a positive step. If you feel overwhelmed, consider talking to a mental health professional who can help you navigate these emotions.",English,0
24,what specific questions shuld i ask my healthcare provider to understanx how prep might interact w1th my pain management medications,"It's great that you're preparing to discuss PrEP with your healthcare provider! Here are some specific questions you can ask:

1. How might PrEP interact with my current pain management medications?
2. Are there specific side effects of PrEP that could affect my chronic pain or pain management?
3. Can you recommend strategies to manage any potential interactions?
4. How will you monitor my health while I’m on PrEP and pain management medications?
5. Are there alternative pain management options that are compatible with PrEP?

Remember, open communication with your provider is key to finding a treatment plan that works for you.",English,1
25,what are the common sdie rffects of PrEP that I should be aware of especiall in relation to my chronic pain,"Common side effects of PrEP, whether oral or injectable, can include nausea, fatigue, headaches, and gastrointestinal issues. Most side effects are mild and often improve within a few weeks. Given your chronic pain, it's important to discuss any potential interactions with your current treatment plan with a healthcare provider. They can help you weigh the benefits of PrEP against any concerns related to your pain management. It's understandable to feel anxious about starting PrEP, especially with the stigma surrounding it. If you're feeling overwhelmed, consider reaching out to a mental health professional or support group for guidance. You're not alone in this journey.",English,1
26,How can I manage the side effects of PrEP while also dealing with my chronic pain?,"It's understandable to feel concerned about managing both PrEP and chronic pain. Common side effects of PrEP can include nausea, headaches, and fatigue, but many people find that these effects lessen over time. Open communication with your healthcare provider is essential; they can help tailor your regimen and manage any side effects you experience. Additionally, consider discussing your chronic pain management strategies with them, as they may offer insights on balancing both treatments. If you’re feeling overwhelmed, connecting with a mental health professional can provide support. Remember, you’re not alone in this, and there are resources available to help you navigate these challenges.",English,0
27,What specific strategies can I use to minimize nausea from PrEP while managing my chronic pain?,"It's understandable to feel concerned about managing both PrEP and chronic pain. While I can’t provide medical advice, some general strategies include taking PrEP with food to help minimize nausea, staying well-hydrated, and discussing your pain management plan with your healthcare provider. They can help you find a treatment regimen that accommodates both your pain and PrEP. 

If you’re feeling overwhelmed, consider reaching out to a mental health professional or a support group. They can provide a safe space to share your feelings and concerns about stigma and health management. You're not alone in this journey!",English,0
28,h-how can i talk to my h3al7hc4r3 provider about my oncerns with starting teeep while managing my chronic pain,"It's important to have an open and honest conversation with your healthcare provider about your concerns. You might start by expressing your feelings about managing chronic pain and how you worry that starting PrEP could complicate things. You can ask questions about the potential impact of PrEP on your pain management and any interactions with your current medications. Remember, your provider is there to support you and help find a solution that's right for your health. If you feel comfortable, you can also discuss any stigma or fears you have regarding PrEP. It may help to bring a list of your concerns to the appointment.",English,1
29,What specific questions should I prepare to ask my healthcare provider about the potential interactions between my chronic pain medications and PrEP?,"It's great that you're preparing for your appointment! Here are some specific questions you might consider asking:

1. Are there any known interactions between my current pain medications and PrEP, either oral or injectable?
2. How will PrEP affect my chronic pain management?
3. What side effects should I be aware of that could impact my pain levels?
4. Can you recommend strategies for managing any potential side effects?
5. How often will I need to follow up for monitoring while on PrEP?

Remember, it's important to share your concerns about both your chronic pain and starting PrEP. Your healthcare provider can help you navigate this journey.",English,0
30,what are the best practices for managinnng chronic ain while 57ar71ng on prep,"Managing chronic pain while starting PrEP is important for your overall well-being. It's essential to communicate openly with your healthcare provider about your chronic pain and any concerns regarding PrEP. They can help tailor a treatment plan that accommodates both your pain management and PrEP needs. 

Consider incorporating self-care strategies that work for you, such as physical therapy, mindfulness, or gentle exercises, which may help alleviate pain. Don’t hesitate to seek support from mental health professionals if you're feeling overwhelmed. Remember, it’s okay to prioritize your health and discuss any stigma or fears you may have surrounding both your chronic pain and PrEP. You’re not alone in this journey.",English,1
