turn,user,bot,language,has_error
1,Q-Quais são os efeitos dolaterais ra PrEEEP qu3 eu devo estar ciente,"Os efeitos colaterais da PrEP, tanto na forma oral quanto injetável, podem incluir náuseas, dor de cabeça, fadiga e, em alguns casos, desconforto gastrointestinal. Esses efeitos geralmente são temporários e muitas pessoas não experimentam nenhum. É importante lembrar que a PrEP é segura e eficaz na prevenção do HIV. Se você tiver preocupações sobre efeitos colaterais, é uma boa ideia conversar com um profissional de saúde. Se você estiver enfrentando dificuldades para acessar informações ou apoio, considere procurar organizações locais que oferecem ajuda a pessoas em situação de abrigo. Você não está sozinho nessa jornada.",Portuguese,0
2,Como posso conseguir acesso à PrEP mesmo vivendo em um abrigo?,"É compreensível se sentir preocupado com o acesso à PrEP em sua situação. A PrEP, que pode ser oral ou injetável, está disponível em muitos centros de saúde, clínicas comunitárias e programas de assistência. Você pode procurar serviços de saúde que atendem pessoas em situação de vulnerabilidade, pois muitas vezes oferecem suporte gratuito ou de baixo custo.

Além disso, algumas organizações sem fins lucrativos oferecem recursos e apoio para pessoas que enfrentam estigma. Se sentir sobrecarregado ou ansioso pode ser comum, e não hesite em buscar ajuda profissional para conversar sobre esses sentimentos. Você não está sozinho nessa jornada.",Portuguese,0
3,qu415 organzaõçes ou centros de saúde 3m minha área oferecem PrEP e qpoio para pessoas em situação de abrigo?,"É compreensível que você esteja preocupado com o acesso à PrEP e ao apoio em sua situação. Muitas organizações e centros de saúde oferecem PrEP e podem fornecer suporte específico para pessoas em situação de abrigo. Sugiro procurar serviços de saúde pública ou organizações locais voltadas para a saúde sexual. Eles podem oferecer informações sobre PrEP, além de apoio psicológico e social. Se sentir medo ou estigmatização, lembre-se de que você não está sozinho e buscar ajuda é um passo importante. Para apoio emocional, considere entrar em contato com profissionais ou grupos de apoio na sua área. Você merece cuidado e respeito.",Portuguese,1
4,Como posso me sentir mais seguro ao pedir informações sobre PrEP em um centro de saúde?,"É compreensível sentir-se ansioso ao buscar informações sobre PrEP, especialmente em um ambiente onde você pode se preocupar com o julgamento. Lembre-se de que os profissionais de saúde estão lá para ajudar, e a confidencialidade é uma prioridade. Você pode começar perguntando sobre a PrEP de forma geral, sem entrar em detalhes pessoais, para se sentir mais confortável. 

Tente também levar um amigo ou alguém de confiança, se possível. Se você sentir que precisa de apoio emocional, considere falar com um profissional de saúde mental ou um grupo de apoio, que pode oferecer um espaço seguro para discutir suas preocupações. Você não está sozinho nessa!",Portuguese,0
5,Onde posso encontrar centros de saúde que oferecem PrEP sem julgamento?,"É compreensível se sentir preocupado. Muitos centros de saúde oferecem PrEP de forma inclusiva e sem julgamento. Você pode procurar por clínicas de saúde comunitária ou serviços de saúde sexual na sua área. Além disso, algumas organizações sem fins lucrativos focadas em saúde LGBTQ+ costumam ter programas de apoio e podem ajudar a acessar medicamentos. Se precisar de apoio emocional, considere entrar em contato com profissionais de saúde mental, que podem oferecer assistência em um ambiente seguro. Se precisar de mais informações, estou aqui para ajudar!",Portuguese,0
6,Quais são os requisitos para obter PrEP em centros de saúde que aceitam pacientes em situações vulneráveis?,"Para obter PrEP em centros de saúde que atendem pacientes em situações vulneráveis, geralmente você precisará passar por uma avaliação inicial, que inclui um teste de HIV e uma consulta médica para discutir seu histórico de saúde. Alguns centros podem ter programas específicos para ajudar pessoas em situação de abrigo.

É importante lembrar que a PrEP pode ser oferecida tanto em forma de comprimidos diários quanto de injeções mensais. Se você se sentir preocupado ou estigmatizado ao buscar ajuda, considere conversar com profissionais de saúde que estão capacitados para oferecer suporte sem julgamentos. Existem organizações que podem ajudar com questões de saúde mental e estigma.",Portuguese,0
7,o-onde posso encontrar centros de saúde que oferecem PrE 3 apoio p4r4 like pessoas em situação de abrigo abrigo,"Entendo a sua preocupação e desejo de acesso ao PrEP. No Brasil, muitos centros de saúde, como os postos do SUS, oferecem PrEP gratuitamente, incluindo apoio a pessoas em situação de abrigo. Você pode procurar o Centro de Testagem e Aconselhamento (CTA) mais próximo ou conversar com profissionais de saúde em unidades de saúde locais. 

Além disso, organizações não governamentais (ONGs) também podem oferecer suporte e informações. É importante lembrar que você merece apoio sem julgamento, e buscar ajuda é um passo corajoso. Se precisar de suporte emocional, considere entrar em contato com um profissional de saúde mental.",Portuguese,1
8,Quais documentos ou 1nf0rm4çõ35 eu preciso idk levr para acessar o PrEP em um centro de saúde,"Para acessar a PrEP em um centro de saúde, geralmente você precisa levar alguns documentos, como:

1. **Documento de Identidade**: Pode ser RG ou CPF.
2. **Comprovante de Residência**: Se você não tiver um endereço fixo, explique sua situação ao profissional de saúde.
3. **Cartão do SUS**: Se você tiver, é importante, mas não é obrigatório.

Além disso, é útil estar preparado para discutir seu histórico de saúde e suas preocupações. Lembre-se que você tem o direito de receber atendimento sem julgamento. Se sentir dificuldades emocionais ou medo de estigmas, considere buscar apoio de grupos de suporte ou profissionais de saúde mental. Você não está sozinho nessa.",Portuguese,1
9,Onde posso ecnontrar um centro se asúde que idk ofereça Pr3P perto do abrgio onde estou morando?,"É compreensível se sentir preocupado em buscar ajuda, especialmente em uma situação difícil. Você pode encontrar centros de saúde que oferecem PrEP, como clínicas de saúde pública, hospitais e centros de testagem de HIV. No Brasil, o Sistema Único de Saúde (SUS) fornece acesso ao PrEP. Sugiro procurar locais que atendam à população LGBT ou serviços especializados em saúde sexual. Se precisar de apoio emocional ou sentir medo do julgamento, considere entrar em contato com organizações locais que oferecem suporte e uma abordagem acolhedora. Você não está sozinho nessa jornada.",Portuguese,1
10,Quais documentos eu preciso levar para conseguir iniciar o tratamento com PrEP no SUS?,"Para iniciar o tratamento com PrEP no SUS, você geralmente precisará de alguns documentos básicos. É importante levar um documento de identidade com foto, como RG ou CNH, e um comprovante de residência. Também é recomendável ter um exame de HIV e outros exames de saúde que possam ser solicitados. 

Lembre-se de que você pode buscar apoio em serviços de saúde que oferecem assistência a pessoas em situação de abrigo, e eles podem ajudar a encontrar os recursos necessários. Se sentir medo ou estigma, considere conversar com um profissional de saúde ou um psicólogo que possa oferecer suporte. Você não está sozinho nessa jornada.",Portuguese,0
11,Existem serviços de saúde que oferecem apoio específico para pessoas em situação de abrigo que precisam de PrEP?,"Sim, existem serviços de saúde que oferecem apoio específico para pessoas em situação de abrigo, incluindo acesso à PrEP. Muitas organizações comunitárias e centros de saúde oferecem programas que ajudam a fornecer medicamentos e suporte emocional, sem julgamento. É importante procurar por clínicas locais ou organizações que trabalham com saúde sexual e prevenção do HIV. Você também pode entrar em contato com serviços de saúde pública, pois eles podem ter recursos adicionais e informações sobre como acessar a PrEP, tanto na forma oral quanto injetável. Lembre-se de que você merece apoio e cuidado.",Portuguese,0
12,Como posso encontrar uma clínica de saúde próxima que forneça PrEP sem causar constrangimento?,"Entendo que essa situação pode ser difícil, mas é importante saber que você não está sozinho. Muitas clínicas oferecem PrEP e têm profissionais treinados para tratar todos com respeito e discrição. Você pode tentar procurar por serviços de saúde locais, organizações de apoio a pessoas vivendo com HIV, ou até mesmo grupos comunitários. Algumas opções incluem o Sistema Único de Saúde (SUS) no Brasil, que oferece acesso gratuito a medicamentos. Além disso, plataformas online podem te ajudar a localizar serviços próximos. Se precisar de apoio emocional, considere conversar com profissionais de saúde mental. Lembre-se, buscar ajuda é um passo importante!",Portuguese,0
13,Quais são os criférios para me qualificar para o uso da PrEP 3 c0m0 posso obtê-la sem exopr minha situqçã?o 😕,"Para se qualificar para o uso da PrEP (profilaxia pré-exposição), geralmente é necessário ser HIV-negativo, ter uma avaliação de risco para infecção pelo HIV e passar por exames de saúde regulares. A PrEP está disponível em formas orais e injetáveis.

Para obtê-la de forma discreta, você pode procurar serviços de saúde que ofereçam atendimento confidencial. Muitas cidades têm clínicas que atendem pessoas em situação de vulnerabilidade, onde você pode receber apoio sem julgamento. Além disso, considere entrar em contato com organizações locais de saúde ou apoio a pessoas vivendo com HIV para orientação. Lembre-se, você não está sozinho nessa jornada!",Portuguese,1
14,0md3 psoso encontrar clíniczs que oferecem PrEP uh de forma confidencial e gratuiya 3m minha região?,"Entendo suas preocupações e a busca por apoio é muito importante. Existem clínicas de saúde e organizações comunitárias que oferecem PrEP de forma confidencial e gratuita. Uma opção é procurar centros de saúde pública ou ONGs que trabalham com saúde sexual. Muitas vezes, esses locais têm profissionais capacitados para atender sem julgamentos.

Você também pode buscar informações em sites especializados em saúde LGBTQ+ ou em linhas de apoio locais, que podem ajudar a encontrar serviços na sua região. Lembre-se de que você merece acesso a cuidados de saúde adequados. Se precisar de apoio emocional, considere entrar em contato com profissionais de saúde mental.",Portuguese,1
15,Como posso me proteger do HIV enquanto busco tratamento para PrEP em um abrigo?,"Entendo que sua situação pode ser desafiadora, mas é importante saber que existem opções para se proteger do HIV. A PrEP pode ser tomada de forma oral diariamente ou recebida como uma injeção a cada dois meses. Você pode procurar serviços de saúde que ofereçam PrEP, muitos deles são gratuitos ou baseados na renda. 

Além disso, usar preservativos durante relações sexuais é uma forma eficaz de se proteger. Se você se sentir confortável, considere entrar em contato com profissionais de saúde ou organizações que atendem à sua comunidade, pois podem oferecer suporte sem julgamentos. Você não está sozinho nessa jornada.",Portuguese,0
16,quais são 05 locais em São Pauol onde posso encontrar serviços gragu1705 de PrEP?,"Em São Paulo, você pode encontrar serviços gratuitos de PrEP em diversos locais, incluindo:

1. **Centro de Referência e Treinamento em DST/Aids (CRT)** - Oferece serviços especializados.
2. **Unidades Básicas de Saúde (UBS)** - Muitas UBS têm programas de prevenção ao HIV, incluindo PrEP.
3. **Hospitais públicos** - Alguns hospitais têm clínicas de infectologia que oferecem PrEP.
4. **Serviço de Atendimento Especializado (SAE)** - Esses serviços estão disponíveis em vários pontos da cidade.
5. **Organizações não governamentais (ONGs)** - Muitas ONGs que atuam na área de saúde sexual oferecem informações e acesso à PrEP.

Lembre-se de buscar apoio e não hesitar em pedir ajuda. Você não está sozinho nessa.",Portuguese,1
17,"oCno posso me sentir mais seguro ao buscar essas informações e serviços, considerando a minha 5i7uação? 5i7uação?","É compreensível sentir-se inseguro ao buscar informações e serviços, especialmente em uma situação difícil. A PrEP, que pode ser tomada em forma de comprimidos diários ou injeções mensais, é uma ferramenta eficaz para prevenir o HIV. Muitas organizações oferecem suporte e serviços de saúde de forma confidencial, sem julgamento. É importante lembrar que você merece acesso a cuidados de saúde, independentemente da sua situação. Se você se sentir confortável, considere entrar em contato com grupos de apoio ou serviços de saúde locais, que podem oferecer assistência e orientações. Você não está sozinho nessa jornada.",Portuguese,1
18,Onde posso encontrar serviços de saúde que oferecem PrEP de forma acessível e sem julgamento?,"É compreensível se sentir preocupado com o acesso a serviços de saúde. Muitas cidades têm clínicas que oferecem PrEP, às vezes gratuitamente ou a preços reduzidos. Você pode procurar por centros de saúde comunitários, ONGs ou serviços de saúde pública que atendam à população LGBTQ+. Além disso, algumas organizações oferecem suporte emocional e informações sem julgamento. Se precisar de ajuda para encontrar esses serviços, considere entrar em contato com um profissional de saúde ou uma linha direta de apoio em sua região. Lembre-se de que você merece apoio e cuidados adequados.",Portuguese,0
19,q-quais eão os documentos ou requisitos necessários para c0n53gu1r a PrEP em clínicas c0mun1tár145? 😕,"Para acessar a PrEP em clínicas comunitárias, geralmente você precisará de alguns documentos básicos, como um documento de identidade, comprovante de residência e, em alguns casos, um exame de HIV recente. É importante também passar por uma avaliação médica, que pode incluir testes para outras infecções sexualmente transmissíveis. 

Se você se sentir inseguro ou preocupado com a possibilidade de julgamento, saiba que muitas clínicas têm um ambiente acolhedor e respeitoso. Se precisar de apoio emocional, considere entrar em contato com profissionais de saúde mental ou organizações que atendem pessoas em situações semelhantes. Você não está sozinho nessa!",Portuguese,1
20,como posso ecnontrar umz clínica comunitária que ofereeeça um Pr3P sem precisar de documentos que não tenno,"É compreensível se sentir preocupado com o acesso à PrEP, especialmente em sua situação. Muitas clínicas comunitárias oferecem serviços de saúde sem a necessidade de documentos completos. Para encontrar uma clínica perto de você, considere as seguintes opções:

1. **Organizações locais de saúde**: Procure por ONGs ou instituições de saúde em sua área que trabalham com prevenção de HIV. Elas podem ter programas específicos para pessoas em situações vulneráveis.

2. **Linhas de ajuda**: Muitas cidades têm linhas de ajuda onde você pode informar sua situação e receber orientações sobre onde ir.

3. **Serviços de saúde pública**: Consulte os serviços de saúde pública da sua cidade. Eles costumam ser mais flexíveis em relação à documentação.

Lembre-se de que você merece apoio sem julgamento. Se precisar, considere conversar com um profissional de saúde mental.",Portuguese,1
21,quais são 05 efeitos colaterais ma1s omuns da PrEP e como posso gdrenciá-los?,"Os efeitos colaterais mais comuns da PrEP incluem:

1. Náuseas
2. Dor de cabeça
3. Fadiga
4. Diarreia
5. Aumento de enzimas hepáticas

Muitas pessoas relatam que esses efeitos tendem a diminuir após algumas semanas de uso. É importante conversar com um profissional de saúde sobre qualquer efeito colateral que você experimente para receber o suporte adequado. Se você está preocupado com o acesso a cuidados médicos ou com o estigma, considere procurar organizações locais que oferecem suporte e informação sobre saúde sexual. Você não está sozinho nessa jornada, e é possível encontrar ajuda.",Portuguese,1
22,onde posso encontrar serviços de saúde que ofereçam PrEP gratuitamente lu a baixo custo em minha área 🙄,"É compreensível se sentir preocupado com o acesso a medicamentos enquanto enfrenta desafios. No Brasil, você pode procurar serviços de saúde pública, como os Centros de Testagem e Aconselhamento (CTA) e unidades de saúde que oferecem serviços de prevenção ao HIV. Muitas vezes, a PrEP é disponibilizada gratuitamente ou a baixo custo. 

Além disso, algumas ONGs e organizações comunitárias podem oferecer suporte e informações. Se você se sentir confortável, buscar ajuda de profissionais de saúde pode ser um passo importante. Lembre-se de que você não está sozinho e há recursos disponíveis para te apoiar.",Portuguese,1
23,Quais documentos ou informações eu preciso levar para acessar a PrEP nesses serviços de saúde?,"Para acessar a PrEP, geralmente você precisará de documentos como um documento de identidade (RG ou CPF), comprovante de residência e, em alguns casos, exames de sangue que atestem sua saúde e a ausência do HIV. É importante consultar os serviços de saúde disponíveis na sua região, pois eles podem ter requisitos específicos. 

Se você estiver enfrentando dificuldades para obter esses documentos ou se sentir inseguro ao buscar ajuda, lembre-se de que existem profissionais que podem oferecer apoio sem julgamento. Não hesite em procurar grupos de apoio ou serviços de saúde que tratem o tema de forma inclusiva. Você não está sozinho nessa!",Portuguese,0
24,Como posso encontrar serviços de saúde que ofereçam PrEP de forma acessível e sem discriminação?,"É compreensível se sentir preocupado com o acesso a serviços de saúde. Uma boa opção é procurar centros de saúde comunitários ou organizações que trabalham com HIV e saúde sexual. Muitas vezes, eles oferecem PrEP sem custo ou com preços reduzidos, além de um ambiente acolhedor e sem julgamento. 

Você também pode verificar se há programas de assistência em sua área, que podem ajudar a cobrir o custo dos medicamentos. Não hesite em buscar apoio; você merece cuidados sem discriminação. Se precisar, procure grupos de apoio ou profissionais de saúde mental para lidar com o estigma e as emoções que você pode estar enfrentando.",Portuguese,0
25,Quais são os sinais de que eu posso estar me expondo ao HIV e quando devo considerar começar a usar PrEP?,"É importante estar ciente de que o HIV pode ser transmitido através de relações sexuais desprotegidas, compartilhamento de agulhas ou de mãe para filho durante a gravidez ou amamentação. Se você estiver em uma situação em que tenha essas exposições, pode ser hora de considerar a PrEP. A PrEP é uma forma eficaz de prevenir a infecção pelo HIV e está disponível em opções orais e injetáveis.

Se você sente medo de buscar ajuda por causa da sua situação, saiba que isso é compreensível. Procure profissionais de saúde que possam oferecer apoio sem julgamento. Existem também organizações que podem ajudar com acesso a medicamentos e informações. Você não está sozinho nessa.",Portuguese,0
26,Onde posso encontrar informações sobre como acessar a PrEP mesmo vivendo em um abrigo?,"Entendo que pode ser desafiador acessar informações e serviços de saúde vivendo em um abrigo. A PrEP, que pode ser tomada por via oral ou injetável, está disponível em várias unidades de saúde e clínicas especializadas. Recomendo procurar centros de saúde locais, ONGs ou programas de saúde pública que atendem a populações vulneráveis. Muitas vezes, eles oferecem suporte específico e podem ajudar a superar barreiras de acesso. Se sentir medo ou estigmatizado, saiba que é natural, e existem profissionais prontos para apoiar você sem julgamentos. Não hesite em buscar ajuda, pois você merece cuidar da sua saúde.",Portuguese,0
27,qu41s sãl idk os centros de saúde ou ONGs que oferecem PrEP e que são mais acessíveis para quem está em sitaução de abrigo? abrigo?,"É compreensível se sentir preocupado com o acesso à PrEP, especialmente em uma situação de abrigo. Muitas ONGs e centros de saúde têm programas para ajudar pessoas em sua situação. No Brasil, você pode procurar pelo programa ""Saúde na Hora"" ou centros de referência em DST/Aids, onde a PrEP pode ser oferecida de forma gratuita. Além disso, algumas ONGs, como a ""ABIA"" e ""GIV"", podem ter informações sobre serviços disponíveis. Lembre-se de que buscar ajuda é um passo importante, e não há motivo para se sentir envergonhado. Se você se sentir confortável, converse com profissionais de saúde locais, que podem oferecer apoio sem julgamento.",Portuguese,1
28,como posso me proteger e garantir qu3 73nha 4c3ss0 à PrEP se predisar me mudar d3 abrigo,"Entendo que sua situação pode ser desafiadora, mas é importante saber que você tem opções para se proteger do HIV. A PrEP, que pode ser oral ou injetável, é uma forma eficaz de prevenção. Para acessar a PrEP, você pode procurar serviços de saúde locais, que muitas vezes oferecem apoio a pessoas em situação vulnerável.

É compreensível sentir medo do julgamento, mas lembre-se de que muitos profissionais de saúde estão lá para ajudar, não para julgar. Se você se sentir sobrecarregado, considere buscar apoio psicológico ou grupos de apoio na sua área. Eles podem fornecer um espaço seguro para você compartilhar suas preocupações.",Portuguese,1
29,quais 5ão os passos qqque posso seguir praa me conectar a um idk serviço de saúde qud ofereça PrEP enquanto estou morando em um abrigo abrigo,"É compreensível que a situação de abrigo possa dificultar o acesso a serviços de saúde. Aqui estão cinco passos que você pode seguir para se conectar a um serviço que oferece PrEP:

1. **Pesquise locais próximos**: Procure centros de saúde, clínicas de saúde comunitária ou hospitais que ofereçam serviços de PrEP. Sites como o do Ministério da Saúde ou ONGs podem ajudar.

2. **Converse com profissionais de saúde**: Se houver um médico ou enfermeiro no abrigo, pergunte sobre onde você pode obter PrEP.

3. **Contato com ONGs**: Muitas organizações oferecem assistência e podem ajudar você a acessar a PrEP.

4. **Solicite apoio**: Envolva amigos ou pessoas de confiança para ajudar a buscar informações.

5. **Atenda a consultas**: Quando encontrar um serviço, agende uma consulta para discutir suas preocupações e opções de PrEP, que incluem formas orais e injetáveis. 

Lembre-se de que buscar ajuda é um passo importante e você merece apoio.",Portuguese,1
30,q-quais OGs ou 5erv1ç0s de saúde na minha ár3a podem me ajudar s acessar a PrEP,"É compreensível se sentir preocupado com o acesso à PrEP, especialmente em sua situação. Recomendo procurar serviços de saúde locais, como centros de saúde comunitários, clínicas de saúde sexual ou programas de prevenção ao HIV, que costumam oferecer PrEP. Muitas vezes, esses serviços têm profissionais treinados para ajudar e podem oferecer apoio sem julgamento. 

Organizações não governamentais (ONGs) que trabalham com saúde e direitos humanos também podem ser um bom recurso. Elas podem fornecer informações sobre como acessar a PrEP e até ajudar com questões financeiras. Lembre-se, você merece cuidar da sua saúde e buscar apoio.",Portuguese,1
