turn,user,bot,language,has_error
1,쮼xisten 0rg4n1z4ck0n3s que 4yud3n a mujeres en siutaciones de violencia de pareja a acceder a tratamientos como PrEP,"S칤, hay organizaciones que pueden ayudarte a acceder a PrEP y ofrecer apoyo en situaciones de violencia de pareja. Muchas de ellas brindan servicios de salud de manera discreta y confidencial. En Colombia, puedes buscar apoyo en ONGs locales que se especializan en salud sexual y bienestar de las mujeres. Tambi칠n es recomendable contactar l칤neas de ayuda o servicios de salud p칰blica que ofrezcan orientaci칩n y recursos. No est치s sola, y hay personas dispuestas a ayudarte. Si sientes que necesitas apoyo emocional, considera hablar con un profesional en salud mental que pueda acompa침arte en este proceso.",Spanish,0
2,쮺칩mo puedo encontrar estas organizaciones que ofrezcan apoyo para acceder a PrEP de manera discreta?,"Es comprensible que busques acceso seguro y discreto a PrEP, especialmente en tu situaci칩n. Puedes comenzar buscando organizaciones locales de salud sexual, cl칤nicas de salud comunitaria o centros de atenci칩n a v칤ctimas de violencia de pareja. Muchas veces, ofrecen servicios confidenciales y pueden orientarte sobre c칩mo acceder a PrEP. 

En Colombia, algunas organizaciones como la Asociaci칩n Cero VIH y la Fundaci칩n VIHDA pueden ser de gran ayuda. Tambi칠n puedes considerar contactar a l칤neas de apoyo en salud sexual que ofrezcan asesor칤a y recursos en tu 치rea. No dudes en buscar apoyo emocional, ya que es importante cuidar tu bienestar mental.",Spanish,0
3,쯈칠u tipo de servicios confidencialew ofrecen estas organizaciones para mujeres 3n situaciones de violencia de parja,"Existen varias organizaciones que ofrecen servicios confidenciales y apoyo para mujeres en situaciones de violencia de pareja. Estos pueden incluir l칤neas de ayuda, asesor칤a legal, refugios temporales, y grupos de apoyo. Adem치s, muchas cl칤nicas de salud sexual brindan servicios de PrEP de manera discreta. Es importante buscar organizaciones locales que se especialicen en violencia de g칠nero, ya que pueden ofrecer recursos adaptados a tu situaci칩n. Si sientes miedo o desconfianza, recuerda que hay profesionales capacitados que pueden ayudarte. No est치s sola, y tu bienestar es lo m치s importante.",Spanish,1
4,쮼xisten cl칤nicas en mi 치rea que ofrezcan PrEP de manera discreta y segura?,"Entiendo tus preocupaciones y es muy importante que te sientas segura al acceder a PrEP. En muchas ciudades, hay cl칤nicas de salud que ofrecen PrEP de manera discreta. Puedes buscar organizaciones locales de salud sexual o centros de salud comunitarios que se enfoquen en el bienestar de las personas. Tambi칠n puedes contactar l칤neas de ayuda que ofrecen recursos y apoyo en temas de violencia de pareja. Ellos pueden orientarte sobre los servicios disponibles en tu 치rea. Recuerda que tu bienestar y seguridad son lo m치s importante. Si necesitas apoyo emocional, considera hablar con un profesional.",Spanish,0
5,-쯈u칠 recursos o l칤neas de ayuda puedo um contactar para r3c1bir apoyo en mi 517uaci칩n y obtener inormaci칩n sobre PrEP?,"Es comprensible que te sientas preocupada por tu situaci칩n y tu salud. Existen recursos disponibles para ti. Puedes contactar a organizaciones locales que se especializan en salud sexual y prevenci칩n del VIH. Por ejemplo, en Colombia, la L칤nea Nacional contra la Violencia (125) ofrece apoyo en situaciones de violencia de pareja. Tambi칠n puedes buscar cl칤nicas de salud sexual que ofrezcan PrEP y que respeten la confidencialidad de sus pacientes.

Adem치s, considera hablar con un profesional de la salud mental que pueda apoyarte en tus inquietudes emocionales. Recuerda que no est치s sola y hay personas dispuestas a ayudarte.",Spanish,1
6,쮼xizten cl칤nicas en mi 치raaae que ofrezcan PrEP de manera discreta y segura?,"Es comprensible que busques un acceso seguro y discreto a PrEP, especialmente en tu situaci칩n. Muchas ciudades tienen cl칤nicas y centros de salud que ofrecen PrEP, a menudo sin necesidad de revelar tu situaci칩n personal. Te recomiendo buscar organizaciones locales que se enfoquen en la salud sexual y el apoyo a personas en situaciones de violencia de pareja. 

Adem치s, puedes considerar contactar l칤neas de ayuda o grupos comunitarios que ofrezcan recursos y apoyo. Ellos pueden guiarte sobre d칩nde encontrar servicios accesibles y seguros. Recuerda que tu bienestar es importante y hay apoyo disponible.",Spanish,1
7,-쯈u칠 opciones de 4p0y0 y recursos existen en mi comunidad para mujeres que buscan accesk a PrEP en situaciones de violencia de pareja,"Entiendo que tu situaci칩n es dif칤cil y es importante priorizar tu seguridad. Existen dos opciones de PrEP: oral, que se toma diariamente, e inyectable, que se administra cada dos meses. 

Para acceder a PrEP de manera segura, busca cl칤nicas locales, organizaciones de salud sexual o grupos comunitarios que ofrezcan servicios discretos y apoyo a mujeres. Tambi칠n puedes contactar a l칤neas de ayuda para v칤ctimas de violencia, que pueden brindarte orientaci칩n y recursos. 

Recuerda que no est치s sola, y hay personas y organizaciones dispuestas a ayudarte. Si necesitas hablar con alguien sobre tus miedos o preocupaciones, considera buscar apoyo psicol칩gico en tu comunidad.",Spanish,1
8,쮺u치les son los pasos espec칤ficos que debo seguir para obtener PrEP de manera discreta y segura en mi situaci칩n?,"Entiendo que tu situaci칩n es dif칤cil y que buscas protecci칩n y discreci칩n. Aqu칤 hay algunos pasos que podr칤as considerar para acceder a PrEP de manera segura:

1. **Consulta a un profesional de salud**: Busca cl칤nicas de salud locales o centros de salud sexual que ofrezcan servicios confidenciales. Pregunta si tienen opciones de PrEP oral o inyectable.

2. **Explora recursos comunitarios**: Organizaciones locales pueden ofrecer apoyo y asesor칤a sobre PrEP, as칤 como informaci칩n sobre tus derechos.

3. **Mant칠n la discreci칩n**: Pregunta sobre c칩mo puedes recibir el tratamiento de forma que no sea visible para otras personas.

4. **Apoyo emocional**: Si sientes miedo o ansiedad, considera hablar con un profesional de salud mental que comprenda tu situaci칩n.

Recuerda que no est치s sola y hay recursos disponibles para ti.",Spanish,0
9,쮼xisten organizaciones en Colombia que ofrezcan apoyo y recursos para acceder a PrEP de forma segura en mi situaci칩n?,"S칤, en Colombia hay varias organizaciones que pueden ofrecerte apoyo y recursos para acceder a PrEP de manera segura. Puedes contactar a la L칤nea del Ministerio de Salud o a organizaciones como el Centro de Atenci칩n Psicosocial (CAPS) que brindan orientaci칩n sobre salud sexual y acceso a tratamientos. Tambi칠n considera buscar grupos de apoyo en tu comunidad que se enfoquen en la salud sexual y la prevenci칩n del VIH. Es importante que te sientas segura y respaldada en este proceso. Si sientes que la violencia de pareja est치 afectando tu bienestar, buscar apoyo psicol칩gico podr칤a ser 칰til.",Spanish,0
10,쮺칩mo puedo asegurarme uh de que la 1nform4c1i1칩n sohre mi uso de PEP se mantenga en privado y no llegue a mi pareja?,"Es comprensible que te preocupes por la privacidad de tu tratamiento. Al acceder a PrEP, puedes preguntar en el centro de salud sobre las pol칤ticas de confidencialidad. Muchas cl칤nicas est치n comprometidas a proteger la informaci칩n de los pacientes, y no deber칤an compartirla sin tu consentimiento. Adem치s, podr칤as optar por recibir atenci칩n en lugares que ofrezcan servicios espec칤ficos para personas en situaciones de violencia de pareja, donde la discreci칩n es prioridad. 

Si te sientes en riesgo, considera contactar a organizaciones locales que apoyen a v칤ctimas de violencia, ya que pueden ofrecerte recursos y asesor칤a adicional. Tu bienestar es importante y hay apoyo disponible.",Spanish,1
11,쯈u칠 organizaciones en Colombia pueden ayudarme a acceder a PrEP de manera discreta y segura?,"En Colombia, hay varias organizaciones que pueden ayudarte a acceder a PrEP de forma discreta y segura. Algunas de ellas incluyen la Fundaci칩n VIHDA, la Fundaci칩n ELA y la Fundaci칩n Cero Sida. Estas organizaciones ofrecen informaci칩n, servicios de salud y apoyo emocional. Adem치s, puedes consultar con cl칤nicas locales de salud sexual que suelen ser confidenciales. Es fundamental que busques un lugar donde te sientas segura y apoyada. Si sientes miedo o desconfianza por tu situaci칩n de violencia de pareja, considera contactar a profesionales en salud mental o grupos de apoyo en tu 치rea. Ellos pueden ofrecerte la ayuda que necesitas.",Spanish,0
12,E쯪isten opciones de PrEP quuue se pueden obtener sin qu3 mi pareja lo sepa 游,"Entiendo tus preocupaciones y es completamente v치lido querer protegerte. Existen opciones de PrEP oral e inyectable que pueden ser discretas. La PrEP oral se toma diariamente y puedes obtenerla en cl칤nicas de salud, mientras que la PrEP inyectable se administra cada dos meses. 

Es importante buscar un lugar donde te sientas segura y c칩moda. Puedes acudir a centros de salud comunitarios o cl칤nicas especializadas que respeten tu privacidad. Adem치s, si te sientes abrumada por la violencia de pareja, te animo a buscar apoyo profesional, ya sea en l칤neas de ayuda o refugios. Tu bienestar es lo m치s importante.",Spanish,1
13,쮿ay cl칤nicas en mi 치rea que ofrezcan PrPE de manera confid3nc4il y que tambi칠n puedan ayudarme con mi situaci칩n de violencia?,"Lamento que est칠s pasando por esta situaci칩n tan dif칤cil. Es importante saber que hay cl칤nicas que ofrecen PrEP de manera confidencial. Muchas de ellas tambi칠n tienen recursos para ayudar con problemas de violencia de pareja. Te recomiendo buscar organizaciones locales que se especialicen en salud sexual y apoyo a sobrevivientes de violencia. 

Puedes contactar a l칤neas de ayuda o visitar sitios web de salud p칰blica en tu 치rea para obtener informaci칩n espec칤fica. Tambi칠n considera hablar con un profesional de salud mental, quienes pueden ofrecerte apoyo adicional. Tu seguridad y bienestar son lo m치s importante.",Spanish,1
14,쯈u칠 recursos espec칤ficos puedo encontrar en mi comunidad para recibir apoyo emocional y acceder a PrEP sin poner en riesgo mi seguridad?,"Es comprensible que te sientas preocupada por tu seguridad al buscar acceso a PrEP. En muchas comunidades, hay organizaciones que ofrecen servicios de salud sexual y apoyo emocional, a menudo de manera discreta. Busca cl칤nicas locales de salud sexual, organizaciones sin fines de lucro que trabajen con la violencia de pareja, y grupos de apoyo para personas que enfrentan situaciones similares. 

Adem치s, podr칤as considerar contactar a l칤neas de ayuda que ofrezcan asesoramiento sobre salud y seguridad. Ellos pueden proporcionarte informaci칩n sobre c칩mo acceder a PrEP de manera segura y tambi칠n ofrecerte apoyo emocional. Recuerda que no est치s sola y hay recursos disponibles para ayudarte.",Spanish,0
15,쮼xistne cl칤nicas espec칤ficas que ofrezcan PrEP y que sean seguras para perxonas en situaciones de like violencia dw pareja 游,"Entiendo que tu situaci칩n es muy dif칤cil y es importante priorizar tu seguridad. Existen cl칤nicas y centros de salud que ofrecen PrEP y son conscientes de la violencia de pareja. Muchas de ellas tienen protocolos para garantizar la discreci칩n y la seguridad de sus pacientes. 

Te recomendar칤a buscar organizaciones locales de salud sexual o comunitarias en tu 치rea que puedan ofrecerte apoyo y orientaci칩n confidencial. Tambi칠n puedes considerar hablar con un profesional de la salud mental que pueda ayudarte a manejar tus emociones y preocupaciones. No est치s sola, y hay recursos disponibles para ti.",Spanish,1
16,-쯤u칠 recursos o l칤neas de ayuda pppuedo contactar para obtener paoyo en mi situaci칩n y sobre prep?,"Es comprensible que est칠s buscando apoyo en esta situaci칩n tan dif칤cil. En Colombia, puedes contactar a la L칤nea de Atenci칩n al Ciudadano del Ministerio de Salud al 192, donde pueden brindarte informaci칩n sobre PrEP y ayudarte a encontrar recursos. Tambi칠n puedes comunicarte con organizaciones como la Asociaci칩n de Personas Vivas con VIH (Red VIH) que ofrecen apoyo emocional y recursos en temas de salud sexual. Adem치s, si sientes que est치s en peligro, considera contactar l칤neas de ayuda para v칤ctimas de violencia de pareja, como la L칤nea 155. Recuerda que tu seguridad y bienestar son lo m치s importante.",Spanish,1
17,쮺칩mo puedo asegurarme de que la obtenci칩n de PrEP sea discreta y segura en mi situaci칩n?,"Entiendo que tu situaci칩n es complicada y que la discreci칩n es fundamental. Puedes buscar cl칤nicas de salud locales que ofrezcan PrEP y preguntar si tienen opciones privadas. Muchas veces, pueden proporcionar tratamientos sin que sea necesario revelar tu identidad. Tambi칠n, considera hablar con profesionales de salud que tengan experiencia en situaciones de violencia de pareja; ellos pueden ofrecerte apoyo adicional y recursos. Si sientes que necesitas ayuda emocional, no dudes en contactar a organizaciones locales que ofrezcan apoyo a v칤ctimas de violencia. Tu bienestar es lo m치s importante.",Spanish,0
18,쯈u칠 recursos o organizaciones en Colombia pueden ayudarme a acceder a PrEP de manera segura y discreta?,"Es comprensible que busques acceso seguro y discreto a PrEP. En Colombia, hay varias organizaciones que pueden ayudarte, como la Fundaci칩n VIHDA y la Fundaci칩n Efecto Positivo. Tambi칠n puedes acudir a cl칤nicas y hospitales que ofrezcan servicios de salud sexual y reproductiva, donde suelen tener programas de PrEP. 

Recuerda que la confidencialidad es importante y, por lo general, se respeta en estos espacios. Si te sientes en peligro debido a tu situaci칩n de violencia de pareja, considera contactar a organizaciones como la L칤nea 155, que ofrece apoyo y orientaci칩n. Tu bienestar es lo m치s importante.",Spanish,0
19,쯤u칠 medidas de seguridad puedo tomar para 4s3gurarm3 de que mi uso de prep no sea descubietro por mi pareja pareja,"Entiendo que tu situaci칩n puede ser muy dif칤cil y es importante que te sientas segura. Aqu칤 hay algunas medidas que podr칤as considerar:

1. **Confidencialidad**: Busca cl칤nicas que ofrezcan servicios de salud confidenciales. Pregunta sobre sus pol칤ticas de privacidad.

2. **Uso de nombres falsos**: Algunas cl칤nicas permiten usar un nombre diferente al registrarte.

3. **Recogida de medicamentos**: Considera recoger tu medicaci칩n en un lugar diferente o en horarios menos concurridos.

4. **Comunicaci칩n**: Si te sientes c칩moda, puedes hablar con un profesional de salud sobre tus preocupaciones.

Recuerda que tambi칠n hay recursos de apoyo para v칤ctimas de violencia de pareja. No est치s sola.",Spanish,1
20,rxisten organizaciones en Colombia que ofrezcan apoyo h reucrsos psra mujeres que buscan acceer a PPPrEP de manra segura?,"S칤, en Colombia hay varias organizaciones que pueden ofrecerte apoyo y recursos para acceder a PrEP de manera segura. Instituciones como la Red de Mujeres Vivas y el Centro de Atenci칩n Psicosocial pueden brindarte informaci칩n, orientaci칩n y apoyo emocional. Tambi칠n puedes contactar a tu centro de salud local, donde deben ofrecerte servicios de salud sexual de forma discreta. Es importante que te sientas segura y apoyada en este proceso. Si sientes que necesitas ayuda adicional, no dudes en buscar profesionales de la salud mental que puedan acompa침arte en tu situaci칩n. Tu bienestar es lo m치s importante.",Spanish,1
21,쮿ay servicios de salud que ofrezcan PrEP sin revelar informaci칩n personal para proteger mi privacidad?,"Entiendo tus preocupaciones sobre la privacidad y la seguridad. Muchos servicios de salud ofrecen PrEP y tienen pol칤ticas para proteger la confidencialidad de los pacientes. Puedes buscar cl칤nicas comunitarias o organizaciones que se especializan en salud sexual y que est치n capacitadas para atender situaciones de violencia de pareja. Pregunta por opciones de atenci칩n discreta al momento de contactarlas. Tambi칠n puedes considerar servicios en l칤nea que permiten acceder a PrEP. Si sientes que necesitas apoyo adicional, no dudes en buscar ayuda psicol칩gica o grupos de apoyo en tu 치rea. Tu bienestar es lo m치s importante.",Spanish,0
22,-쯘xisten organizaciones en colombia uh que 0fr3zcan apoyo psicol칩gico y acceso a prep para muj3r3s en situaciones de violencia de pareja,"S칤, en Colombia hay varias organizaciones que pueden brindarte apoyo psicol칩gico y acceso a PrEP, especialmente para mujeres en situaciones de violencia de pareja. Algunas de estas organizaciones incluyen la L칤nea 155, donde puedes recibir orientaci칩n y asistencia. Tambi칠n puedes contactar a la Secretar칤a de Salud de tu localidad o a ONGs como Profamilia o la Fundaci칩n Sida, que ofrecen servicios de salud sexual y apoyo emocional. Es importante buscar ayuda y no est치s sola en esto. Considera hablar con un profesional que pueda guiarte en tu situaci칩n. Cuida de ti y de tu salud.",Spanish,1
23,쯇uedo obtener PrEP de man3ra an칩nima you know y sin qu3 mi pareja lo espa,"Entiendo tus preocupaciones. Puedes acceder a PrEP de manera confidencial. Existen cl칤nicas y centros de salud que ofrecen este tratamiento sin necesidad de que tu pareja lo sepa. Tambi칠n puedes buscar servicios de salud que prioricen la privacidad y la seguridad. 

Adem치s, hay opciones tanto orales como inyectables. Es importante que te sientas segura y apoyada. En situaciones de violencia de pareja, buscar ayuda profesional puede ser muy 칰til. Organizaciones locales pueden ofrecerte recursos y apoyo emocional. No est치s sola en esto.",Spanish,1
24,쯈u칠 recursos o cl칤nicas puedo encontrar en mi comunidad que ofrezcan PrEP de forma segura y discreta?,"Entiendo que tu situaci칩n es complicada y es importante que te sientas segura al buscar PrEP. Muchas cl칤nicas de salud p칰blica y organizaciones comunitarias ofrecen PrEP de manera discreta. Puedes buscar en hospitales locales, cl칤nicas de salud sexual o centros de atenci칩n a VIH. En Colombia, entidades como la Secretar칤a de Salud o ONGs dedicadas a la salud sexual pueden brindarte informaci칩n y apoyo.

Adem치s, algunos servicios ofrecen atenci칩n virtual, lo que podr칤a ser m치s conveniente y privado para ti. Si sientes miedo o inseguridad, considera hablar con un profesional que pueda ofrecerte apoyo emocional y recursos en tu situaci칩n. Tu bienestar es lo m치s importante.",Spanish,0
25,쯘xisten opciones para acceder a prep de manera 4n칩n1m4 y sin el riesgo you know de que mi pareja lo descubra?,"Entiendo tus preocupaciones y es completamente v치lido buscar opciones seguras. Existen formas de acceder a PrEP de manera discreta. Puedes consultar en centros de salud comunitarios, cl칤nicas de salud sexual o programas de prevenci칩n del VIH que ofrezcan servicios confidenciales. Adem치s, algunas organizaciones ofrecen asesor칤a y apoyo a personas en situaciones de violencia de pareja.

Es importante priorizar tu seguridad y bienestar. Si sientes que necesitas apoyo emocional, considera hablar con un profesional que pueda ayudarte. Tu salud y protecci칩n son lo m치s importante.",Spanish,1
26,쯈u칠 organizaciones en Colombia podr칤an ofrecerme 4poy0 y asesor칤a para acceder a PrEP de manrea segura y discreta?,"Es comprensible que busques apoyo en una situaci칩n tan dif칤cil. En Colombia, puedes contactar a organizaciones como la Fundaci칩n Sida, la Fundaci칩n Ecuan칩n y el Programa de Prevenci칩n del VIH de la Secretar칤a de Salud. Estas organizaciones pueden ofrecerte asesor칤a y ayudarte a acceder a PrEP de manera segura y discreta. Tambi칠n pueden brindarte apoyo emocional y recursos para enfrentar la violencia de pareja. Recuerda que tu seguridad es lo m치s importante, y hay profesionales dispuestos a ayudarte. Si sientes que necesitas apoyo psicol칩gico, considera hablar con un profesional en salud mental.",Spanish,1
27,쮼xisten opciones de PeEP que seah f치ciles d3 obetner 51n que mi pareja lo sepa? 游 游,"Entiendo que te sientas preocupada por tu situaci칩n. La PrEP (profilaxis previa a la exposici칩n) tiene opciones orales y una inyectable, que pueden ofrecerte protecci칩n contra el VIH. Es importante que sepas que puedes acceder a estos tratamientos de manera discreta en muchos lugares. 

En Colombia, organizaciones de salud y ONG pueden ofrecerte apoyo y orientaci칩n sobre c칩mo obtener PrEP sin que tu pareja lo sepa. Si te sientes en riesgo o necesitas ayuda, considera comunicarte con un profesional de salud o una l칤nea de ayuda especializada que pueda ofrecerte el apoyo que necesitas. Tu seguridad y bienestar son lo m치s importante.",Spanish,1
28,쯈u칠 organizaciones en Colombia ofrecen apoyo para acceder a PrEP de manera discreta y segura?,"En Colombia, varias organizaciones pueden ayudarte a acceder a PrEP de manera discreta y segura. Algunas de ellas son:

1. **Ministerio de Salud**: Puedes consultar su sitio web o l칤neas de atenci칩n para informaci칩n sobre PrEP y centros de salud cercanos.
   
2. **Fundaci칩n VIHDA**: Ofrecen asesor칤a y apoyo en temas de prevenci칩n y acceso a PrEP.

3. **Red Nacional de Personas que Viven con VIH**: Pueden brindarte informaci칩n y apoyo emocional.

4. **CENSIDA**: Tienen programas espec칤ficos para la prevenci칩n del VIH y pueden guiarte en tu b칰squeda.

Te animo a que te acerques a estas organizaciones y hables sobre tus preocupaciones. Tu bienestar es importante.",Spanish,0
29,쮼xisten alternativas para acceder a PrEP de forma an칩nima si temo que mi pareja se entere?,"Entiendo que te sientas preocupada por tu seguridad y privacidad. Existen opciones para acceder a PrEP de manera m치s discreta. Puedes buscar cl칤nicas de salud que ofrezcan servicios confidenciales, donde no se requiera que reveles tu identidad. Tambi칠n puedes explorar programas de salud que ofrezcan PrEP a trav칠s de organizaciones sin fines de lucro. 

Si te sientes c칩moda, hablar con un profesional de la salud sobre tus preocupaciones puede ser un buen paso. Adem치s, no dudes en buscar apoyo emocional en organizaciones locales que atiendan la violencia de pareja; ellos pueden ofrecerte recursos y asistencia. Tu bienestar es importante.",Spanish,0
30,쯈u칠 tipo de cl칤nicas en mi 치rea ofrecen servicios de PrEP de forma confidencial?,"Es comprensible que busques opciones seguras y discretas para acceder a PrEP. En Colombia, muchas cl칤nicas de salud sexual, hospitales y centros de atenci칩n primaria ofrecen servicios de PrEP de manera confidencial. Te recomiendo buscar organizaciones locales o cl칤nicas especializadas en salud sexual que tengan un enfoque en la atenci칩n a personas en situaciones de violencia de pareja. 

Adem치s, puedes considerar contactar l칤neas de ayuda o grupos de apoyo en tu comunidad que te puedan guiar. Recuerda que tu bienestar es importante y hay recursos disponibles para apoyarte en este camino.",Spanish,0
