turn,user,bot,language,has_error
1,i-is tjree financial assistance available for someone in my 51u7471on to help with the cost of PrEP PrEP,"Yes, there are financial assistance options available to help with the cost of PrEP. Programs like the Patient Advocate Foundation and the PrEP Assistance Program can provide support for low-income individuals. Additionally, some health insurance plans may cover PrEP, so it’s worth checking if you have coverage. Local health departments or community health centers can also offer resources and assistance specific to your location. If you feel overwhelmed, consider reaching out to a local support group or mental health professional who can help you navigate these options. You're not alone in this journey, and there are people who can help.",English,1
2,What are some tips for effectively communicating my needs to healthcare providers when discussing PrEP?,"Communicating your needs to healthcare providers can feel daunting, but here are some tips that may help:

1. **Prepare Ahead**: Write down your questions and concerns about PrEP, including any specific needs related to your neurodevelopmental disorder.

2. **Bring a Support Person**: If possible, have a trusted friend or family member accompany you to help communicate and advocate for you.

3. **Be Direct**: Clearly express what you need, whether it’s information about oral or injectable PrEP, or support addressing any stigma you fear.

4. **Request Clarification**: Don’t hesitate to ask for explanations in simpler terms if something isn’t clear.

5. **Follow-Up**: If you feel overwhelmed during the appointment, consider scheduling a follow-up visit to discuss your needs further.

Remember, you deserve care that meets your needs. If you’re feeling anxious, talking to a mental health professional can also be beneficial.",English,0
3,What resources or support groups are available for people like me who are seeking PrEP and dealing with stigma?,"It's great that you're seeking support! There are resources available to help you access PrEP and navigate any stigma you may face. Organizations like the National LGBTQIA+ Health Education Center and local LGBTQ+ centers often provide information on PrEP and may host support groups. Additionally, the American Academy of HIV Medicine offers resources tailored to individuals with neurodevelopmental disorders. 

You can also reach out to a local health department or community health clinic; they might have staff trained to assist people facing similar challenges. If you're feeling overwhelmed, consider speaking with a mental health professional who understands these issues. You're not alone in this journey!",English,0
4,what specific steps can I take to ensure my healthcare pr0v1d3r understands my needs related to PrEP and .. my neurodevelopmrntal disorder?,"It's important to advocate for your needs. Here are some steps you can take:

1. **Prepare Information**: Write down your concerns and questions about PrEP and your neurodevelopmental disorder. This can help you communicate clearly.

2. **Bring a Support Person**: If possible, have someone accompany you to appointments. They can help express your needs.

3. **Request a Comfortable Environment**: Ask your provider for a quiet space to discuss sensitive topics, which can help reduce anxiety.

4. **Be Honest**: Share your concerns about stigma and how your neurodevelopmental disorder affects your understanding of medical information.

5. **Follow Up**: Don’t hesitate to ask for clarification on anything you don’t understand during your appointments.

Remember, your health matters, and it’s okay to seek help in communicating your needs.",English,1
5,What resources are available for low-income individuals to access PrEP without facing stigma?,"There are several resources available to help low-income individuals access PrEP while minimizing stigma:

1. **Community Health Clinics**: Many local clinics offer sliding scale fees based on income, making PrEP more affordable.

2. **Patient Assistance Programs**: Some pharmaceutical companies provide PrEP at no cost or reduced cost for those who qualify.

3. **Health Departments**: Local health departments often have programs that provide PrEP, sometimes with financial assistance.

4. **Support Groups**: Connecting with support groups can help you share experiences and find encouragement in navigating healthcare.

5. **Telehealth Services**: Some services allow you to access PrEP consultations online, which may feel more comfortable.

If you're feeling anxious, consider reaching out to mental health professionals who can provide support.",English,0
6,w-what steps can I take to find a supportive healtchare provider who understands um my situation and can hlep me ccess PrEP 💀,"Finding a supportive healthcare provider is an important step. Here are some suggestions:

1. **Research Local Clinics:** Look for clinics specializing in LGBTQ+ health or those known for being inclusive. They often have staff trained to understand diverse needs.

2. **Ask for Recommendations:** Reach out to local LGBTQ+ organizations or support groups. They may have lists of providers who are understanding and non-judgmental.

3. **Communicate Your Needs:** When you contact a provider, express your concerns about stigma and your neurodevelopmental disorder. It’s okay to ask if they have experience with similar situations.

4. **Consider Telehealth:** Online consultations can sometimes feel less intimidating and may offer more privacy.

5. **Support Services:** If anxiety is overwhelming, consider speaking with a mental health professional who can help you navigate these interactions.

You deserve compassionate care!",English,1
7,h-hat specific questiosn should i ask a potential healthcare provider to ensure tbey are a good fit for mu needs,"It's great that you're preparing to find a healthcare provider who fits your needs! Here are some specific questions you can ask:

1. **Experience with PrEP**: How much experience do you have prescribing PrEP?
2. **Understanding of Neurodevelopmental Disorders**: Are you familiar with how neurodevelopmental disorders can impact communication and treatment?
3. **Stigma Awareness**: How do you approach stigma in healthcare settings?
4. **Support Services**: What resources do you offer for patients who may need extra support?
5. **Communication Style**: How do you prefer to communicate about treatment and follow-up?

These questions can help ensure you find a supportive provider who understands your unique situation.",English,1
8,What resources are available for low-income individuals to help cover the cost of PrEP?,"There are several resources available to help low-income individuals access PrEP. The Patient Assistance Program from Gilead, the manufacturer of some PrEP medications, offers financial assistance for eligible individuals. Additionally, the Ready, Set, PrEP program provides free PrEP to those who qualify. Many community health centers offer sliding scale fees based on income, and some local health departments may have programs to assist with PrEP access. It's also helpful to reach out to organizations like the National HIV/AIDS Hotline for guidance. Remember, you don’t have to navigate this alone; support is available.",English,0
9,how can i find a healthcare providsr who understands my concerns about stigma uh and my neurodevelopmental disorder when discussing prep?,"Finding a healthcare provider who is understanding and supportive can greatly ease your experience with PrEP. Start by looking for clinics that specialize in LGBTQ+ health or sexual health services, as they often have staff trained in sensitivity and inclusivity. You can also reach out to local community organizations or support groups focused on HIV prevention; they may have recommendations. When contacting a provider, consider asking about their experience with neurodevelopmental disorders and how they approach stigma in their practice. Remember, it’s okay to advocate for your needs. If you feel overwhelmed, consider speaking with a mental health professional for additional support.",English,1
10,what resources are available to help me navigate conversations with healthcare providers about Pr3P 🙄,"It's understandable to feel anxious about these conversations. Several resources can help you navigate discussions with healthcare providers about PrEP:

1. **Patient Advocacy Groups**: Organizations like the National Alliance of State & Territorial AIDS Directors (NASTAD) offer support and can help you find local resources.

2. **PrEP Navigation Services**: Many health departments and clinics have PrEP navigators who can assist you in understanding your options and communicating with providers.

3. **Telehealth Services**: Some online platforms offer PrEP consultations, which might feel more comfortable for you.

4. **Support Groups**: Connecting with others who share similar experiences can provide encouragement and tips.

Consider reaching out to these resources for support tailored to your needs.",English,1
11,uow can I find a healthcare provider who ia understanding and supportive of my situation when seeking PrEP,"Finding a supportive healthcare provider is crucial. Start by looking for clinics or health centers that specialize in LGBTQ+ healthcare or sexual health. These places often have staff trained to be understanding and non-judgmental. You can also search for local PrEP programs or community health organizations; they may offer resources and referrals. 

Don’t hesitate to express your needs upfront when you contact a provider. If you're feeling anxious, consider bringing a friend or advocate to help communicate on your behalf. Additionally, the National LGBTQIA+ Health Education Center has resources that might help. Remember, you deserve compassionate care.",English,1
12,What financial assistance options are available to hlp cover the cost of Pr3P fkr someone in my 517u471on?,"There are several financial assistance options to help cover the cost of PrEP. Many pharmaceutical companies offer patient assistance programs that provide PrEP at little to no cost for those who qualify. Additionally, the Health Resources and Services Administration (HRSA) has a program to help low-income individuals access PrEP. 

You may also explore local health departments or community health centers, which often provide services on a sliding scale based on income. The National HIV/AIDS hotline (1-800-232-4636) can connect you to resources specific to your area. Remember, seeking help is a strong step forward, and you deserve support without stigma.",English,1
13,hhhow can i fid healthcare proviers wh0 are understanding anddd supportive of my neurodevelopmental disorder um when seeking rep,"Finding a supportive healthcare provider can be crucial, especially when navigating PrEP access. Start by looking for clinics that specialize in LGBTQ+ health or that openly promote inclusivity. You might also consider reaching out to local HIV prevention organizations; they often have resources or can recommend providers known for their understanding approach.

When you call or visit a clinic, don’t hesitate to express your concerns about stigma or your neurodevelopmental disorder. It’s your right to seek an environment where you feel comfortable. If you ever feel overwhelmed, consider support groups or mental health professionals who can help you cope with these feelings. You’re not alone in this journey.",English,1
14,what speeecific questions should I ask a healthcare pr0vid3r to ensure thet're supportive of my needs while discussing idk PrEP 🙂,"It’s great that you’re planning to advocate for yourself! Here are some questions you might consider asking:

1. How do you support patients with neurodevelopmental disorders during consultations?
2. Can you explain the different PrEP options available, including oral and injectable forms?
3. What resources or programs do you have to help low-income patients access PrEP?
4. How do you address stigma in your practice, especially regarding PrEP?
5. Can I bring someone with me for support during appointments?

Remember, it's okay to express your concerns and needs. Finding a provider who listens and understands is key. If you feel overwhelmed, consider reaching out to support groups or mental health professionals who specialize in these areas.",English,1
15,What resources are available for low-income individuals like me to learn more about PrEP without facing stigma?,"It's great that you’re seeking information about PrEP! For low-income individuals, several resources can help:

1. **Local Health Departments**: They often provide free or low-cost PrEP services and can assist with navigating stigma-free care.

2. **Community Health Centers**: These centers offer services on a sliding scale based on income and are usually more understanding of diverse needs.

3. **National HIV/AIDS Hotline (1-800-CDC-INFO)**: You can call for information about PrEP and local resources.

4. **PrEP Locator**: Websites like PrEP Locator can help you find clinics near you.

5. **Support Groups**: Online or local groups can provide a safe space to share experiences and gather information.

You’re not alone in this journey!",English,0
16,w-what steps can i take to repare for myyy first 4pp01n7ment to discuss lrep while kanaging my anxiety about potential stigma? ‼️,"It’s great that you’re preparing for your appointment! Here are some steps you can take:

1. **Write Down Your Questions**: List any questions or concerns about PrEP, your health, or the appointment process. This can help you stay focused.

2. **Bring a Support Person**: If possible, consider bringing a trusted friend or family member for support. They can help communicate your needs.

3. **Practice Self-Care**: Engage in calming activities before your appointment to help manage anxiety, like deep breathing or mindfulness.

4. **Know Your Rights**: Remember, healthcare providers are required to treat you with respect and confidentiality. 

If you feel stigma-related anxiety, consider talking to a mental health professional for support. You're taking an important step for your health!",English,1
17,W-What r350urc35 are available to help me find a healthcare provider idk who is undestanding and ... supportive of my newds related to PrEP? PrEP?,"It's great that you're seeking information about PrEP! To find a supportive healthcare provider, consider reaching out to local LGBTQ+ organizations, community health centers, or clinics specializing in sexual health. They often have staff trained to understand diverse needs and can help you navigate the process. 

You can also contact the National PrEP Hotline at 1-888-711-1767 for guidance and resources in your area. If you're feeling anxious about stigma or your neurodevelopmental disorder, support groups or mental health professionals can provide helpful strategies. Remember, you deserve compassionate care!",English,1
18,How can I communicate my concerns about stigma and my neurodevelopmental disorder to a healthcare provider when seeking PrEP?,"It's important to advocate for yourself when discussing your needs. You can start by expressing your desire for a supportive environment. You might say something like, ""I want to talk about PrEP, but I have some concerns about stigma and my neurodevelopmental disorder."" This can set the tone for an open conversation. 

If you're uncomfortable, consider bringing someone you trust to help communicate your concerns. Remember, healthcare providers are there to support you, and many are trained to be sensitive to these issues. If you feel overwhelmed, consider reaching out to support groups or counseling services for guidance. You're not alone in this journey.",English,0
19,What specific resources or organizations can help me navigate the process of accessing PrEP while addressing my concerns about stigma and my neurodevelopmental disorder?,"It's great that you're seeking support for accessing PrEP. Several organizations can help:

1. **The National HIV/AIDS Hotline** (1-800-CDC-INFO) offers confidential information and can connect you to local services.
2. **PrEP Locator** (preplocator.org) helps find clinics that provide PrEP, many of which are equipped to support diverse needs.
3. **Local health departments or LGBTQ+ centers** often have resources specifically for low-income individuals and can offer guidance on navigating stigma.
4. **Mental health professionals** can provide support around anxiety and stigma, helping you advocate for yourself in healthcare settings.

Remember, you're not alone, and there are people and resources ready to help you.",English,0
20,how can I find idk a healtycare provider who is und3rs74nding and knowledgeable aaabout working ith patients like me 😭,"Finding a supportive healthcare provider is important. You can start by looking for local LGBTQ+ health clinics or organizations that specialize in HIV prevention and PrEP. Many of these clinics prioritize understanding and inclusivity. 

Consider reaching out to resources like the National LGBTQIA+ Health Education Center or local AIDS service organizations, as they might have recommendations. You can also ask for referrals from friends or online communities that focus on your needs.

If you're feeling anxiety or fear about stigma, speaking with a mental health professional can be helpful. They can support you in navigating these challenges. Remember, you deserve compassionate care!",English,1
21,What specific questions should I ask a healthcare provider to ensure they are a good fit for my needs regarding PrEP?,"It's great that you're advocating for your health! Here are some questions you can ask to find the right healthcare provider for your PrEP needs:

1. What experience do you have with prescribing PrEP, especially for individuals with neurodevelopmental disorders?
2. How do you ensure a stigma-free environment when discussing sexual health and PrEP?
3. Can you explain the differences between oral and injectable PrEP, and which might be better for me?
4. How can we communicate effectively during appointments to make sure I understand everything?
5. What resources do you recommend for support and counseling regarding PrEP and sexual health?

These questions can help you assess their understanding and supportiveness. Remember, it's okay to seek a provider who makes you feel comfortable!",English,0
22,waht local resources or organizations can help me access um pr3p while considering my financial situation and neurodevelopmental needs,"It's great that you're seeking information about PrEP! In the U.S., organizations like the Ryan White HIV/AIDS Program can help low-income individuals access PrEP. Local health departments often provide services as well, including sliding-scale fees based on income. The PrEP Locator website can help you find providers near you.

Consider reaching out to organizations like the National Alliance on Mental Illness (NAMI) for support with communication and navigating healthcare. They can also provide resources for mental health support. Remember, you deserve care and support, and there are people ready to help you through this process.",English,1
23,What specific steps can I take to find a healthcare provider who is understanding and supportive of my neurodevelopmental disorder while discussing PrEP?,"Finding a supportive healthcare provider can feel daunting, but there are steps you can take. Start by researching local clinics that specialize in LGBTQ+ health or HIV prevention, as they often have experience with diverse needs. Consider reaching out to organizations like the National LGBTQ+ Health Education Center or local health departments; they can help connect you to knowledgeable providers.

When you contact a clinic, you can ask about their experience with patients who have neurodevelopmental disorders and their approach to PrEP. Bringing a trusted friend or advocate to appointments may also help you communicate your needs. Remember, it’s okay to seek someone who makes you feel comfortable and understood.",English,0
24,w-what 5p3c1fic questions should i ask a healthcare provider to ensure they are supportive 4b0u7 my nsurodevelopmental disorder and prep?,"It's great that you're preparing to talk to a healthcare provider. Here are some specific questions you might consider asking:

1. How do you accommodate patients with neurodevelopmental disorders in your practice?
2. Can you explain the process of accessing PrEP in a way that’s easy for me to understand?
3. What steps do you take to ensure a non-judgmental and supportive environment for all patients?
4. Are there resources, like social workers or counselors, available to help me with any concerns?
5. How can we communicate in a way that works best for me during our appointments?

Remember, it’s okay to express your needs and concerns. You deserve supportive care.",English,1
25,What local resources or clinics specifically cater to low-income individuals seeking PrEP while considering neurodevelopmental needs?,"Finding local resources for PrEP can be a bit overwhelming, especially when considering specific needs. Many community health clinics offer PrEP services and are often equipped to assist low-income individuals. Look for clinics that focus on LGBTQ+ health or those that specifically mention inclusivity for neurodevelopmental needs. 

You can also check organizations like the Health Resources and Services Administration (HRSA) or local AIDS service organizations, which often have programs to help with cost and access. Additionally, the National PrEP Hotline is a great resource for guidance tailored to your situation. Remember, it's okay to express your concerns when seeking help; you deserve supportive care.",English,0
26,what should i do if i feel uncomofrtable discussing my neurodevelopmental disorder with healthcare providers when seeikng prep 😕,"It's completely understandable to feel uncomfortable discussing personal matters with healthcare providers. Here are some steps you can take:

1. **Bring a Support Person**: If possible, have a trusted friend or advocate accompany you to help communicate your needs.

2. **Write It Down**: Prepare a list of your concerns and questions in advance. This can help you express yourself more clearly.

3. **Choose a Provider You Trust**: Look for healthcare providers known for their sensitivity to diverse needs, including those with neurodevelopmental disorders.

4. **Use Resources**: Consider reaching out to organizations like the National Alliance on Mental Illness (NAMI) for support and guidance.

Remember, you deserve compassionate care, and it's okay to seek help in navigating these conversations.",English,1
27,What resources are available to help me find a supportive healthcare provider for accessing PrEP?,"Finding a supportive healthcare provider for PrEP is important. Here are some resources you can consider:

1. **Local Health Departments**: They often have information about clinics that provide PrEP in a stigma-free environment.

2. **The PrEP Locator**: A tool from the CDC that helps you find providers offering PrEP near you.

3. **National LGBTQIA+ Health Organizations**: Groups like the Human Rights Campaign or the Gay and Lesbian Medical Association can help you find inclusive providers.

4. **Support Groups**: Online forums or local support groups can connect you with others who have similar experiences and can recommend providers.

If you feel anxious about the process, consider reaching out to a mental health professional for support. You're not alone in this!",English,0
28,How can I prepare for a doctor's appointment about PrEP to ensure my concerns are addressed without facing stigma?,"Preparing for your appointment can help you feel more confident. Here are some tips: 

1. **Write Down Your Questions**: List any concerns you have about PrEP, your neurodevelopmental disorder, and stigma. This can help you communicate clearly.

2. **Bring Support**: If possible, have a trusted friend or family member join you for support.

3. **Be Open**: Let the provider know about your concerns regarding stigma. A good provider will understand and respect your feelings.

4. **Research**: Familiarize yourself with both oral and injectable PrEP options so you can ask informed questions.

If you feel overwhelmed, consider speaking with a mental health professional who can help you navigate these feelings. You deserve compassionate care!",English,0
29,What resources are available to help low-income individuals access PrEP without facing stigma?,"There are several resources available to assist low-income individuals in accessing PrEP while minimizing stigma:

1. **Community Health Centers**: These centers often provide PrEP services on a sliding scale based on income and may offer a supportive environment.

2. **State Health Departments**: Many states have programs that help cover the costs of PrEP for low-income individuals.

3. **Patient Assistance Programs**: Pharmaceutical companies may have programs to provide PrEP medications at little or no cost.

4. **Support Groups**: Connecting with local or online support groups can help reduce feelings of stigma and anxiety.

5. **Mental Health Resources**: If you're feeling overwhelmed, consider speaking with a mental health professional who understands these issues.

Reach out to these resources; you deserve support and care.",English,0
