turn,user,bot,language,has_error
1,Can you explain how PrEP works and its effectiveness in preventing HIV?,"PrEP, or pre-exposure prophylaxis, is a medication taken to reduce the risk of HIV infection. It works by preventing the virus from establishing an infection if exposed. There are two main forms: oral PrEP, taken daily, and injectable PrEP, administered every two months. 

When taken consistently, PrEP is highly effective, reducing the risk of getting HIV from sexual activity by about 99%. It's important to discuss your concerns with a healthcare provider who understands your situation. Remember, you deserve respectful care, and there are resources available to help you navigate any stigma or fear you may face.",English,0
2,What are some strategies to find a supportive healthcare provider who is knowledgeable about PrEP and LGBTQ+ issues?,"Finding a supportive healthcare provider can feel challenging, but there are strategies to help you:

1. **LGBTQ+ Centers**: Reach out to local LGBTQ+ community centers, as they often have resources or referrals for knowledgeable providers.

2. **Online Directories**: Use online platforms like the Human Rights Campaign or the GLMA (Gay and Lesbian Medical Association) to find affirming healthcare professionals.

3. **Support Groups**: Join local or online support groups; they can share experiences and recommend providers who understand your needs.

4. **Initial Visits**: Consider scheduling a consultation to gauge comfort and understanding before committing to ongoing care.

Remember, you deserve compassionate and respectful care. Seeking support from mental health professionals can also be beneficial in navigating these feelings.",English,0
3,How can I approach the conversation about PrEP with a healthcare provider without feeling judged?,"It's completely understandable to feel apprehensive about discussing PrEP with a healthcare provider. Here are some tips to help you approach the conversation:

1. **Prepare Ahead**: Write down your questions and concerns before your appointment. This can help you stay focused.
   
2. **Choose the Right Provider**: If possible, look for healthcare providers who specialize in LGBTQ+ health or have a reputation for being inclusive.

3. **Be Direct**: You can start the conversation by saying you want to discuss PrEP specifically. This can set a clear tone.

4. **Know Your Rights**: Remember that you deserve respectful and non-judgmental care. If you feel uncomfortable, it's okay to seek a different provider.

If you’re feeling overwhelmed, talking to a mental health professional can also be helpful. You’re not alone in this journey!",English,0
4,What resources or support groups are available for people like me who are navigating PrEP and facing stigma?,"There are several supportive resources for those navigating PrEP and stigma. The CDC and local health departments often provide information and support for individuals interested in PrEP. National organizations like the National LGBTQIA+ Health Education Center and the Gay and Lesbian Medical Association can help connect you with affirming healthcare providers.

Support groups, both in-person and online, such as those found on platforms like Meetup or Facebook, can offer community and shared experiences. Additionally, mental health resources like the Trevor Project and local counseling services can provide emotional support. You're not alone, and reaching out can make a difference in your journey.",English,0
5,how can I ifnd a healthcaer pr0vid3r who understands mh experience 4nd won't judge m3 for seeking PrEP? 😅,"It's great that you're taking steps to prioritize your health. Finding a supportive healthcare provider can make a big difference. Consider looking for clinics that specialize in LGBTQ+ health or those that advertise inclusive services. Organizations like the LGBTQ+ Health Initiative or the Human Rights Campaign can help you find providers experienced in working with diverse communities.

When you contact a clinic, you can ask about their experience with PrEP and how they support clients with gender dysphoria. Remember, your health matters, and you deserve care in a safe, non-judgmental environment. If feelings of fear or isolation persist, consider reaching out to a mental health professional for support.",English,1
6,wh4tt7 should i say to a provider to ensure the understand my concerns 4b0u7 57igm4 ane gender dysphoria when discussing prep?,"When discussing your concerns with a healthcare provider about PrEP, you can start by expressing your feelings openly. You might say, “I want to talk about PrEP, but I have concerns about stigma and my gender dysphoria. It’s important for me to feel understood and respected during our conversation.” You can also ask how they ensure a supportive environment for all patients. Remember, you deserve compassionate care. If you ever feel uncomfortable, it’s okay to seek another provider. If needed, consider reaching out to local LGBTQ+ organizations for resources and support. You're not alone in this journey.",English,1
7,wh47 specific questions should I ask ttto gauge if a healthcare you know provider is LGBTQ+ friendly before discussing PrEP?,"It's great that you're thinking ahead about your comfort with a healthcare provider. Here are some questions you might consider asking:

1. How do you ensure a welcoming environment for LGBTQ+ patients?
2. What experience do you have in providing care for LGBTQ+ individuals, particularly around sexual health?
3. Are you knowledgeable about PrEP and its benefits for LGBTQ+ patients?
4. How do you handle confidentiality and privacy regarding sensitive health topics?
5. Can you explain your approach to discussing gender identity and sexual orientation in healthcare?

These questions can help you gauge their understanding and sensitivity, making it easier to discuss your health needs. Remember, your comfort is important!",English,1
8,what 5h0uld 1 do if I find out that a healthcare provider is not 4s LGBTQ+ friendly asss I h0ped?,"It's important to feel safe and supported when discussing your health. If you find that a healthcare provider is not LGBTQ+ friendly, consider these steps:

1. **Seek a Second Opinion:** Look for another provider who is known for being inclusive and understanding of LGBTQ+ health needs.
2. **Research Resources:** Organizations like the Human Rights Campaign or local LGBTQ+ centers can help you find affirming healthcare providers.
3. **Report Concerns:** If you feel comfortable, you can report your experience to the clinic or hospital administration.
4. **Connect with Support Groups:** Joining local or online LGBTQ+ support groups can provide community and resources.
5. **Prioritize Your Well-being:** Remember, your health and comfort are paramount. 

You deserve respectful care!",English,1
9,h0q can o f1nd lgbtq+-friendly healtbcare providers in my qr3a who can help e with prep prep,"Finding LGBTQ+-friendly healthcare providers can make a big difference in your experience. You can start by checking out local LGBTQ+ community centers, which often have resources or referrals. Websites like the Human Rights Campaign and the Fenway Institute offer directories of inclusive healthcare providers. Additionally, the PrEP Locator tool can help you find clinics that offer PrEP and are welcoming to diverse identities. Remember, you deserve respectful and understanding care. If you ever feel overwhelmed, consider reaching out to support organizations that focus on mental health, as they can provide guidance and reassurance.",English,1
10,what questions should I ask a healthcare provider to ensure they are supportive annnd knowledgeable about PrEP for people like me? me?,"It's great that you're advocating for your health! Here are some questions you might consider asking:

1. **Experience with PrEP**: How familiar are you with prescribing PrEP for non-binary individuals and those navigating gender dysphoria?
2. **Supportive Environment**: What steps do you take to ensure a supportive and inclusive experience for LGBTQ+ patients?
3. **PrEP Options**: Can you explain the differences between oral and injectable PrEP and help me decide which might be best for me?
4. **Follow-up Care**: What is the process for regular check-ins and monitoring while on PrEP?
5. **Resources**: Are there resources or support groups you recommend for individuals facing stigma or mental health concerns related to HIV prevention?

These questions can help you find a provider who understands your needs and creates a welcoming space.",English,1
11,what should i do if i like feel uncomfortable eith a healthcare provider' response to my questions about prep,"It's completely understandable to feel uncomfortable when discussing sensitive topics like PrEP, especially if you worry about being misunderstood. If a healthcare provider's response makes you uneasy, consider looking for another provider who is experienced in LGBTQ+ health and can create a supportive environment. Many clinics focus on inclusive care and can help make your experience more comfortable. You can also reach out to local LGBTQ+ organizations for support and resources. Remember, your health and comfort are important, and you deserve a provider who respects and understands your needs.",English,1
12,How can I find a healthcare provider who is affirming and knowledgeable about PrEP for non-binary individuals like me?,"Finding a supportive healthcare provider is important. You can start by searching for LGBTQ+ friendly clinics or organizations in your area. Resources like the Gay and Lesbian Medical Association (GLMA) or local LGBTQ+ health centers often have directories of affirming providers. Additionally, reach out to community support groups—many have recommendations based on personal experiences. When you call a clinic, feel free to ask about their experience with non-binary patients and PrEP. It’s okay to prioritize your comfort and safety in these conversations. Remember, you deserve respectful and understanding care. If you're feeling anxious about this process, consider talking to a mental health professional for support.",English,0
13,what specofic questions should i ssk 4 healthcare provider to nesure they understand my needs r3g4rdihg prep 🙄,"It's great that you're thinking about how to communicate your needs. Here are some specific questions you might consider asking your healthcare provider:

1. What are my options for PrEP, including oral and injectable forms?
2. How will you ensure my privacy and confidentiality during our discussions?
3. Can you explain how PrEP works and its effectiveness in preventing HIV?
4. What are the potential side effects, and how will we monitor them?
5. How do you support patients who may feel stigmatized or misunderstood regarding their sexual health?

Feel free to express any concerns about stigma or discrimination; a supportive provider should be open to these conversations. If you feel overwhelmed, seeking support from a counselor or therapist can also be helpful.",English,1
14,what should I do if I feel uncomfortable or judged during my appointment about discussing PrEP?,"It's completely understandable to feel uncomfortable or judged when discussing sensitive topics like PrEP. If you sense that a healthcare provider isn't being supportive, you have the right to speak up. You can say something like, ""I’d like to discuss my health without feeling judged."" If that doesn't help, consider finding a different provider who is more affirming and sensitive to your needs. Look for clinics that specialize in LGBTQ+ health, as they often have more experience with these conversations. Remember, your health and comfort matter, and you deserve a supportive environment. If you ever feel overwhelmed, consider reaching out to mental health professionals or support groups for additional help.",English,1
15,hos can I fnd a healthcare provider who id knowledgeable and supp0r71v3 of my needs r3g4rd1ng PrEP?,"Finding a supportive healthcare provider for PrEP can feel daunting, but there are resources to help. Look for clinics that specialize in LGBTQ+ health or sexual health services. The National LGBTQIA+ Health Education Center and local health departments often provide directories. You can also check online platforms like PrEP Locator or the CDC’s website for nearby providers. When reaching out, consider asking about their experience with non-binary patients and PrEP. It's important to find someone who understands your needs. Remember, you deserve care that respects and affirms your identity. If you’re feeling isolated or anxious, speaking with a mental health professional can also be really helpful.",English,1
16,what should I say to a healthcare provider to rnsure they understand my concerns about stigma when discussing PrEP?,"It’s important to feel comfortable discussing your concerns with healthcare providers. You might say something like, “I want to talk about PrEP for HIV prevention, but I have some worries about stigma and being misunderstood. Can you assure me that this is a safe space for discussing my sexual health?” This opens up the conversation while expressing your needs. Remember, you deserve respectful and non-judgmental care. If you're feeling overwhelmed, consider reaching out to supportive organizations or mental health professionals who can help you navigate these feelings. You're not alone in this journey.",English,1
17,are there specific cl1n1c5 or rganizations that are more um supportive and knlwledgealbe about PrEP for non-binary individuaks?,"Yes, there are clinics and organizations that are known for their inclusive and supportive environments for non-binary individuals seeking PrEP. Look for LGBTQ+ health centers or community clinics, as they often have trained staff who understand your needs and concerns. Organizations like the Human Rights Campaign and local LGBTQ+ centers can provide resources and referrals. Additionally, you might find telehealth services that offer a comfortable way to discuss your health without the fear of stigma. If you're feeling isolated, consider reaching out to support groups focused on LGBTQ+ health and mental wellness. They can offer community and understanding.",English,1
18,What should I ask a healthcare provider to ensure they are knowledgeable and respectful regarding my identity when discussing PrEP?,"It's great that you're preparing to have this important conversation! You might consider asking the following questions:

1. ""How do you ensure a respectful and inclusive environment for all patients, including those from diverse gender identities?""
2. ""Can you explain your experience in providing care to non-binary individuals or those navigating gender dysphoria?""
3. ""What steps do you take to maintain confidentiality and ensure privacy in discussions about sexual health?""
4. ""How do you approach conversations about PrEP with patients who may have concerns about stigma?""

These questions can help you gauge their understanding and create a more comfortable dialogue. Remember, you deserve compassionate and respectful care!",English,0
19,What resources or support groups are available for non-binary individuals seeking PrEP and navigating healthcare challenges?,"It's great that you're seeking information and support. Many organizations focus on LGBTQ+ health, including non-binary individuals. The Human Rights Campaign and the National LGBTQ Task Force offer resources and guidance on accessing PrEP. Local LGBTQ+ community centers often host support groups and can help connect you to affirming healthcare providers.

Online platforms like The Trevor Project provide mental health support and resources tailored to LGBTQ+ youth. Additionally, consider contacting local health departments or clinics specializing in sexual health for more personalized assistance. Remember, you deserve compassionate care, and seeking help is a brave step.",English,0
20,How can I find a healthcare provider who is knowledgeable about PrEP and sensitive to the needs of non-binary patients?,"Finding a supportive healthcare provider is important. You can start by looking for clinics that specialize in LGBTQ+ healthcare, as they often have staff trained in gender sensitivity and sexual health. Resources like the National LGBTQIA+ Health Education Center or local LGBTQ+ community centers can help you find providers who are knowledgeable about PrEP. Additionally, websites like PrEP Locator can guide you to clinics near you. When reaching out, consider asking about their experience with non-binary patients and PrEP. Remember, you deserve compassionate care, and it’s okay to seek out providers who understand your needs.",English,0
21,What should I do if I encounter discrimination or feel uncomfortable during a healthcare visit while discussing PrEP?,"It's important to feel safe and respected during healthcare visits. If you encounter discrimination or feel uncomfortable, consider the following steps: 

1. **Speak Up**: Politely express your discomfort to the provider. Sometimes, they may not realize how their words or actions affect you.

2. **Seek Support**: Bring a trusted friend or advocate to your appointment for support.

3. **Find Affirming Care**: Look for healthcare providers or clinics known for being LGBTQ+ friendly. Resources like the Gay and Lesbian Medical Association can help.

4. **Report Concerns**: If you experience discrimination, consider reporting it to the clinic management or a patient advocacy group.

Remember, you deserve respectful care. If you’re feeling overwhelmed, talking to a mental health professional can be beneficial.",English,0
22,ho5 can 1 find a healthcare provider who is knowledgeable and 5upp0rt1v3 of lgbtq+ 1nd1v1ud4ls ilke me?,"Finding a supportive healthcare provider is important. You can start by looking for LGBTQ+ friendly clinics or organizations in your area. The Human Rights Campaign and the Gay and Lesbian Medical Association have resources to help you find affirming healthcare professionals. Additionally, consider reaching out to local LGBTQ+ community centers; they often have lists of recommended providers. When choosing a provider, you can also call ahead to ask about their experience with LGBTQ+ health issues. Remember, you deserve respectful and understanding care. If you ever feel overwhelmed, talking to a mental health professional can be beneficial too.",English,1
23,what sp3c1f1c qu357i0n5 should i ask a potential provider to ensure they are suppor71v3 of my n33d5,"It's great that you're thinking about how to find a supportive healthcare provider. Here are some specific questions you might consider asking:

1. How do you ensure a welcoming environment for LGBTQ+ patients?
2. What is your experience working with non-binary individuals regarding sexual health?
3. Can you explain your approach to discussing PrEP and sexual health with patients?
4. How do you handle confidentiality and privacy concerns?
5. Are there resources available for patients who feel anxious about discussing their health?

These questions can help you gauge their understanding and support for your needs. Remember, you deserve compassionate care!",English,1
24,What should I do if I encounter a healthcare provider who is not supportive or understanding of my identity while seeking PrEP?,"It's important to prioritize your comfort and safety when seeking healthcare. If you encounter an unsupportive provider, consider the following steps: 

1. **Trust Your Instincts**: If you feel uncomfortable, it's okay to seek care elsewhere. You deserve a provider who respects and understands your identity. 
2. **Seek LGBTQ+ Friendly Clinics**: Look for healthcare facilities that specifically cater to LGBTQ+ individuals. They often have staff trained to provide inclusive care. 
3. **Advocacy Resources**: Organizations like the Human Rights Campaign or local LGBTQ+ centers can offer support and help you find affirming care. 
4. **Mental Health Support**: If feelings of isolation or anxiety arise, speaking with a mental health professional can be beneficial. 

Your health and well-being are important, and you deserve compassionate care.",English,0
25,How can I find LGB7Q+ friendly healthcare providers in my area who offer Pr3P?,"Finding LGBTQ+ friendly healthcare providers can be an important step in accessing PrEP. Here are a few strategies to help you:

1. **Local LGBTQ+ Organizations:** Many cities have organizations that provide resources and referrals for LGBTQ+ health services.

2. **Online Directories:** Websites like the Human Rights Campaign and the Fenway Institute offer directories of LGBTQ+ friendly providers.

3. **Community Health Centers:** Look for federally qualified health centers, which often have staff trained in LGBTQ+ health.

4. **Telehealth Services:** Some online providers specialize in LGBTQ+ care and can prescribe PrEP.

Remember, you deserve a supportive healthcare experience. If you feel anxious about these conversations, consider reaching out to a mental health professional who understands these issues.",English,1
26,you know what should I say to my healthcare provider to f3el more comfortable d15cu551nf PrEP and my sexuuual health?,"It's completely understandable to feel apprehensive discussing these topics. You might start the conversation by saying something like, ""I want to discuss my sexual health and HIV prevention options, including PrEP. It's important for me to feel safe and understood during this conversation."" You can also ask them about their experience working with LGBTQ+ individuals to gauge their comfort level. Remember, you deserve respectful and inclusive care. If you ever feel overwhelmed, consider reaching out to support groups or mental health professionals who specialize in these issues. You're not alone in this journey!",English,1
27,What are some ways to identify a healthcare provider who is knowledgeable and supportive of LGBTQ+ needs?,"Finding a supportive healthcare provider is important. Here are some ways to identify one who understands LGBTQ+ needs:

1. **LGBTQ+ Health Centers**: Look for local clinics or health centers that specialize in LGBTQ+ healthcare. They often have trained staff who are affirming and knowledgeable.

2. **Online Resources**: Websites like the Human Rights Campaign or the GLMA (Gay and Lesbian Medical Association) offer directories of LGBTQ+ friendly providers.

3. **Community Recommendations**: Ask friends or local LGBTQ+ community groups for recommendations based on their experiences.

4. **Initial Consultation**: Consider scheduling a meet-and-greet to discuss your concerns and see how comfortable you feel with the provider.

It’s okay to ask questions about their experience with LGBTQ+ health issues. You deserve compassionate care!",English,0
28,How can I ensure my privacy when discussing PrEP and my sexual health with a provider?,"It's completely understandable to be concerned about privacy when discussing sensitive topics like PrEP and sexual health. Here are some steps you can take to protect your privacy:

1. **Choose a supportive provider**: Look for healthcare providers known for being LGBTQ+ friendly. You can often find reviews or recommendations online.

2. **Ask about confidentiality**: Before your appointment, inquire about their privacy policies and how they handle sensitive information.

3. **Use telehealth services**: Many providers offer virtual appointments, which can feel more comfortable and private.

4. **Know your rights**: Familiarize yourself with HIPAA regulations, which protect your health information.

Remember, your health is important, and you deserve care that respects your privacy. If you're feeling overwhelmed, consider speaking with a mental health professional for support.",English,0
29,What questions should I ask to find a healthcare provider who understands my needs and concerns about PrEP?,"It's important to find a healthcare provider who respects and understands your needs. Here are some questions you might consider asking:

1. **Experience with LGBTQ+ Patients:** ""How do you ensure a welcoming environment for LGBTQ+ individuals?""
2. **Knowledge about PrEP:** ""What is your experience in prescribing PrEP, and can you explain both oral and injectable options?""
3. **Stigma Sensitivity:** ""How do you address stigma related to sexual health and HIV prevention?""
4. **Patient-Centered Care:** ""How do you involve patients in their health decisions, especially regarding PrEP?""
5. **Support Resources:** ""Can you recommend any supportive services for mental health or community resources?""

Finding a provider who listens and respects your identity can make a big difference.",English,0
30,How can I address my concerns about being misunderstood when discussing my need for PrEP with a healthcare provider?,"It's completely understandable to feel apprehensive about discussing your health needs, especially regarding PrEP. Consider finding a healthcare provider who specializes in LGBTQ+ health or has experience with gender diversity. They may be more understanding and supportive. You can also prepare for the conversation by writing down your questions and concerns beforehand, which can help you feel more confident. Remember, your health and comfort are the priority. If you feel comfortable, you might mention your fears upfront, which could help set a supportive tone. If you ever feel overwhelmed, reaching out to a mental health professional or support group can also be beneficial. You're not alone in this journey.",English,0
