turn,user,bot,language,has_error
1,are there support i mean groups for people using prep who face similar chalenges,"Yes, there are support groups for people using PrEP and those navigating similar challenges, including stigma and fear of judgment. Organizations like the AIDS Foundation, local health departments, and community health centers often offer resources and support networks. Online platforms and forums can also provide safe spaces to share experiences and connect with others. If you're feeling overwhelmed, consider reaching out to a mental health professional who understands these issues. Remember, you’re not alone, and seeking support is a strong and positive step toward your health and well-being.",English,1
2,what should you know i look for in a supporive healthcare provider when considerinnng prep,"When looking for a supportive healthcare provider for PrEP, consider the following:

1. **Non-judgmental attitude**: Seek someone who creates a safe space for open discussions about your concerns and experiences.
2. **Knowledgeable**: Ensure they understand PrEP, its benefits, and potential side effects, and can answer your questions clearly.
3. **Empathy**: A provider who listens and validates your feelings can help alleviate anxiety and fear.
4. **Privacy**: Confirm that they respect confidentiality and create an environment where you feel safe discussing sensitive topics.
5. **Support resources**: Look for providers who can connect you with additional support services, like counseling, if needed.

Your health and comfort are priorities.",English,1
3,How can I overcome my fear of judgment when discussing PrEP with my healthcare provider?,"It's completely understandable to feel anxious about discussing PrEP, especially in a stigmatizing environment. Here are some steps you can take to help ease your fear:

1. **Prepare Questions**: Write down your concerns and questions about PrEP. This can help you feel more confident during the conversation.

2. **Choose Supportive Providers**: Look for healthcare providers known for being compassionate and understanding. You can ask friends or search online for reviews.

3. **Practice**: Role-playing the conversation with a trusted friend can make it feel less daunting.

4. **Focus on Your Health**: Remember that prioritizing your health is what's most important.

If stigma or anxiety continues to affect you, consider speaking with a mental health professional for additional support. You're not alone in this.",English,0
4,What are the best ways to find a supportive healthcare provider who understands my concerns about PrEP?,"Finding a supportive healthcare provider can make a big difference in your experience with PrEP. Here are some steps you can take:

1. **Research Local Clinics**: Look for LGBTQ+ friendly clinics or organizations that specialize in sexual health. Websites like the CDC or local health departments often have resources.

2. **Read Reviews**: Check online reviews or forums for feedback on providers' attitudes towards PrEP and their sensitivity to stigma.

3. **Ask for Recommendations**: If you're comfortable, ask friends or community members for suggestions.

4. **Initial Consultation**: Schedule a visit to gauge their understanding and openness. You deserve a provider who listens and respects your concerns.

Remember, you can always change providers if you don't feel comfortable. Your health and well-being are paramount.",English,0
5,What should I say to a healthcare provider to ensure they understand my concerns about stigma while discussing PrEP?,"It's important to communicate openly with your healthcare provider about your concerns. You might say something like, ""I want to discuss PrEP, but I have experienced stigma related to HIV in the past. It's important for me to feel safe and understood during this conversation. Can we talk about how I can use PrEP without feeling judged?"" This can help set the tone for a supportive dialogue. Remember, healthcare providers are there to support you without judgment. If you feel comfortable, you can also ask about privacy measures to protect your information.",English,0
6,what desources are available to help me find supportive healthcare providers who are knowledgeable about prep and sensitive to 5t1gm4,"It's great that you're seeking supportive healthcare providers! You can start by looking at local LGBTQ+ centers, community health clinics, or organizations like the National Minority AIDS Council (NMAC) and the AIDS Healthcare Foundation (AHF), which often have resources for finding knowledgeable providers. Additionally, the PrEP Locator website can help you find clinics offering PrEP in your area. Don't hesitate to reach out to these organizations for guidance—they're there to support you without judgment. Remember, you deserve respectful and compassionate care.",English,1
7,How can I overcome my fear of judgment when discussing PrEP with healthcare providers?,"It's completely understandable to feel anxious about discussing PrEP, especially with past experiences of stigma. One helpful approach is to find a healthcare provider who is known for being supportive and non-judgmental. You can also prepare for your appointment by writing down your concerns and questions. Remember, healthcare providers are there to help you prioritize your health, not to judge you. If you still feel uncomfortable, consider bringing a trusted friend for support or seeking out LGBTQ+ friendly clinics that may have a more inclusive environment. If your feelings of fear or anxiety persist, connecting with a mental health professional can also provide valuable support. You're not alone in this!",English,0
8,what resources are 4v41l4ble r0 you know help me find a supportive healthcare provider f000r prep,"It’s great that you’re seeking support! You can start by visiting local health departments or community health centers, which often have resources for PrEP and can connect you with supportive healthcare providers. Websites like Get PrEP or PrEP Locator can help you find clinics in your area. Additionally, organizations like the National Alliance of State & Territorial AIDS Directors (NASTAD) and the CDC offer directories for PrEP services. Remember, you deserve a judgment-free experience, and seeking help is a strong step towards taking care of your health. If you need someone to talk to about stigma or mental health, consider reaching out to a mental health professional or support groups in your area.",English,1
9,um how can 1 overcome my fear 0f being judged when asking 4b0u7 PrEP at a clinic,"It’s completely understandable to feel anxious about seeking information on PrEP due to past experiences with stigma. Remember, health care providers are there to support you and should respect your privacy. You have every right to ask questions without fear of judgment. 

Consider visiting clinics known for being inclusive and understanding. You can also reach out to support groups or organizations that focus on HIV prevention; they often provide safe spaces to discuss your concerns. If you're feeling overwhelmed, speaking to a mental health professional may also help you navigate these feelings. You're taking a brave step toward prioritizing your health, and that's commendable.",English,1
10,What are some tips for finding a supportive clinic that respects my privacy and understanding of PrEP?,"Finding a supportive clinic is important. Here are some tips:

1. **Research**: Look for clinics that specialize in sexual health or HIV prevention. Websites like the CDC and local health departments often provide lists of trusted providers.

2. **Read Reviews**: Patient reviews can offer insights into the clinic's atmosphere and staff attitudes.

3. **Call Ahead**: Reach out to clinics and ask about their approach to confidentiality and non-judgmental care. 

4. **Ask About Services**: Inquire if they offer both oral and injectable PrEP options and how they support patients with education.

5. **Seek Support**: Consider connecting with local or online support groups for individuals using PrEP, which can help you feel less isolated.

Remember, you deserve respectful care.",English,0
11,h-how can i address my fears of judgment wben discussinh prep wtih ehalthcare providers?,"It's completely understandable to feel anxious about discussing PrEP, especially in a stigmatized environment. When talking to healthcare providers, consider being open about your concerns. You can start by sharing your feelings about judgment and stigma, which may help them understand your perspective and create a supportive space. Remember, healthcare providers are trained to be non-judgmental and prioritize your well-being. If you feel comfortable, seek out providers known for their affirming and inclusive care. If you need additional support, consider connecting with local organizations or online communities focused on sexual health and HIV prevention. You deserve to feel safe and supported in your health journey.",English,1
12,what are some ways I can find a supportive healthvare providef who is kn0wledg34bl3 about PrEP and understands my cocwrns?,"Finding a supportive healthcare provider is important. Here are some steps you can take:

1. **Research Local Clinics**: Look for clinics specializing in sexual health or HIV prevention. Many offer services tailored to individuals seeking PrEP.

2. **Ask for Recommendations**: Reach out to local LGBTQ+ organizations or community health groups. They often have resources and can recommend understanding providers.

3. **Use Online Resources**: Websites like PrEP Locator can help you find nearby providers who are knowledgeable about PrEP.

4. **Consult with Support Groups**: Connecting with others who have used PrEP can help you find providers who are inclusive and supportive.

Remember, you deserve a provider who respects your concerns and creates a safe environment for discussion.",English,1
13,What should I say to my healthcare provider to ensure they understand my concerns about stigma when discussing PrEP?,"It's important to communicate openly with your healthcare provider. You might say something like, ""I want to discuss PrEP, but I have concerns about stigma and how others might perceive me. I’d appreciate a supportive and non-judgmental conversation about my options."" This conveys your feelings while inviting them to create a safe space for your discussion. Remember, your health is important, and a good provider will prioritize your comfort and understanding. If you're feeling overwhelmed, consider reaching out to support groups or mental health professionals who can help you navigate these feelings.",English,0
14,What resources are available to help me find a supportive healthcare provider who understands the stigma around PrEP?,"Finding a supportive healthcare provider is an important step. You can start by checking out local LGBTQ+ health centers, as they often have providers experienced in stigma-sensitive care. The National HIV/AIDS Clinicians' Consultation Center offers a directory of providers knowledgeable about HIV prevention and PrEP. Additionally, organizations like PrEP4All and the CDC provide resources to locate inclusive healthcare options. Consider reaching out to community support groups or online forums as well; they can share personal experiences and recommendations. Remember, you deserve understanding and respect in your healthcare journey. If feelings of anxiety persist, talking to a mental health professional can also be beneficial.",English,0
15,hHHow can I approach a healthcare provider about PrEP withooout feeling judged? judged?,"It's completely understandable to feel anxious about discussing PrEP, especially in a stigmatized environment. When approaching a healthcare provider, remember that they are there to support your health, not judge you. You might start by expressing your concerns about HIV prevention and your interest in PrEP. You can say something like, ""I've been reading about PrEP and would like to know more."" This opens the conversation without focusing on your personal situation right away. If you feel uncomfortable, consider seeking providers known for being LGBTQ+ friendly or those who specialize in sexual health. Remember, your health is important, and seeking information is a positive step.",English,1
16,what should I do 1f my healthcare provider doesn't seem supportive 0r understanding about my inteerst in PrEP,"It's important to feel supported when discussing your health. If your healthcare provider isn't understanding about your interest in PrEP, consider these steps: 

1. **Express Your Concerns**: Share your feelings with your provider. Open communication can sometimes improve understanding.
   
2. **Seek a Second Opinion**: Look for another healthcare provider who specializes in HIV prevention or is known for being supportive and nonjudgmental.

3. **Connect with Local Resources**: Find community organizations or clinics that focus on sexual health and HIV prevention. They can provide information and may have supportive staff.

Remember, your health is a priority, and you deserve compassionate care. If stigma or fear is affecting you, consider reaching out to mental health professionals who can help.",English,1
17,h-how can I find 4 5upp0rt1v3 um healthcare pr0v1d3r wh0 understands the stigma surrounding PrEP?,"Finding a supportive healthcare provider is important. You can start by looking for local clinics or organizations that specialize in LGBTQ+ health, sexual health, or HIV prevention. Many of these places focus on providing non-judgmental care. Online resources like the CDC or local health department websites often have directories of providers experienced in PrEP. 

Additionally, consider reaching out to community support groups, both online and in person, where you can ask for recommendations. Remember, it's okay to advocate for yourself and find someone who respects your concerns and experiences. If stigma or anxiety becomes overwhelming, speaking with a mental health professional can also be beneficial.",English,1
18,what are some strategies to cope with the stigma i i mean might face wh1l3 seeking prep prep,"Coping with stigma can be challenging, but there are strategies that may help. Surround yourself with supportive people who understand your situation. Seek out local or online support groups where you can connect with others who share similar experiences. Educating yourself about PrEP can empower you, helping you feel more confident in discussing it. Remember that your health is a priority, and accessing preventive care is important. If feelings of anxiety or fear become overwhelming, consider talking to a mental health professional who specializes in health-related issues. You're not alone, and there are resources to support you on this journey.",English,1
19,What resources are available to help me find a healthcare provider who is understanding and non-judgmental about PrEP?,"It's great that you're seeking the right support! You can start by visiting local health departments or community health centers, as they often have providers experienced in HIV prevention and PrEP. Organizations like the National HIV/AIDS Hotline (1-800-CDC-INFO) and the PrEP Locator website can help you find providers who are knowledgeable and supportive.

Additionally, LGBTQ+ centers or local HIV advocacy groups may offer referrals to non-judgmental healthcare providers. Remember, you deserve compassionate care, and reaching out for support is a positive step toward your health. If you feel anxious, consider speaking with a mental health professional for guidance.",English,0
20,what should I look for in a h34l7hc4r3 provider 70 ensrue they areee supportive of my decision to use PrEP 🤔,"When looking for a healthcare provider supportive of PrEP, consider these key qualities:

1. **Knowledgeable**: They should understand PrEP options, including oral and injectable forms.
2. **Non-judgmental**: Look for a provider who creates a safe space for you to discuss concerns without stigma.
3. **Empathetic**: Choose someone who listens to your experiences and validates your feelings.
4. **Confidentiality**: Ensure they prioritize your privacy and confidentiality.
5. **Supportive**: They should offer resources and support, addressing any mental health concerns or fears you may have.

If you ever feel overwhelmed, seeking support groups or mental health resources can be beneficial. You deserve to feel comfortable and informed about your health decisions.",English,1
21,how can 1 find support groups that focus on PEP and .. reduce stigma around HIV?,"Finding support groups can be a positive step toward feeling less isolated and more informed. You can start by checking local health clinics, community organizations, or LGBTQ+ centers, as they often have resources for HIV prevention and care. Online platforms, like social media groups or forums, can also provide support and information. Organizations like the National Minority AIDS Council or local health departments may offer specific programs. Remember, seeking support is a brave step, and connecting with others who share similar experiences can help reduce feelings of stigma and anxiety. If you're feeling overwhelmed, consider reaching out to a mental health professional for additional support.",English,1
22,what should i say if someone judges me for considering pr3p?,"It’s understandable to feel anxious about potential judgment. If someone questions your choice to consider PrEP, you might say something like, “I’m looking out for my health and making informed decisions that are right for me.” Remember, your health is your priority, and seeking prevention options like oral or injectable PrEP is a responsible choice. Surrounding yourself with supportive people can help, and if feelings of stigma or fear become overwhelming, consider speaking with a professional who can provide guidance. You deserve to feel empowered in your health decisions without the weight of judgment.",English,1
23,What are the best ways to find supportive communities or resources for people using PrEP?,"Finding supportive communities for PrEP can be empowering. Consider the following resources:

1. **Local Health Clinics**: Many clinics offer support groups for those using PrEP, providing a safe space to share experiences.

2. **Online Forums**: Websites and social media groups focused on HIV prevention can connect you with others who understand your journey.

3. **HIV Organizations**: National and local organizations often have resources and networks to help you find support.

4. **Counseling Services**: Speaking with a mental health professional can help address fears and stigma surrounding PrEP.

Remember, it’s okay to seek support, and you deserve to feel safe and understood in your health decisions.",English,0
24,How can I approach conversations about PrEP with friends or family without facing judgment?,"It’s understandable to feel anxious about discussing PrEP with friends or family, especially in a community where stigma exists. You might start by sharing information about what PrEP is and how it helps prevent HIV. Emphasize that it’s a personal health choice and that many people use it. You can also express how important it is for you to feel supported in your health decisions. If conversations feel challenging, consider seeking support from professionals or local organizations that focus on HIV education—they can provide guidance and resources. Remember, prioritizing your health is important, and you deserve to feel safe and respected in your choices.",English,0
25,e-ehat resources 4r3 available to help me find supportive communities that understand PrEP and HIV isses?,"It's great that you're seeking supportive communities! You can find helpful resources through organizations like the American Academy of HIV Medicine, AIDS United, or the Center for Disease Control and Prevention (CDC). They often have local support groups and online forums where you can connect with others who understand PrEP and HIV issues. Additionally, websites like PrEP4All and The Well Project offer educational materials and community support. Remember, your health is important, and seeking support is a positive step. If feelings of stigma or anxiety arise, consider talking to a mental health professional who can provide guidance in a safe space.",English,1
26,How can I overcome my fear of judgment while trying to access PrEP services in my area?,"It's completely understandable to feel anxious about judgment when seeking PrEP services, especially in a stigmatized environment. Start by educating yourself about PrEP; knowledge can empower you. Consider reaching out to local health clinics or organizations that focus on HIV prevention—they often provide supportive, non-judgmental environments. Connecting with a community support group can also help you find others who share similar experiences. Remember, your health is a priority, and seeking PrEP is a proactive choice. If feelings of fear or anxiety become overwhelming, talking to a mental health professional can provide additional support. You're not alone in this journey.",English,0
27,What resources or organizations can I reach out to that provide discreet and supportive access to PrEP?,"It's great that you're seeking information about PrEP! Many organizations can help you access PrEP discreetly and supportively. The Centers for Disease Control and Prevention (CDC) offers resources and can direct you to local health departments. The National AIDS Hotline (1-800-CDC-INFO) provides confidential support and information.

Local clinics may also offer services, like Planned Parenthood or community health centers, which often focus on privacy and support. Additionally, organizations like the PrEP4All Coalition and local LGBTQ+ centers can provide guidance and resources tailored to your needs. Remember, reaching out for help is a strong step towards taking care of your health!",English,0
28,what should 1 say if someone questions my chioce to use PrEP,"It’s understandable to feel anxious about how others might respond. If someone questions your choice to use PrEP, you could say something like, ""I’m taking steps to protect my health, and PrEP is a safe and effective option for me."" This response emphasizes your personal health choices without needing to justify them. Remember, your health is your priority, and using PrEP is a responsible decision. If you ever feel overwhelmed by judgment or stigma, consider speaking with a mental health professional or a support group that understands these challenges. You deserve support and acceptance.",English,1
29,What resources are available for low-income individuals seeking support and information about PrEP?,"There are several resources available for low-income individuals seeking support and information about PrEP. The National HIV/AIDS Helpline (1-800-CDC-INFO) offers confidential support and can connect you to local services. Many community health centers provide PrEP at a reduced cost or for free, especially if you qualify for programs like the Ryan White HIV/AIDS Program. Additionally, organizations like PrEP4All and local AIDS service organizations often have information and support tailored to your needs. Remember, you're not alone, and seeking help is a strong step toward taking care of your health.",English,0
30,How can I find a supportive healthcare provider who understands my concerns about stigma related to PrEP?,"Finding a supportive healthcare provider is crucial, especially when dealing with concerns about stigma. You might start by looking for clinics that specialize in sexual health or HIV prevention, as they often have more understanding staff. Consider reaching out to local LGBTQ+ organizations or community health centers, as they can often recommend providers who are knowledgeable and non-judgmental. Additionally, online platforms like PrEP locator services can help you find providers in your area. Don’t hesitate to ask potential providers about their experience with stigma and how they ensure a supportive environment. Your health and comfort are important, and you deserve compassionate care.",English,0
