turn,user,bot,language,has_error
1,quelles sont les options disponibles opur obtenir PrEP um si je ressens de l'anxiété sociale,"Il existe deux options principales pour obtenir la PrEP : la PrEP orale, que vous prenez quotidiennement, et la PrEP injectable, administrée tous les deux mois. Pour accéder à ces traitements, vous pouvez consulter un professionnel de santé, comme un médecin ou un spécialiste en santé sexuelle, qui pourra vous orienter et vous rassurer.

Il est compréhensible de ressentir de l'anxiété sociale, surtout en raison de vos expériences passées. Sachez que vous n'êtes pas seul et qu'il existe des ressources pour vous soutenir. Pensez à contacter des professionnels de la santé mentale ou des groupes de soutien qui peuvent vous aider à surmonter ces craintes. Votre bien-être est important.",French,1
2,Comment puis-je trouver un professionnel de santé qui respecte ma situation et ne me jugera pas pour envisager la PrEP ?,"C'est tout à fait compréhensible de vouloir trouver un professionnel de santé respectueux et compréhensif, surtout en tenant compte de votre vécu. Vous pouvez commencer par rechercher des cliniques spécialisées dans la santé sexuelle qui sont connues pour leur approche inclusive. Des ressources en ligne, comme les sites de santé communautaire, peuvent également offrir des recommandations. N'hésitez pas à demander au personnel de la clinique comment ils abordent la PrEP et le soutien psychologique. Rappelez-vous que votre santé mentale est tout aussi importante; des professionnels comme des psychologues spécialisés peuvent vous aider à surmonter la stigmatisation liée à votre passé. Vous méritez un soutien empathique et sans jugement.",French,0
3,quels 5on7 les signes d'un professionnel de santé qui pourrait être sensible à ma situation par rapport à la PrEP et au PTSD ?,"Lorsque vous recherchez un professionnel de santé sensible à votre situation, voici quelques signes à considérer :

1. **Écoute active** : Ils prennent le temps d'écouter vos préoccupations sans interruption ni jugement.
2. **Empathie** : Ils montrent de la compassion et comprennent que votre passé peut influencer vos choix de santé.
3. **Non-jugement** : Ils ne portent pas de jugement sur votre situation ou vos choix concernant la PrEP.
4. **Connaissance des traumatismes** : Ils sont informés sur le PTSD et ses effets sur la santé mentale et physique.
5. **Approche inclusive** : Ils utilisent un langage inclusif et respectent votre identité de genre.

N'hésitez pas à poser des questions sur leur approche lors du premier rendez-vous pour vous sentir à l'aise.",French,1
4,Comment puis-je aborder le sujet de la PrEP avec un professionnel de santé sans craindre le jugement ?,"Aborder le sujet de la PrEP peut être difficile, surtout face à des expériences passées. Rappelez-vous que les professionnels de santé sont formés pour traiter ces discussions avec empathie et sans jugement. Vous pourriez commencer par expliquer que vous avez des préoccupations concernant votre santé sexuelle et que vous souhaitez explorer des options de prévention. Il peut être utile de préparer quelques questions à l'avance pour vous sentir plus à l'aise. Si vous ressentez de l'anxiété, envisagez de demander à un ami de vous accompagner. N'oubliez pas que vous méritez un soutien respectueux et compréhensif. Si vous avez besoin de parler de vos sentiments, des ressources professionnelles sont disponibles pour vous aider.",French,0
5,Quels sont les moyens d'obtenir des informations sur la PrEP qui respectent mon expérience traumatique et ma sensibilité à la stigmatisation ?,"Il est important de se sentir en sécurité et respecté lorsque vous cherchez des informations sur la PrEP. Vous pouvez envisager de consulter des professionnels de la santé qui sont formés pour aborder ces sujets avec compassion et sans jugement. Des organisations locales de santé sexuelle ou des lignes d'écoute peuvent également offrir un soutien adapté à vos préoccupations. 

La PrEP est disponible sous forme de comprimés oraux à prendre quotidiennement ou d'injections tous les deux mois. N'hésitez pas à poser des questions spécifiques et à partager vos préoccupations avec des personnes de confiance. Si vous ressentez le besoin de parler de votre passé traumatique, des thérapeutes spécialisés peuvent vous aider à naviguer ces émotions.",French,0
6,comment puis-je abooorder le sujet de la prep 4v3c mon médecin sans me sentir jugé ?,"Il est normal de ressentir de l'appréhension à aborder des sujets sensibles, surtout en lien avec votre santé sexuelle et votre histoire personnelle. Vous pourriez commencer par exprimer à votre médecin que vous avez des préoccupations concernant la stigmatisation et que vous souhaitez en discuter dans un cadre sûr. Les professionnels de santé sont formés pour traiter ces sujets avec empathie et respect. 

Rappelez-vous que la PrEP, qu'elle soit orale ou injectable, est une option de prévention efficace contre le VIH. Si vous ressentez le besoin d'un soutien supplémentaire, envisagez de contacter des groupes de soutien ou des professionnels de la santé mentale qui peuvent vous aider à gérer votre anxiété. Vous méritez d'avoir des conversations ouvertes sur votre santé sans jugement.",French,1
7,Quelles ressources ou groupes de 50ut13n pourraient m'aider à surmonter la stigmatisation liée à l'utilisation de la PrEP ? ?,"Il existe plusieurs ressources et groupes de soutien qui peuvent vous aider à surmonter la stigmatisation liée à l'utilisation de la PrEP. Vous pourriez envisager de rejoindre des groupes de soutien locaux ou en ligne, tels que ceux proposés par des organisations comme AIDES ou le Collectif PrEP. Ces groupes offrent un espace sûr pour partager des expériences et des préoccupations. 

De plus, consulter un professionnel de la santé mentale spécialisé dans les traumatismes peut également être bénéfique pour aborder les sentiments de stigmatisation et de peur. N’hésitez pas à rechercher des ressources dans votre région qui se concentrent sur le soutien aux personnes vivant avec le VIH et les préoccupations liées à la santé sexuelle. Vous n’êtes pas seul dans ce parcours.",French,1
8,c0mm3nt puis-je trouver hn professionnel d3 la santé m3n74l3 qu1 comprend les enjeux liés à la PrEP et au trrrauma ? ✨,"Je comprends que trouver un professionnel de la santé mentale qui soit à l'écoute de vos expériences et de vos préoccupations est important. Vous pouvez commencer par consulter des ressources locales, comme des cliniques spécialisées en santé sexuelle, qui peuvent avoir des spécialistes formés pour aborder les questions de PrEP et de trauma. 

Des plateformes en ligne peuvent également vous aider à trouver des thérapeutes qui se spécialisent dans la santé sexuelle et la gestion du trauma. N'hésitez pas à poser des questions sur leur expérience en matière de PrEP lors de la première rencontre. Prenez soin de vous et sachez que vous méritez un soutien adapté.",French,1
9,Quels critères devrais-je considérer pour choisir un thérapeute qui comprend la relation entre le PTSD et l'utilisation de la PrEP ?,"Choisir un thérapeute qui comprend les liens entre le PTSD et l'utilisation de la PrEP est essentiel. Voici quelques critères à considérer :

1. **Spécialisation** : Recherchez un thérapeute formé en santé mentale et en sexualité, qui a de l'expérience avec le PTSD et la prévention du VIH.

2. **Approche inclusive** : Assurez-vous qu'ils adoptent une approche non-jugeante et inclusive, respectant votre identité et vos expériences.

3. **Références** : Demandez des recommandations à des personnes de confiance ou à des organisations locales de santé.

4. **Consultation initiale** : Profitez d'une première rencontre pour évaluer leur compréhension et leur capacité à vous soutenir.

N’oubliez pas que votre confort est primordial dans cette relation.",French,0
10,comemnt puis-je ab0rd3r i mean la discussion sur la PrEP zvec m0n 7hér4p3u73 sans ressentir de jugement,"Il est compréhensible de ressentir de l'appréhension à aborder la PrEP avec votre thérapeute, surtout en lien avec des expériences passées. Vous pourriez commencer par exprimer vos préoccupations concernant la stigmatisation et votre désir d’obtenir des informations sur la PrEP. Rappelez-vous que les professionnels de la santé sont là pour vous soutenir, sans jugement. 

Vous pouvez également envisager de partager comment votre passé influence vos pensées sur la santé sexuelle. Si vous ressentez le besoin d'un soutien supplémentaire, des ressources comme des groupes de soutien peuvent également vous aider à discuter de ces sujets dans un environnement sûr.",French,1
11,um Quelles stratégies puis-je utiliser pour me sentir plus à l'aise 3n parlant de PrEP avec d'autres surtout en tenant compte de ma peur du jugement,"Il est compréhensible de ressentir de l'inconfort à parler de PrEP, surtout avec un passé traumatique. Voici quelques stratégies pour vous aider :

1. **Éducation** : Informez-vous sur PrEP; la connaissance peut réduire l'anxiété. Savoir que c'est un outil de prévention efficace peut renforcer votre confiance.

2. **Choix des personnes** : Parlez-en d'abord avec des amis ou des professionnels de santé en qui vous avez confiance. Cela peut créer un espace plus sûr.

3. **Groupes de soutien** : Rejoindre un groupe de soutien pour les personnes prenant ou envisageant de prendre PrEP peut vous aider à partager vos expériences sans jugement.

4. **Prendre votre temps** : Vous n'êtes pas obligé(e) de tout partager d'un coup; avancez à votre rythme.

Si vous ressentez le besoin d’un soutien supplémentaire, envisager de parler à un professionnel de la santé mentale peut être bénéfique.",French,1
12,comment puis-je trouvr des groupes de 5ou71en qui c0mprennen7 les défis liés à la 571gm47154710n de l'utilisation de PrEP,"Pour trouver des groupes de soutien qui comprennent les défis liés à la stigmatisation de l'utilisation de la PrEP, vous pouvez explorer plusieurs options. Recherchez des organisations locales ou nationales de santé sexuelle, comme AIDES ou le Sidaction en France, qui proposent souvent des groupes de soutien. Vous pouvez également consulter des forums en ligne ou des réseaux sociaux dédiés à la santé LGBTQ+, où des personnes partagent leurs expériences. N'hésitez pas à contacter des professionnels de la santé mentale qui peuvent vous orienter vers des ressources pertinentes. Rappelez-vous que vous n'êtes pas seul, et il existe des espaces sûrs pour discuter de ces préoccupations.",French,1
13,comment puis-je aborddder le sjet d3 la PrEP avec mln médecin en tenant compte de mes expériences passées ?,"Aborder le sujet de la PrEP avec votre médecin peut être un défi, surtout avec un passé traumatique. Voici quelques étapes pour faciliter cette conversation :

1. **Préparez-vous** : Notez vos préoccupations concernant la santé sexuelle et la PrEP. Cela peut vous aider à exprimer clairement vos pensées.

2. **Choisissez un moment approprié** : Demandez un rendez-vous où vous pourrez parler de manière confidentielle et sans pression.

3. **Soyez honnête** : Partagez vos expériences passées et comment elles influencent votre perception de la santé sexuelle.

4. **Posez des questions** : Demandez des informations sur la PrEP, ses avantages et ses options (orale ou injectable) pour vous sentir plus à l'aise.

N'hésitez pas à consulter un professionnel de la santé mentale pour un soutien supplémentaire. Vous n'êtes pas seul dans ce parcours.",French,1
14,Quels sont les moyens de réduire la stigmatisation autour de la PrEP dans ma communauté ?,"Pour réduire la stigmatisation autour de la PrEP, il est essentiel d'éduquer la communauté sur le VIH, la santé sexuelle et les options de prévention. Organiser des ateliers ou des discussions ouvertes peut aider à démystifier la PrEP. Le partage d'histoires personnelles et positives peut également favoriser l'empathie et l'acceptation. Créer des espaces sûrs pour parler de ces sujets sans jugement est crucial. Impliquer des professionnels de la santé et des défenseurs de la santé peut renforcer le message. Si vous ressentez des inquiétudes ou du stress, envisager de consulter un professionnel de la santé mentale peut également être bénéfique. Vous n'êtes pas seul et il existe des ressources pour vous soutenir.",French,0
15,Comment puis-je trouver un professionnel de santé qui comprend les enjeux de la PrEP et du PTSD dans ma situation ?,"Pour trouver un professionnel de santé qui comprend bien les enjeux de la PrEP et du PTSD, vous pourriez commencer par rechercher des cliniques spécialisées en santé sexuelle, qui offrent des services de PrEP. Les centres de santé communautaire peuvent également être une bonne option, car ils sont souvent formés pour traiter des personnes ayant vécu des traumatismes. Vous pouvez également demander des recommandations à des groupes de soutien ou à des associations LGBTQ+ qui ont souvent des ressources et des contacts. N’hésitez pas à poser des questions sur leur expérience avec la PrEP et la santé mentale lors de votre première consultation. Vous méritez d'être soutenu dans votre parcours.",French,0
16,Comment puis-je aborder le sujet de la PrEP avec un professionnel de santé sans me sentir jugé ?,"Il est tout à fait normal de se sentir anxieux à l'idée d'aborder des sujets sensibles comme la PrEP. Commencez par choisir un professionnel de santé avec qui vous vous sentez à l'aise, peut-être en cherchant des cliniques spécialisées dans la santé LGBTQ+. Vous pouvez aussi préparer à l'avance ce que vous souhaitez dire, en exprimant vos préoccupations sur la stigmatisation et votre passé. Rappelez-vous que ces professionnels sont là pour vous aider, pas pour vous juger. Si vous ressentez le besoin de soutien supplémentaire, envisager de parler à un thérapeute peut également être bénéfique. Prenez soin de vous.",French,0
17,Quels sont les moyens de réduire la stigmatisation liée à la PrEP dans mon entourage ?,"Il est important d'aborder la stigmatisation liée à la PrEP avec empathie et éducation. Vous pouvez commencer par partager des informations factuelles sur la PrEP, y compris son efficacité en tant que méthode de prévention du VIH, qu'elle soit orale ou injectable. Discuter ouvertement de vos propres expériences peut également aider à sensibiliser votre entourage.

Encourager des discussions sur la santé sexuelle sans jugement et promouvoir un environnement de soutien sont essentiels. Vous pourriez aussi envisager de rejoindre des groupes ou des ressources communautaires qui traitent de la PrEP et de la santé mentale, ce qui peut offrir un espace sûr pour partager vos préoccupations et trouver du soutien.",French,0
18,Comment puis-je trouver un groupe de soutien pour discuter de la PrEP et de mes expériences avec le PTSD ? 🙄,"Il est compréhensible de vouloir un espace sûr pour discuter de la PrEP et de vos expériences. Vous pouvez commencer par rechercher des organisations locales ou nationales qui se concentrent sur la santé sexuelle, le VIH et le soutien aux personnes ayant vécu des traumatismes. Beaucoup de ces groupes offrent des ressources, des forums en ligne ou des réunions en personne. 

En France, des associations comme AIDES ou le Sidaction peuvent vous orienter vers des groupes de soutien. N'oubliez pas que vous méritez un environnement sans jugement pour partager vos expériences. Si vous ressentez le besoin d'une aide plus professionnelle, envisagez de consulter un thérapeute spécialisé dans le PTSD.",French,1
19,quels sont les moyens pour réduire la stigmatisation autour d3 la PrEP dans les discussions sssur la sant sexuelle ? ?,"Pour réduire la stigmatisation autour de la PrEP dans les discussions sur la santé sexuelle, il est essentiel de promouvoir l'éducation et la sensibilisation. Partager des informations sur l’efficacité de la PrEP, ainsi que sur les personnes qui l’utilisent, peut aider à normaliser son utilisation. Encourager des conversations ouvertes et sans jugement entre amis, partenaires et professionnels de santé peut également diminuer la stigmatisation. Vous pouvez également envisager de rejoindre des groupes de soutien ou des ateliers sur la santé sexuelle, où vous pourrez échanger des expériences dans un environnement sûr et compréhensif. Si vous ressentez le besoin d’un soutien supplémentaire, n’hésitez pas à consulter un professionnel de la santé mentale.",French,1
20,comment puis-je aborder le sujet de la prep 4vc3 mes proches like sans craindre leur jugement ?,"Aborder le sujet de la PrEP avec vos proches peut être délicat, surtout si vous craignez le jugement. Une approche ouverte et honnête peut aider. Vous pourriez commencer par partager pourquoi la santé sexuelle est importante pour vous et comment la PrEP est un outil de prévention efficace. Expliquer que c’est une option pour réduire le risque de VIH peut aussi aider à démystifier le sujet. 

N'oubliez pas que vos expériences et vos préoccupations sont valables. Si vous ressentez de l’anxiété liée à la stigmatisation, il peut être utile de parler avec un professionnel de la santé mentale. Ils peuvent vous offrir un soutien adapté à votre situation.",French,1
21,Quels conseils pouvez-vous me donner pour trouver un professionnel de la santé qui comprend les enjeux de la stigmatisation liée à la PrEP ?,"Pour trouver un professionnel de la santé qui comprend les enjeux de la stigmatisation liée à la PrEP, commencez par rechercher des centres de santé communautaires ou des cliniques spécialisées dans la santé sexuelle. Ces établissements sont souvent formés pour aborder les questions de stigmatisation et de santé mentale. Vous pouvez également consulter des groupes de soutien ou des forums en ligne, où d'autres personnes partagent leurs expériences et recommandations. N'hésitez pas à poser des questions sur l'approche du professionnel concernant la stigmatisation lors de votre première consultation. Cela peut vous aider à vous sentir plus à l'aise et en sécurité.",French,0
22,comment puis-je surmonter ma peur du jugement lor5q3u je discute de la prep i mean avec un professionnel de la 5an7é ?,"C'est tout à fait normal de ressentir de l'appréhension en abordant des sujets aussi personnels que la PrEP, surtout si vous avez des expériences passées difficiles. Pour surmonter cette peur du jugement, choisissez un professionnel de santé avec qui vous vous sentez en sécurité et à l'aise. Vous pourriez aussi envisager de commencer la conversation en exprimant vos préoccupations. Les professionnels sont là pour vous soutenir, sans jugement. 

Si vous avez besoin de soutien supplémentaire, des ressources spécialisées, comme des groupes de soutien ou des thérapeutes, peuvent vous aider à naviguer ces émotions et à renforcer votre confiance. Vous méritez un espace sûr pour parler de votre santé.",French,1
23,Quels conseils pratiques pouvez-vous me donner pour aborder la discussion sur la PrEP sans me sentir mal à l'aise ?,"Il est compréhensible de se sentir mal à l'aise en abordant la PrEP, surtout avec un passé traumatique. Voici quelques conseils pratiques : 

1. **Préparez-vous** : Notez vos questions ou préoccupations à l'avance pour vous sentir plus à l'aise.
   
2. **Choisissez un professionnel de santé de confiance** : Cherchez quelqu'un qui comprend les enjeux liés à la stigmatisation et au PTSD.

3. **Soyez honnête** : Parler de votre expérience peut aider le professionnel à mieux comprendre vos besoins.

4. **Établissez un cadre de confidentialité** : Rappelez-vous que votre santé est votre priorité, et que vous méritez un espace sûr pour en discuter.

Si vous ressentez le besoin d'un soutien supplémentaire, envisagez de consulter un professionnel de la santé mentale. Vous méritez de vous sentir en sécurité et soutenu.",French,0
24,cimment puis-je trouver un pr0f35510nnel de santé qui comprend à la fois l4 PrEP et les impacttts du PTSD sur m4 um santé mentale 💀,"Il est important de trouver un professionnel de santé qui comprend vos besoins spécifiques. Vous pouvez commencer par chercher des cliniques spécialisées en santé sexuelle ou en VIH dans votre région, car elles sont souvent bien informées sur la PrEP. 

Pour le PTSD, envisagez de consulter des thérapeutes ou des psychologues spécialisés en santé mentale. Les plateformes en ligne comme Doctolib peuvent vous aider à trouver des professionnels qui mentionnent ces spécialités dans leurs profils. N'hésitez pas à poser des questions lors de la prise de rendez-vous pour vous assurer qu'ils comprennent vos préoccupations. Vous méritez un soutien compréhensif et sans jugement.",French,1
25,quels snt les moyens de réduire .a s71gm4ti54710n que je pourrais rencontrer lorsque j'aborde la rep aevc les autres ?,"Il est compréhensible de ressentir de l'appréhension face à la stigmatisation liée à la discussion sur la PrEP. Voici quelques suggestions pour vous aider : 

1. **Éducation** : Informez-vous sur la PrEP, tant orale qu'injectable, pour vous sentir plus à l'aise en partageant des faits avec les autres.

2. **Choix des personnes** : Parlez-en avec des amis de confiance ou des professionnels de la santé qui sont ouverts et compréhensifs.

3. **Groupes de soutien** : Rejoindre des groupes de soutien peut vous aider à partager des expériences dans un environnement sûr.

N'hésitez pas à consulter des professionnels de santé mentale pour vous accompagner dans ce processus. Vous méritez d'être soutenu.",French,1
26,Comment puis-je trouver des professionnels de santé qui sont sensibles à la stigmatisation liée à la PrEP et au PTSD ?,"Il est important de trouver des professionnels de santé qui comprennent vos préoccupations. Vous pourriez commencer par rechercher des cliniques spécialisées dans la santé sexuelle ou des centres de prévention du VIH, qui ont souvent une approche inclusive. Les ressources en ligne, comme des forums ou des groupes de soutien, peuvent également vous aider à trouver des recommandations de praticiens sensibles à ces enjeux. N’hésitez pas à poser des questions sur leur expérience avec des patients ayant des antécédents de trauma. Si vous ressentez le besoin de parler à quelqu'un, envisager de consulter un thérapeute spécialisé dans le PTSD peut également vous apporter un soutien précieux.",French,0
27,Quelles ressources ou groupes de soutien en France pourraient m'aider à mieux comprendre la PrEP sans me sentir jugé ?,"Il existe plusieurs ressources et groupes de soutien en France où vous pouvez obtenir des informations sur la PrEP dans un environnement inclusif et sans jugement. Vous pouvez consulter des associations comme AIDES ou le Sidaction, qui offrent des conseils sur la santé sexuelle et la prévention du VIH. Les centres de santé sexuelle, tels que les Cegidd (Centres gratuits d’information, de dépistage et de diagnostic), peuvent également fournir des informations sur la PrEP et offrir un espace sûr pour poser vos questions. N'hésitez pas à explorer ces options et à parler de vos préoccupations, car vous méritez d'être soutenu dans votre parcours.",French,0
28,Comment puis-je aborder le sujet de la PrEP avec mon médecin sans craindre le jugement ?,"Il est tout à fait normal de ressentir de l'appréhension à aborder des sujets sensibles comme la PrEP, surtout avec un passé traumatique. Vous pourriez commencer par exprimer vos préoccupations concernant votre santé sexuelle et mentionner que vous avez des questions sur la PrEP en tant qu'option de prévention. Rappelez-vous que les professionnels de santé sont là pour vous aider et qu'ils doivent respecter votre confidentialité et vos sentiments. Si vous ressentez de la stigmatisation ou de l'anxiété, il peut être utile de consulter un professionnel de la santé mentale pour vous accompagner dans ce processus. Vous méritez d'être soutenu dans votre parcours.",French,0
29,quels sont les moyens de réduire la stigmatisation que je pourrais rencontrer en parlant de PrwP dans ma communauté ?,"Il est compréhensible de se sentir inquiet face à la stigmatisation. Pour réduire cette stigmatisation, vous pourriez :

1. **Éduquer** : Partagez des informations sur PrEP et son efficacité, car la connaissance réduit souvent la peur.
2. **Créer des espaces sûrs** : Rejoindre ou créer des groupes de soutien où les discussions sur la santé sexuelle sont accueillies et respectées.
3. **Partager des témoignages** : Écouter ou partager des expériences personnelles peut aider à humaniser le sujet et à briser les stéréotypes.
4. **Promouvoir l'empathie** : Encourager des conversations ouvertes et respectueuses sur la santé sexuelle dans votre communauté.

N'hésitez pas à chercher des ressources professionnelles pour vous soutenir dans ce processus.",French,1
