turn,user,bot,language,has_error
1,w-welche möglifhen Nebenwirkungen könnte ich von PrEP erwarten 💀,"Es ist ganz normal, sich über mögliche Nebenwirkungen von PrEP Gedanken zu machen. Zu den häufigsten Nebenwirkungen gehören Übelkeit, Kopfschmerzen, Müdigkeit und manchmal Veränderungen in den Nierenwerten. Diese sind in der Regel mild und verschwinden oft nach einigen Wochen. 

Es ist wichtig, regelmäßige Arztbesuche zur Überwachung einzuplanen. Wenn du Bedenken wegen Stigmatisierung oder mentaler Gesundheit hast, wäre es hilfreich, mit einem Fachmann zu sprechen, der dir Unterstützung bieten kann. Du bist nicht allein in deinen Ängsten, und es gibt Ressourcen, die dir helfen können.",German,1
2,wie kann ich mit der Ang57 umgehen adss andere negtaiv über mich denken wenn ich PrEP in Erwägung zi3h3 zi3h3,"Es ist verständlich, dass du dir Sorgen machst, was andere über dich denken könnten. Viele Menschen haben ähnliche Ängste, wenn es um PrEP geht. Es ist wichtig zu wissen, dass die Einnahme von PrEP eine verantwortungsvolle Entscheidung ist, um sich selbst und andere zu schützen. Es gibt sowohl orale als auch injizierbare Formen von PrEP, die effektiv sind.

Wenn du über Stigmatisierung oder Selbstwertgefühl nachdenkst, kann es hilfreich sein, mit jemandem zu sprechen, z. B. einem Psychologen oder einer Beratungsstelle. Professionelle Unterstützung kann dir helfen, deine Ängste zu bewältigen und einen positiven Umgang mit deiner Gesundheit zu finden.",German,1
3,Welche Nebenwirkungen sind mit der Einnahme von PrEP verbunden und wie häufig treten sie auf?,"PrEP, sowohl die orale als auch die injizierbare Form, kann einige Nebenwirkungen haben, die in der Regel mild und vorübergehend sind. Häufige Nebenwirkungen sind Übelkeit, Kopfschmerzen und Müdigkeit, die oft innerhalb der ersten Wochen nach Beginn der Behandlung auftreten. Schwere Nebenwirkungen sind selten, können aber Nierenprobleme umfassen. Es ist wichtig zu wissen, dass viele Menschen PrEP gut vertragen und keine ernsthaften Nebenwirkungen erleben. Wenn du Bedenken hast, ist es hilfreich, mit einem Fachmann über deine Ängste zu sprechen, um mehr Informationen und Unterstützung zu erhalten. Es gibt auch Ressourcen, die dir helfen können, mit Stigmatisierung und Selbstwertgefühl umzugehen.",German,0
4,wie kann ich mit meiner Angst v0r Stigmatisierung umgehen wenn ich PrEP in Betracht ziehe,"Es ist verständlich, dass du dir Sorgen über Stigmatisierung machst, wenn du über PrEP nachdenkst. Viele Menschen haben ähnliche Bedenken. Es könnte hilfreich sein, mit jemandem zu sprechen, dem du vertraust, oder einem Fachmann, der sich auf sexuelle Gesundheit spezialisiert hat. Sie können dir Informationen und Unterstützung bieten, die dir helfen, dich sicherer zu fühlen.

PrEP ist eine wirksame Methode zur HIV-Prävention, sowohl in Form von Tabletten als auch als Spritze. Die meisten Menschen haben keine schweren Nebenwirkungen. Es ist wichtig, die Vor- und Nachteile mit einem Arzt zu besprechen, um eine informierte Entscheidung zu treffen. Du bist nicht allein in diesem Prozess!",German,1
5,welche Nebenwirkungen sind bei der Einnahme von rPEP am häufigsten ujd wie kann ich damit umgehen?,"Bei der Einnahme von PrEP, sowohl oral als auch injizierbar, können einige Nebenwirkungen auftreten, wie Übelkeit, Kopfschmerzen und Müdigkeit. Viele Menschen haben jedoch keine oder nur milde Nebenwirkungen. Es ist wichtig, regelmäßig mit einem Arzt oder einer Ärztin darüber zu sprechen, um deine Bedenken zu besprechen und Unterstützung zu erhalten.

Wenn du dich mit Stigmatisierung oder Ängsten über PrEP auseinandersetzt, könnte es hilfreich sein, mit einem Fachmann für psychische Gesundheit zu sprechen, um deine Gedanken und Gefühle zu klären. Du bist nicht allein, und es gibt Unterstützung.",German,1
6,"Wie kann ich mit meinen Ängsten vor Stigmatisierung umgehen, während ich über PrEP nachdenke?","Es ist ganz normal, sich über Stigmatisierung Gedanken zu machen, besonders wenn es um Themen wie PrEP geht. Es kann hilfreich sein, sich an vertrauenswürdige Freunde oder Fachleute zu wenden, um über deine Ängste zu sprechen. Oft hilft es, Informationen zu sammeln, um mehr über PrEP zu erfahren, sowohl über die orale als auch die injizierbare Form. 

Denke daran, dass deine Gesundheit und dein Wohlbefinden an erster Stelle stehen. Fachkräfte für psychische Gesundheit können wertvolle Unterstützung bieten, um deine Ängste zu bewältigen. Du bist nicht allein in diesem Prozess, und es gibt Ressourcen, die dir helfen können.",German,0
7,"Welche Informationen über die möglichen Nebenwirkungen von PrEP sind wichtig, um meine Ängste zu reduzieren?","Es ist verständlich, dass du dir Sorgen über mögliche Nebenwirkungen von PrEP machst. Zu den häufigsten Nebenwirkungen von oralem und injectable PrEP gehören Übelkeit, Müdigkeit und Kopfschmerzen, die oft vorübergehend sind. Schwerwiegendere Nebenwirkungen sind selten, können aber Nierenprobleme oder allergische Reaktionen umfassen. Es ist wichtig, regelmäßig ärztliche Kontrollen durchzuführen, um deine Gesundheit zu überwachen. 

Die Angst vor Stigmatisierung ist ebenfalls nachvollziehbar. Gespräche mit vertrauten Menschen oder Fachleuten können helfen, diese Gefühle zu bearbeiten. Wenn du Unterstützung brauchst, ziehe in Betracht, mit einem Psychologen oder Berater zu sprechen. Du bist nicht allein in dieser Situation.",German,0
8,"wie kann ich mit den Ängsten umgehen, die mir den Zigang zu Pr3P und den dmit verbundenen Informationen erschweren?","Es ist verständlich, dass Ängste und Sorgen über Stigmatisierung und Nebenwirkungen dich belasten können. Es ist wichtig, deine Gefühle ernst zu nehmen. Der Zugang zu Informationen über PrEP kann helfen, Unsicherheiten zu verringern. PrEP ist eine sehr effektive Methode zur HIV-Prävention, sowohl in oraler Form als auch als Injektion. 

Es könnte hilfreich sein, mit einem Fachmann für sexuelle Gesundheit oder einem Berater zu sprechen, der dich unterstützen kann und Verständnis für deine Bedenken hat. Es gibt auch Selbsthilfegruppen und Online-Communities, die dir helfen können, dich weniger allein zu fühlen. Du musst dich nicht schämen, Fragen zu stellen und Informationen zu suchen.",German,1
9,welche konkreten Nebenwirkungen von PrEP sollte ich beachten und wie häufig treten sie auf 😬,"Es ist verständlich, dass du dir Sorgen über mögliche Nebenwirkungen von PrEP machst. Zu den häufigsten Nebenwirkungen gehören Übelkeit, Kopfschmerzen und Müdigkeit. Diese treten in der Regel nur in den ersten Wochen der Einnahme auf und sind oft mild. Ernsthafte Nebenwirkungen sind selten, können aber Nierenprobleme umfassen, die durch regelmäßige Tests überwacht werden.

Wenn du Bedenken hast, ist es hilfreich, mit einem Gesundheitsdienstleister zu sprechen, der dir detaillierte Informationen und Unterstützung bieten kann. Es ist auch wichtig, sich nicht von Stigmatisierung abhalten zu lassen. Viele Menschen nutzen PrEP, um sich und andere zu schützen. Du bist nicht allein!",German,1
10,"Wie kann ich mit meiner Angst vor der Stigmatisierung umgehen, wenn ich mich für PrEP entscheide?","Es ist verständlich, besorgt über Stigmatisierung zu sein, vor allem, wenn es um PrEP geht. Viele Menschen ziehen PrEP in Betracht, um sich selbst und andere zu schützen. Es kann hilfreich sein, mit vertrauenswürdigen Freunden oder Fachleuten über deine Ängste zu sprechen. So kannst du Unterstützung finden und Informationen sammeln, die dir helfen, die Entscheidung zu treffen, die für dich am besten ist. 

Wenn du über mögliche Nebenwirkungen besorgt bist, ist es wichtig, sich darüber zu informieren. Sowohl orale als auch injizierbare PrEP haben in der Regel gut verträgliche Nebenwirkungen. Professionelle Beratungsstellen können dir helfen, deine Bedenken zu klären und deinen Selbstwert zu stärken.",German,0
11,welche Nebenwirkungen sind bei der Einnahme von PrEP am häufigsten und wie lange halten 513 normalerweise 4n? 🙂,"Die häufigsten Nebenwirkungen von PrEP (sowohl oral als auch injizierbar) sind zum Beispiel Übelkeit, Kopfschmerzen und Müdigkeit, die in der Regel mild sind und oft nach einigen Wochen abklingen. Es ist wichtig zu wissen, dass viele Menschen PrEP gut vertragen und keine ernsthaften Nebenwirkungen erleben. 

Deine Bedenken bezüglich Stigmatisierung sind verständlich. Es kann hilfreich sein, mit jemandem zu sprechen, der Erfahrung mit PrEP hat, oder professionelle Unterstützung in Anspruch zu nehmen. Du bist nicht allein, und es gibt viele Ressourcen, die dir helfen können, deine Ängste zu besprechen.",German,1
12,"Wie kann ich mit der Angst umgehen, dass andere über meine Entscheidung zur PrEP urteilen könnten?","Es ist verständlich, dass du Bedenken über die Meinungen anderer hast. Viele Menschen fühlen sich so, wenn es um PrEP geht, da es oft mit Stigmatisierung verbunden wird. Denke daran, dass deine Gesundheit und dein Wohlbefinden Priorität haben. Es könnte hilfreich sein, mit einer Vertrauensperson oder einem Fachmann über deine Ängste zu sprechen. Sie können Unterstützung bieten und dir helfen, dich sicherer zu fühlen. PrEP, ob oral oder als injizierbare Form, ist eine wirksame Methode zur HIV-Prävention. Es gibt auch viele Ressourcen und Gemeinschaften, die Verständnis und Unterstützung bieten. Du bist nicht allein in diesem Prozess.",German,0
13,welche uh möglichen nebenwirkumgen von prep sollte ich beachten unnnd wie häuf1g treten sie auf,"Es ist verständlich, dass du dir Gedanken über mögliche Nebenwirkungen von PrEP machst. Zu den häufigsten Nebenwirkungen gehören Übelkeit, Müdigkeit und Kopfschmerzen. Diese treten in der Regel bei etwa 10% der Menschen auf, die PrEP einnehmen, und klingen oft innerhalb der ersten Wochen ab. 

Wichtig ist, dass viele Menschen PrEP gut vertragen und keine ernsthaften Nebenwirkungen erleben. Wenn du Bedenken hast, wäre es hilfreich, mit einem Arzt oder einer Ärztin zu sprechen, um deine Ängste und Fragen zu klären. Denke daran, dass es okay ist, Unterstützung zu suchen, um deine Sorgen über Stigmatisierung und Selbstwertgefühl anzugehen.",German,1
14,"Wie kann ich meine Bedenken bezüglich der Stigmatisierung ansprechen, wenn ich mit meinem Arzt über PrEP sprechen möchte?","Es ist verständlich, dass du Bedenken wegen Stigmatisierung hast. Du könntest deinem Arzt direkt sagen, dass du dich unwohl fühlst, über PrEP zu sprechen, und dass du Bedenken bezüglich der Reaktionen anderer hast. Ein offenes Gespräch kann helfen, das Vertrauen zu stärken. Ärzte sind geschult, sensibel mit solchen Themen umzugehen und können dir versichern, dass deine Privatsphäre respektiert wird. Wenn du dich mehr unterstützt fühlen möchtest, kannst du auch in Erwägung ziehen, eine Beratungsstelle oder Selbsthilfegruppe aufzusuchen. Es ist wichtig, dass du dich wohlfühlst, wenn du über deine Gesundheit sprichst.",German,0
15,welche nebenwirkungen von prep sollte uh ich besonders beachten und wie häufig treten sie auf,"Bei PrEP, sowohl in oraler Form als auch als Injektion, sind die meisten Nebenwirkungen mild und vorübergehend. Häufige Nebenwirkungen können Übelkeit, Kopfschmerzen oder Müdigkeit sein, die in der Regel innerhalb der ersten Wochen nach Beginn der Behandlung auftreten. Seltenere, aber ernstere Nebenwirkungen können Nierenprobleme oder allergische Reaktionen sein. Es ist wichtig, regelmäßig ärztliche Kontrollen wahrzunehmen, um deine Gesundheit zu überwachen. Wenn du über deine Ängste oder Bedenken sprechen möchtest, könnte es hilfreich sein, mit einem Fachmann für psychische Gesundheit oder einem Berater zu sprechen. Es ist normal, solche Gefühle zu haben, und Unterstützung zu suchen, ist ein wichtiger Schritt.",German,1
16,w-wie kann ich mit der angs umgehen dass andere negativ üer meine entscheidung für prep denken könnten,"Es ist völlig verständlich, sich Sorgen über das Urteil anderer zu machen. Viele Menschen haben ähnliche Ängste. Wichtig ist, dass du für deine Gesundheit und dein Wohlbefinden sorgst. PrEP, sowohl in oraler als auch in injizierbarer Form, ist eine bewährte Methode zur HIV-Prävention und wird von vielen Menschen genutzt. 

Wenn du dich über Stigmatisierung oder Ängste austauschen möchtest, könnte es hilfreich sein, mit einem Fachmann, wie einem Therapeuten oder Berater, zu sprechen. Sie können dir dabei helfen, deine Gefühle zu verarbeiten und Strategien zu entwickeln, um damit umzugehen. Du bist nicht allein in diesem Prozess.",German,1
17,"Welche Nebenwirkungen können bei der Einnahme von PrEP auftreten, und wie häufig sind sie?","Bei der Einnahme von PrEP, sowohl in oraler Form als auch als injizierbare Variante, können einige Nebenwirkungen auftreten. Häufige Nebenwirkungen sind Übelkeit, Kopfschmerzen und Müdigkeit, die meist mild sind und oft innerhalb der ersten Wochen abklingen. Seltene, aber ernstere Nebenwirkungen können Nierenprobleme oder Veränderungen der Knochendichte sein. Es ist wichtig, regelmäßig mit einem Arzt oder einer Fachkraft zu sprechen, um sicherzustellen, dass alles gut verläuft. Wenn du Bedenken hast, ist es auch hilfreich, mit einem Fachmann über deine Ängste und Sorgen zu sprechen. Du bist nicht allein, und es gibt Unterstützung.",German,0
18,wie kaaann icu mit dem gefühl der 571gma71513rung umgehen wenn ich über prep spreche oder darüber nachdenke?,"Es ist völlig verständlich, sich über Stigmatisierung Gedanken zu machen, wenn es um PrEP geht. Viele Menschen haben ähnliche Bedenken. Wichtig ist, dass PrEP eine präventive Maßnahme ist, die Menschen vor HIV schützt und nicht das Selbstwertgefühl mindern sollte. 

Wenn du mit jemandem darüber sprechen möchtest, könnte es hilfreich sein, dich an Fachleute oder Selbsthilfegruppen zu wenden, die sich mit HIV-Prävention und den damit verbundenen Gefühlen befassen. Es gibt auch Therapieangebote, die dir helfen können, mit den Ängsten umzugehen. Du bist nicht allein, und es gibt Unterstützung für dich.",German,1
19,welche möglchen nebenwirkungen von prep sollte ich beachyen und wie häfuig um treten diese auf,"PrEP, sowohl in oraler als auch in injizierbarer Form, kann Nebenwirkungen haben, die jedoch nicht bei jedem auftreten. Häufige Nebenwirkungen sind Übelkeit, Kopfschmerzen und Müdigkeit, die meistens in den ersten Wochen der Einnahme auftreten. Seltenere, aber ernsthaftere Nebenwirkungen können Nierenprobleme oder allergische Reaktionen sein.

Es ist wichtig, regelmäßig mit einem Arzt zu sprechen, um mögliche Nebenwirkungen zu überwachen. Wenn du Bedenken hast oder dich unwohl fühlst, empfehle ich, mit einem Fachmann zu sprechen, der dir helfen kann, diese Ängste zu adressieren. Es ist völlig normal, solche Sorgen zu haben.",German,1
20,"Wie kann ich sicherstellen, dass meine Freunde und Familie meine Entscheidung, PrEP in Betracht zu ziehen, verstehen und akzeptieren?","Es ist verständlich, dass du dir Sorgen über die Reaktionen deiner Freunde und Familie machst. Offene und ehrliche Gespräche können helfen. Du könntest erklären, dass PrEP eine präventive Maßnahme ist, die Menschen hilft, sich vor HIV zu schützen, und dass es für dich wichtig ist, deine Gesundheit zu priorisieren. 

Zusätzlich könntest du Informationen über PrEP bereitstellen, um Missverständnisse abzubauen. Es kann auch hilfreich sein, Unterstützung bei einem Fachmann oder einer Selbsthilfegruppe zu suchen, um deine Gedanken und Gefühle zu besprechen. Denke daran, dass dein Wohlbefinden an erster Stelle steht und dass du das Recht hast, deine Gesundheit in die eigenen Hände zu nehmen.",German,0
21,Welche Nebenwirkungen sind bei der Einnahme von PrEP am häufigsten und wie kann ich damit umgehen?,"Es ist verständlich, dass du dir Sorgen über mögliche Nebenwirkungen von PrEP machst. Zu den häufigsten Nebenwirkungen gehören leichte Übelkeit, Kopfschmerzen und Müdigkeit, die oft innerhalb von wenigen Wochen nachlassen. Bei einigen Menschen kann es auch zu Veränderungen der Nierenfunktion kommen, weshalb regelmäßige ärztliche Kontrollen wichtig sind.

Es ist hilfreich, offen mit einem Gesundheitsdienstleister über deine Bedenken zu sprechen. Sie können dir helfen, die Vor- und Nachteile abzuwägen und unterstützen dich bei der Überwindung von Ängsten. Wenn du das Gefühl hast, dass Stigmatisierung oder andere emotionale Herausforderungen dich belasten, ziehe in Betracht, mit einem Fachmann für psychische Gesundheit zu sprechen. Du bist nicht allein in deinen Sorgen.",German,0
22,"Wie kann ich meine Ängste bezüglich der Stigmatisierung überwinden, um PrEP in Betracht zu ziehen?","Es ist ganz normal, Ängste vor Stigmatisierung zu haben, besonders wenn es um Themen wie PrEP geht. Viele Menschen fühlen sich so. Es kann hilfreich sein, sich mit vertrauenswürdigen Personen oder Fachleuten auszutauschen, die Verständnis für deine Bedenken haben. Informiere dich über PrEP und die positiven Erfahrungen anderer, um ein besseres Gefühl zu bekommen.

Zur Nebenwirkungen: Diese können individuell unterschiedlich sein, und die meisten Menschen haben keine ernsthaften Probleme. Ein offenes Gespräch mit einem Arzt oder einer Fachkraft kann dir helfen, deine Ängste zu klären. Wenn du Unterstützung bei deinen Gefühlen brauchst, ziehe in Betracht, professionelle Hilfe in Anspruch zu nehmen. Du bist nicht allein!",German,0
23,"Welche konkreten Schritte kann ich unternehmen, um mehr über die Nebenwirkungen von PrEP zu erfahren und mich gleichzeitig mit meinen Ängsten auseinanderzusetzen?","Es ist verständlich, dass du Bedenken bezüglich der Nebenwirkungen von PrEP und der Stigmatisierung hast. Ein erster Schritt könnte sein, mit einem Arzt oder einer Fachkraft für sexuelle Gesundheit zu sprechen, die dir fundierte Informationen über PrEP – sowohl die orale als auch die injizierbare Form – geben kann. Sie können dir auch helfen, deine Ängste zu besprechen und zu verstehen, wie die Behandlung funktioniert.

Darüber hinaus gibt es Online-Ressourcen und Selbsthilfegruppen, die dir Unterstützung bieten können. Es ist wichtig, sich mit Menschen auszutauschen, die ähnliche Erfahrungen gemacht haben. Denke daran, dass deine Gesundheit und dein Wohlbefinden an erster Stelle stehen.",German,0
24,"w-wie kann ich die angst vor s71gma71513rung überwinden, wenn ich erwäge, prep zu nehmen?","Es ist verständlich, dass du Angst vor Stigmatisierung hast, wenn es um PrEP geht. Viele Menschen fühlen sich so, und es ist wichtig, sich daran zu erinnern, dass deine Gesundheit und dein Wohlbefinden an erster Stelle stehen. Offene Gespräche mit vertrauenswürdigen Freunden oder Fachleuten können helfen, diese Ängste zu lindern. 

PrEP, sowohl in oraler als auch in injizierbarer Form, ist eine bewährte Methode zur HIV-Prävention. Zu den Nebenwirkungen gehören gelegentlich Übelkeit oder Kopfschmerzen, die oft mild sind. Es gibt jedoch Unterstützung, um mit diesen Ängsten umzugehen. Professionelle Ressourcen wie Beratungsstellen oder Selbsthilfegruppen können ebenfalls hilfreich sein. Du bist nicht allein in diesem Prozess.",German,1
25,"Welche Möglichkeiten gibt es, um die möglichen Nebenwirkungen von PrEP besser zu verstehen und damit umzugehen?","Es ist völlig normal, Bedenken bezüglich der Nebenwirkungen von PrEP zu haben. Um mehr darüber zu erfahren, kannst du mit einem Arzt oder einem Fachmann für sexuelle Gesundheit sprechen, der dir die Informationen und Unterstützung bieten kann, die du benötigst. 

Es gibt zwei Hauptformen von PrEP: orale Tabletten, die täglich eingenommen werden, und injizierbare PrEP, die alle zwei Monate verabreicht wird. Beide Optionen können Nebenwirkungen haben, die jedoch in der Regel mild sind. 

Wenn du weitere Ängste oder Stigmatisierung empfindest, könnten Gespräche mit einem Therapeuten oder einer Selbsthilfegruppe hilfreich sein. Du bist nicht allein, und es gibt Unterstützung.",German,0
26,w13 k4nn ich mit den ängsten umgehn die ich wegen der stigmatisierung empfind wen ich üebr prep spreche,"Es ist vollkommen verständlich, dass du Bedenken bezüglich Stigmatisierung hast. Viele Menschen fühlen sich so, wenn es um Themen wie PrEP geht. Es ist wichtig, dass du dich in einem sicheren Umfeld befindest, in dem du offen sprechen kannst. Überlege, mit einem Fachmann oder einer Fachfrau für sexuelle Gesundheit zu sprechen, der dir helfen kann, deine Ängste zu adressieren und mehr Informationen zu PrEP zu erhalten. PrEP ist sicher und kann in Form von Tabletten oder Injektionen eingenommen werden. Denk daran, dass es viele Menschen gibt, die ähnliche Fragen haben und Unterstützung suchen. Du bist nicht allein.",German,1
27,"Welche Nebenwirkungen von PrEP sollte ich erwarten, und sind sie ernsthaft genug, um meine Entscheidung zu beeinflussen?","Es ist verständlich, dass du Bedenken hinsichtlich der Nebenwirkungen von PrEP hast. Zu den häufigsten Nebenwirkungen gehören Übelkeit, Müdigkeit und Kopfschmerzen, die in der Regel mild und vorübergehend sind. Schwere Nebenwirkungen sind selten, können aber auftreten. Es ist wichtig, mit einem Arzt oder einer Fachkraft für sexuelle Gesundheit zu sprechen, um deine Sorgen zu besprechen und alle Informationen zu erhalten, die du benötigst, um eine informierte Entscheidung zu treffen. 

Wenn du dich wegen Stigmatisierung oder Selbstwertgefühl unsicher fühlst, gibt es Unterstützung, die dir helfen kann. Professionelle Ressourcen wie Psychologen oder Selbsthilfegruppen können hilfreich sein.",German,0
28,"Wie kann ich mit der Angst vor Stigmatisierung umgehen, wenn ich PrEP in Betracht ziehe?","Es ist verständlich, dass du dir Sorgen über Stigmatisierung machst. Viele Menschen fühlen sich ähnlich, wenn es um PrEP geht. Es könnte hilfreich sein, mit vertrauenswürdigen Freunden oder Fachleuten zu sprechen, die deine Bedenken ernst nehmen. Informiere dich über PrEP, um mehr über die Vorteile und möglichen Nebenwirkungen zu erfahren. Es gibt sowohl orale als auch injizierbare Optionen. Denke daran, dass deine Gesundheit und dein Wohlbefinden wichtig sind. Wenn du das Gefühl hast, dass deine Ängste überwältigend sind, könnte es hilfreich sein, mit einem Therapeuten oder Berater über deine Gefühle zu sprechen. Sie können dir Unterstützung bieten.",German,0
29,Welche konkreten Nebenwirkungen sind bei der Einnahme von PrEP am häufigsten und wie wahrscheinlich sind sie? 😅,"Es ist verständlich, dass du dir Sorgen über mögliche Nebenwirkungen machst. Bei der oralen PrEP sind häufige Nebenwirkungen wie Übelkeit, Durchfall oder Kopfschmerzen möglich, treten jedoch oft nur in den ersten Wochen auf und klingen dann ab. Sehr selten können ernsthafte Nebenwirkungen wie Nierenprobleme auftreten, weshalb regelmäßige Arztbesuche wichtig sind. 

Bei der injizierbaren PrEP sind ähnliche Nebenwirkungen möglich, oft in Form von Schmerzen an der Injektionsstelle oder grippeähnlichen Symptomen. Die Wahrscheinlichkeit, ernsthafte Nebenwirkungen zu haben, ist jedoch gering. Es ist wichtig, darüber offen mit einem Fachmann zu sprechen, um alle Bedenken zu klären. Du bist nicht allein, und es gibt Unterstützung.",German,1
30,"wie kann ich mit meinen ängsten umgehen, um offener über rep sprechen zi können?","Es ist verständlich, dass Angst vor Stigmatisierung und möglichen Nebenwirkungen dich daran hindert, offen über PrEP zu sprechen. Es könnte hilfreich sein, dir bewusst zu machen, dass viele Menschen in ähnlichen Situationen sind und sich für ihre Gesundheit entscheiden. 

Du könntest mit vertrauenswürdigen Freunden oder Gesundheitsfachleuten sprechen, die dich unterstützen können. Professionelle Ressourcen wie Beratungsstellen für sexuelle Gesundheit können ebenfalls helfen, deine Ängste zu besprechen. Informiere dich über PrEP, sowohl über die orale als auch über die injizierbare Form, um besser zu verstehen, wie sie funktioniert und welche Nebenwirkungen möglich sind. Es ist wichtig, dass du dich wohlfühlst, wenn du Entscheidungen für deine Gesundheit triffst.",German,1
