turn,user,bot,language,has_error
1,¿Es posible obtene rPEP sin tener que proporcionar informacón um personal complicada?,"Entiendo que la situación puede ser estresante. PEP (profilaxis post-exposición) es un tratamiento que se utiliza después de una posible exposición al VIH y generalmente requiere atención médica. Sin embargo, algunos centros de salud y clínicas pueden ofrecer servicios de forma anónima o con información personal mínima. Te recomiendo buscar organizaciones locales que se especialicen en salud sexual o VIH, ya que pueden ofrecerte apoyo y recursos sin un proceso complicado. Tu bienestar es importante, y hay opciones disponibles para recibir atención. Si necesitas apoyo emocional, considera hablar con un profesional de salud mental.",Spanish,1
2,¿Cuáles son los centros de salud en México que 0fr3c3n PrEP sin exigir demasiada información personal?,"En México, varios centros de salud ofrecen PrEP y pueden tener políticas más accesibles sobre la información personal. Es recomendable buscar clínicas especializadas en salud sexual, como las del Sistema Nacional de Salud, y organizaciones no gubernamentales que trabajan en prevención del VIH. Puedes consultar a la Red Mexicana de Personas que Viven con VIH (REMEDI) o la organización “Cáritas” que brindan recursos y apoyo. Recuerda que también hay opciones de PrEP oral y injectable. Si sientes ansiedad o miedo por el estigma, considera hablar con un profesional de salud mental que pueda ofrecerte apoyo. Tu salud es importante.",Spanish,1
3,¿Existen programas o recursos en México que ofrezcan apoyo emocional para personas que están considerando el uso de PrEP?,"Sí, en México hay varios recursos que pueden ofrecer apoyo emocional y acceso a información sobre PrEP. Organizaciones como la Red Mexicana de Personas que Viven con VIH (REMFVIH) y el Centro Nacional para la Prevención y el Control del VIH/SIDA (CENSIDA) pueden ayudarte. También puedes buscar clínicas comunitarias que ofrezcan servicios de salud y apoyo psicológico. Es importante que hables con un profesional de salud para abordar tus preocupaciones y recibir el apoyo que necesitas. No estás solo en esto, y hay recursos disponibles para ayudarte en tu situación.",Spanish,0
4,¿Dónde puedo encontrar clínicas comunitarias en México que ofrezcan PrEP y atención médica gratuita o de bajo costo?,"En México, hay varias clínicas comunitarias y organizaciones que ofrecen PrEP y atención médica gratuita o de bajo costo. Puedes buscar en:

1. **Centros de Salud**: Muchos ofrecen servicios de salud sexual y prevención del VIH.
2. **Organizaciones no gubernamentales (ONG)**: Algunas, como la Fundación Mexicana para la Salud, ofrecen servicios de salud gratuitos.
3. **Clínicas de VIH**: Estas clínicas suelen tener programas de PrEP y pueden brindarte atención especializada.

Te recomiendo contactar a la línea de atención del VIH en tu estado para obtener información específica sobre las clínicas cercanas a tu ubicación. También es importante hablar con profesionales de salud mental si sientes ansiedad o miedo por el estigma.",Spanish,0
5,¿Existen programas específicos que ofrezcan transporte o ayuda para acceder a estas clínicas si no tengo medios para llegar?,"Existen varios programas y recursos que pueden ayudar con el transporte y el acceso a clínicas de salud. Muchas organizaciones comunitarias y de salud pública ofrecen asistencia para el transporte a personas que necesitan atención médica, especialmente en el contexto de la prevención del VIH y el acceso a PrEP. Puedes buscar clínicas locales que ofrezcan servicios de salud gratuitos o de bajo costo y preguntar si tienen programas de transporte. También hay líneas de ayuda y recursos que pueden brindarte más información sobre cómo acceder a estos servicios. No dudes en comunicarte con organizaciones de salud en tu área para obtener apoyo adicional.",Spanish,0
6,¿xódne puedo encontrar clnicas qu3 ofrezcan PrEP y que sean accesibles para personas sin hg04r,"Entiendo que acceder a servicios de salud puede ser un desafío, especialmente en tu situación. Muchas clínicas comunitarias y organizaciones de salud pública ofrecen PrEP de forma gratuita o a bajo costo, independientemente de tu situación de vivienda. Puedes buscar clínicas que brinden servicios de salud sexual o prevención del VIH en tu área. 

Además, algunos programas de salud pueden ofrecer apoyo y recursos adicionales. Si te sientes ansioso por el estigma, recuerda que hay profesionales y grupos de apoyo que pueden ayudarte a manejar esas emociones. Considera contactar a organizaciones locales como el ""Centro Nacional para la Prevención del VIH"" o el ""Instituto Nacional de Salud Pública"" para más información.",Spanish,1
7,¿Hay organizaciones en México que ofrezcan apoyo emocional para personas que están considerando PrEP?,"Sí, en México hay varias organizaciones que pueden ofrecer apoyo emocional y recursos para personas que consideran PrEP. Por ejemplo, la Red Mexicana de Personas que Viven con VIH y organizaciones locales como ""AIDS Healthcare Foundation"" y ""CENSIDA"" pueden proporcionar ayuda y orientación. También hay grupos de apoyo donde puedes compartir tus experiencias y preocupaciones en un ambiente seguro. Si sientes ansiedad o miedo por el estigma, es importante hablar con un profesional de salud mental. No estás solo, y hay recursos disponibles para ayudarte en este camino.",Spanish,0
8,¿Puedo acceder a PrEP sin tener un domicilio fijo o seguro médico en México?,"Sí, puedes acceder a PrEP en México incluso si no tienes un domicilio fijo o seguro médico. Hay organizaciones y clínicas que ofrecen PrEP de forma gratuita o a bajo costo, y muchas de ellas no requieren un domicilio permanente para recibir atención. Es importante buscar servicios de salud comunitarios o clínicas especializadas en VIH que puedan brindarte apoyo. 

Entiendo que la ansiedad y el miedo al estigma pueden ser abrumadores. Si te sientes cómodo, te animo a que hables con un profesional de la salud o un consejero que pueda ofrecerte apoyo adicional. Tu bienestar es importante.",Spanish,0
9,¿Dónde puedo encontrar clínicas o servicios comunitarios que ofrezcan PrEP sin necesidad de un domicilio estable?,"Entiendo que la falta de un hogar estable puede complicar el acceso a la atención médica. Muchas clínicas comunitarias y organizaciones de salud ofrecen PrEP y no requieren un domicilio fijo. Puedes buscar clínicas locales de salud pública, organizaciones que trabajen con la comunidad LGBTQ+, o servicios de salud que se enfoquen en VIH. 

También puedes consultar el sitio web de la Asociación Nacional de Salud Pública (o su equivalente en tu área) para obtener más información sobre los recursos disponibles. Si te sientes abrumado, considera hablar con un profesional de salud mental que pueda apoyarte en esta situación. ¡No estás solo, hay recursos disponibles!",Spanish,0
10,¿Existen programas específicos sue ayuden a jóvense sin hogar a acceder a PrEP y atención médica relacionada 💀,"Sí, hay programas y recursos diseñados para ayudar a jóvenes sin hogar a acceder a PrEP y atención médica. Muchas organizaciones locales y nacionales ofrecen servicios gratuitos o de bajo costo, incluyendo clínicas móviles y centros de salud comunitarios. Además, algunas organizaciones enfocadas en el VIH pueden proporcionar apoyo y recursos específicos para tu situación.

Es comprensible sentir ansiedad y miedo por el estigma asociado al VIH. Considera contactar a una línea de ayuda o buscar un consejero en salud mental que pueda brindarte apoyo. No estás solo en esto; hay recursos disponibles para ayudarte.",Spanish,1
11,¿Dónde puedo encontrar una clínica que ofrezca PrEP cerca de mí?,"Para encontrar clínicas que ofrezcan PrEP cerca de ti, puedes visitar el sitio web de la Red de Prevención del VIH de tu área o llamar a líneas de ayuda locales. También puedes buscar clínicas comunitarias, centros de salud o programas de salud pública, que a menudo ofrecen servicios de PrEP y pueden ser accesibles incluso si no tienes un lugar fijo donde vivir. Es importante recordar que hay recursos disponibles para ayudarte. Si sientes ansiedad o miedo por el estigma, considera hablar con un profesional de salud mental o un consejero que pueda apoyarte.",Spanish,1
12,¿-¿qué recursos existen like para acceder a prep si no tengo una dirección fija,"Entiendo que tu situación es difícil. Existen recursos que pueden ayudarte a acceder a PrEP incluso sin una dirección fija. Puedes acudir a clínicas de salud comunitarias, muchas de las cuales ofrecen servicios gratuitos o de bajo costo. También hay programas de salud pública que brindan PrEP y apoyo, a menudo sin necesidad de un hogar estable. Además, puedes considerar organizaciones locales que se centran en la salud LGBTQ+ o en el VIH, ya que suelen tener recursos y orientación. Si sientes ansiedad o miedo por el estigma, hablar con un profesional de salud mental puede ser muy útil. Recuerda que no estás solo y hay personas dispuestas a ayudarte.",Spanish,1
13,¿dónd3 puedo encontrar clínicas comunitarias que ofrezcan prep c3rc4 um de mí?,"Entiendo que acceder a atención médica puede ser un desafío, especialmente en tu situación. Muchas clínicas comunitarias en México ofrecen PrEP y están diseñadas para ser accesibles y sin juicio. Puedes buscar clínicas de salud pública o centros de salud comunitaria en tu área que ofrezcan servicios de prevención del VIH. También puedes contactar organizaciones locales que se especializan en salud sexual; a menudo tienen recursos y pueden ayudarte a encontrar atención. Si sientes ansiedad o miedo por el estigma, considera hablar con un profesional de salud mental que pueda apoyarte. Tu salud y bienestar son importantes.",Spanish,1
14,¿-¿Existen programas uh de ayuda financiera para cubrir el costo de PrPE si no tengo ingresos estables,"Sí, hay programas y recursos que pueden ayudarte a acceder a PrEP, incluso si no tienes ingresos estables. Muchas organizaciones comunitarias y clínicas ofrecen PrEP de forma gratuita o a bajo costo, independientemente de tu situación económica. Además, programas de asistencia financiera pueden ayudarte a cubrir los costos de los medicamentos.

Es comprensible sentir ansiedad y preocupación. Te animo a que busques apoyo en organizaciones locales de salud o grupos comunitarios que se especializan en VIH. Ellos pueden ofrecerte recursos y orientación. Si sientes que el estigma te afecta emocionalmente, considera hablar con un profesional de salud mental. Tu bienestar es importante.",Spanish,1
15,¿Dónde puedo encontrar organizaciones locales que ofrezcan PrEP y apoyo para personas sin hogar?,"Hay varias organizaciones que pueden ayudarte a acceder a PrEP y ofrecer apoyo, incluso si estás enfrentando la falta de vivienda. Te recomiendo buscar clínicas comunitarias o centros de salud que se especialicen en salud sexual y VIH. Muchas veces, estas clínicas ofrecen servicios gratuitos o de bajo costo.

Además, organizaciones como la Asociación Mexicana de Lucha contra el SIDA o el Centro Nacional para la Prevención y el Control del VIH/SIDA pueden tener recursos y referencias. No dudes en preguntar sobre opciones de atención accesibles y apoyo emocional. Recuerda que mereces atención y cuidado sin importar tu situación.",Spanish,0
16,¿Existen servicios de salud gratuitos específicos para hombres jóvenes en situación de calle que necesiten PrEP?,"Sí, hay servicios de salud gratuitos y de bajo costo que pueden ayudar a hombres jóvenes en situación de calle a acceder a PrEP. Muchas clínicas comunitarias y organizaciones sin fines de lucro ofrecen atención especializada en salud sexual y prevención del VIH, sin importar tu situación habitacional. También pueden brindar apoyo emocional y recursos adicionales para ayudarte a manejar la ansiedad y el estigma. Te animo a buscar clínicas locales o líneas directas en tu área que ofrezcan estos servicios. No estás solo, y es importante cuidar de tu salud.",Spanish,0
17,¿Dónde puedo encontrar una clínica que ofrezca PrEP cerca de mi ubicación actual?,"Para encontrar una clínica que ofrezca PrEP cerca de ti, te recomiendo buscar en sitios web como la página de los Centros para el Control y la Prevención de Enfermedades (CDC) o la Asociación Nacional de Salud Pública. También puedes llamar a líneas de ayuda locales o buscar organizaciones comunitarias que se especialicen en salud sexual. Muchas clínicas ofrecen servicios de salud gratuitos o de bajo costo, lo que podría ser útil dada tu situación. Si sientes ansiedad por el estigma asociado, considera hablar con un profesional de salud mental que pueda brindarte apoyo. Tu salud es importante y hay recursos disponibles para ayudarte.",Spanish,0
18,¿Eixsten programas específicos para personas sin hogar que faciliten el acceso a PrsP y atención médica? médica?,"Sí, hay programas y recursos diseñados para ayudar a personas sin hogar a acceder a PrEP y atención médica. Muchas organizaciones comunitarias y clínicas de salud ofrecen servicios gratuitos o de bajo costo. También pueden proporcionar asistencia con el transporte y la confidencialidad para reducir el estigma. Te recomendaría buscar clínicas de salud pública o programas locales de VIH en tu área. También puedes contactar a organizaciones como la Alianza Nacional de VIH/SIDA, que pueden ofrecerte información específica. Recuerda que tu salud es importante y hay personas dispuestas a ayudarte. Si sientes ansiedad o miedo, considera hablar con un profesional de salud mental que pueda ofrecerte apoyo.",Spanish,1
19,¿Dónde puedo encontrar una clínica de salud pública cerca de mí que ofrezca PrEP y servicios para personas sin hogar?,"Es comprensible que estés preocupado por acceder a la atención médica. Te recomiendo buscar clínicas de salud pública en tu área, ya que muchas de ellas ofrecen PrEP y servicios específicos para personas sin hogar. Puedes visitar el sitio web de la Red Nacional de Clínicas (National Health Network) o utilizar sitios como HIV.gov, donde puedes encontrar recursos locales. También puedes llamar a la línea de ayuda de VIH de tu estado para obtener información sobre servicios disponibles. No estás solo en esto, y hay recursos que pueden apoyarte.",Spanish,0
20,¿qué documentos necesito llevar para acceder a uh prep en una clínica de salud pública?,"Para acceder a PrEP en una clínica de salud pública, generalmente necesitarás llevar una identificación con foto y, si es posible, algún comprobante de ingresos o situación económica. Si no tienes un lugar estable, muchas clínicas son comprensivas y ofrecen servicios sin necesidad de una dirección fija. También te pueden pedir que respondas a algunas preguntas sobre tu salud y historial sexual. No dudes en comunicar tus preocupaciones sobre el estigma; el personal está capacitado para ayudarte con respeto y comprensión. Si necesitas apoyo adicional, considera contactar a organizaciones locales que puedan ofrecerte recursos y asistencia.",Spanish,1
21,¿Hay clínics que ofrezcan PrEP sin ita previa o que sean accesibles para personas you know sin hogar?,"Sí, hay clínicas y organizaciones que ofrecen PrEP sin necesidad de un seguro médico o una dirección fija. Muchas de estas clínicas están diseñadas para atender a personas con bajos ingresos o que enfrentan situaciones de vivienda inestable. Puedes buscar clínicas de salud comunitarias o programas de salud pública en tu área que ofrezcan servicios de PrEP. También puedes contactar organizaciones locales de salud que se especializan en VIH/SIDA; suelen tener recursos y pueden ayudarte a acceder a la atención que necesitas. Recuerda que no estás solo, y hay personas y recursos dispuestos a apoyarte.",Spanish,1
22,¿xisten recursos o pr0gr4m45 específicos en México que ne ayuden a acceder a PrEP sin tener like un hogar fijo? 🙂,"Sí, en México hay recursos que pueden ayudarte a acceder a PrEP, incluso si no tienes un hogar fijo. Muchas organizaciones comunitarias y clínicas de salud ofrecen programas que brindan atención médica, incluyendo PrEP, sin necesidad de tener un domicilio fijo. 

Es recomendable buscar servicios de salud pública o clínicas especializadas en VIH/SIDA, donde también pueden ofrecerte apoyo emocional y asesoramiento. Si sientes ansiedad por el estigma, hablar con profesionales de la salud mental puede ser útil. No estás solo, y hay personas y recursos dispuestos a ayudarte.",Spanish,1
23,¿Puedo recibir PrEP en un centro de salud comunitario sin que me pidan identificación o una dirección fija?,"Sí, muchos centros de salud comunitarios ofrecen PrEP y pueden ser accesibles sin la necesidad de identificación o una dirección fija. Estos centros están diseñados para atender a personas en diversas situaciones, incluidas aquellas que enfrentan la falta de vivienda. Te recomendaría buscar un centro de salud cercano que ofrezca servicios de salud sexual. Además, recuerda que hay opciones de PrEP oral e inyectable. Si sientes ansiedad por el estigma asociado al VIH, buscar apoyo emocional de profesionales puede ser muy útil. No estás solo en esto.",Spanish,0
24,¿Hay programas específicos en MMMéxico que ayuden a personas s1n hogar a acceder a PrEP y atención médica relacionada?,"Sí, en México hay programas y organizaciones que ofrecen apoyo a personas sin hogar para acceder a PrEP y atención médica. Puedes buscar servicios a través de organizaciones como el Centro Nacional para la Prevención y el Control del VIH y el Sida (CENSIDA) y clínicas comunitarias. También hay grupos locales que brindan servicios a personas en situación de vulnerabilidad. 

Es comprensible sentir ansiedad por el estigma y la situación actual. Recuerda que tu salud es importante y hay recursos disponibles. Si necesitas apoyo emocional, te animo a contactar a un profesional de salud mental.",Spanish,1
25,¿Dónde puedo encontrar estas clínicas comunitarias y programas de apoyo eb mi área 😕,"Entiendo que la situación puede ser difícil. En México, puedes buscar clínicas comunitarias o programas de salud que ofrezcan PrEP a través de organizaciones como la Secretaría de Salud o ONGs locales que se enfoquen en la salud sexual. También puedes consultar el sitio web de CENSIDA para obtener información sobre servicios en tu área. Si te sientes abrumado o ansioso, es útil hablar con un profesional de la salud mental. Ellos pueden ofrecer apoyo y estrategias para manejar el estrés. Recuerda que no estás solo y hay recursos disponibles para ayudarte.",Spanish,1
26,¿existen pr0gr4m4s que ofreczan prep sin i mean costo para personas en mi situación? 😭,"Sí, hay programas que ofrecen PrEP sin costo para personas en situaciones similares a la tuya. Muchas organizaciones de salud comunitaria y clínicas ofrecen PrEP de manera gratuita o a bajo costo, especialmente para personas de bajos ingresos y sin hogar. Además, algunos programas estatales y federales pueden ayudarte a acceder a estos servicios.

Es comprensible sentir ansiedad por el estigma asociado al VIH. Te animo a que busques apoyo en grupos locales de salud o en líneas de ayuda, donde puedes hablar con profesionales que comprenden tu situación. Recuerda que cuidar de tu salud es importante y hay recursos disponibles para ti.",Spanish,1
27,¿Cómo puedo encontrar estas organizaciones de salud comunitaria que ofrezcan PrEP en mi área,Es comprensible que te sientas preocupado por acceder a PrEP en tu situación actual. Puedes buscar organizaciones de salud comunitaria en tu área a través de recursos como el sitio web de la Asociación Nacional de Salud de las Minorías (NMAC) o el sitio de la Red Nacional de Centros de Salud Comunitarios. También puedes llamar a la Línea de Ayuda del VIH para obtener información. Muchas clínicas ofrecen servicios de salud gratuitos o de bajo costo y son sensibles a la situación de las personas sin hogar. Recuerda que no estás solo y hay personas dispuestas a ayudarte.,Spanish,1
28,¿Existen programas específicos que ofrezcan PrEP de manera gratuita o a bajo costo para personas sin hogar?,"Sí, hay programas que ofrecen PrEP de manera gratuita o a bajo costo, especialmente dirigidos a personas en situaciones vulnerables, como aquellos sin hogar. Muchas clínicas comunitarias, centros de salud y organizaciones no gubernamentales ofrecen servicios de salud accesibles. Estos lugares pueden ayudarte a acceder a PrEP, así como a otros recursos de salud mental y apoyo. Es importante buscar servicios locales que puedan brindarte la atención necesaria sin estigmas. Si sientes ansiedad o miedo, considera hablar con un profesional que pueda ofrecerte apoyo emocional. ¡Tú mereces cuidar de tu salud!",Spanish,0
29,¿Cómo puedo encontrar una clínica cercana que ofrezca PrEP y sea accesible para mí?,"Entiendo que la falta de vivienda y el acceso a servicios de salud pueden ser muy desafiantes. Puedes buscar clínicas locales que ofrezcan PrEP a través de recursos como el sitio web de la Red Nacional de Clínicas de Salud o el Programa de Salud Pública de tu estado. También, organizaciones comunitarias que se enfocan en la salud LGBTQ+ a menudo tienen información sobre servicios accesibles.

No dudes en comunicarte con estas organizaciones, ya que pueden ofrecer apoyo y recursos adicionales. Si sientes ansiedad o miedo por el estigma, hablar con un profesional de la salud mental puede ser útil. Recuerda que mereces atención y cuidado.",Spanish,0
30,¿Qué tipo de documentación necesito para acceder a PrEP en una clínica si no tengo un hogar estable?,"Entiendo que tu situación es complicada y preocupante. Para acceder a PrEP, generalmente se necesita una identificación, como una tarjeta de identificación o un documento oficial. Sin embargo, muchas clínicas son comprensivas y pueden ofrecer servicios sin requerir documentación estricta, especialmente para personas en situaciones vulnerables.

Es importante buscar clínicas comunitarias o centros de salud que ofrezcan servicios a personas sin hogar. Ellos pueden proporcionarte apoyo y recursos adicionales. Si sientes ansiedad o miedo por el estigma, considera hablar con un profesional de salud mental que pueda ayudarte. Recuerda que tu salud es lo más importante.",Spanish,0
