turn,user,bot,language,has_error
1,i’m idk concerned about the reactions of others if they find out I am on PrEP how can I manage fhi5 fear,"It's completely understandable to feel anxious about potential reactions from others regarding your use of PrEP. Stigma can be challenging, but remember that your health and well-being are what's most important. Consider finding supportive communities, either online or in person, where you can connect with others who understand your experiences. Professional resources like counseling services or support groups can also help you navigate these feelings. Remember, taking care of your health is a positive choice, and you deserve support in that journey. If you have any questions about PrEP options, like oral or injectable forms, feel free to ask!",English,1
2,What are some low-cost or free resources available for accessing PrEP in my area?,"It's great that you're exploring PrEP! Many areas offer low-cost or free resources for accessing it. Look for local health departments, community health clinics, or organizations like the AIDS Healthcare Foundation or the PrEP4All Coalition. They often provide PrEP services regardless of insurance status and can help with affordability. You might also consider contacting the National HIV/AIDS hotline at 1-800-CDC-INFO for specific resources in your area. Don't hesitate to reach out for support; you're taking a positive step for your health!",English,0
3,Are there any specific clinics or organizations in my area that focus on helping low-income individuals access PrEP?,"Many clinics and organizations specialize in helping low-income individuals access PrEP. You can start by checking with local health departments, community health centers, or HIV service organizations. The Health Resources and Services Administration (HRSA) also provides a directory of federally qualified health centers that may offer PrEP at low or no cost. Additionally, organizations like the National Alliance of State and Territorial AIDS Directors (NASTAD) can help you find resources in your area. Don't hesitate to reach out to them, as they often have programs to assist with affordability and can provide supportive environments.",English,0
4,"What should I expect during my first visit to a clinic for PrEP, and how can I ensure my privacy is protected?","During your first visit for PrEP, you can expect a health assessment, which may include questions about your sexual history and any current health concerns. The healthcare provider will discuss your risk for HIV and explain how PrEP works, including the oral and injectable options. 

To protect your privacy, you can ask about confidentiality policies and ensure that your information is kept secure. Most clinics prioritize patient confidentiality, so feel free to express your concerns. If you feel anxious, consider bringing a trusted friend for support or reaching out to local support organizations that can help guide you through the process. You're not alone in this!",English,0
5,what affordable healthcare optiosn are available for um accessing prep without compromising my privacy? 😅,"It's understandable to feel anxious about accessing healthcare, especially in your situation. Many clinics offer low-cost or sliding scale fees based on income, which can make PrEP more affordable. Look for local health departments, community health centers, or organizations like Planned Parenthood, which often provide confidential services. 

Additionally, some programs and foundations offer assistance for those in need. For privacy, you may consider using telehealth services if available in your area, allowing you to consult with a provider from a safe space. If you're feeling overwhelmed, reaching out to a mental health professional can also be beneficial. You're not alone in this journey.",English,1
6,h-how can o find l0c4l clinics that off3r sliding svae fees for pre withhhout revealing my living situation,"Finding local clinics that offer sliding scale fees for PrEP can be done discreetly. You can start by visiting the websites of community health centers, which often provide services based on income. The Health Resources & Services Administration (HRSA) has a tool to locate these centers. Additionally, organizations like the AIDS Healthcare Foundation or local LGBTQ+ centers may have resources. 

You can also call clinics directly and ask if they offer sliding scale fees without disclosing your living situation. Remember, your health is important, and many clinics are understanding and supportive. If you’re feeling anxious, consider talking to a counselor or a trusted friend for support.",English,1
7,Are there specific organizations that provide financial assistance for PrEP in low-income situations?,"Yes, there are organizations that can help with financial assistance for PrEP, especially for those in low-income situations. The Patient Advocate Foundation and the AIDS Drug Assistance Program (ADAP) offer support for accessing medications, including PrEP. Additionally, some local health departments and community health centers provide PrEP at low or no cost, regardless of insurance. It's also worth checking if you qualify for programs like the Gilead Access Program, which offers assistance for their PrEP medications. Reaching out to local resources can help you find the support you need. Don't hesitate to ask for help; you’re not alone in this!",English,0
8,wht should I like do if I feel uncomfortable d1scu551ng Pr3PPP w1th a healthcare pr0v1d3r due 70 stigma ❓,"It's completely understandable to feel uncomfortable discussing PrEP due to stigma. Here are some steps you can take:

1. **Find Supportive Providers**: Look for healthcare facilities or clinics known for being LGBTQ+ friendly or specializing in sexual health. They may have staff trained to handle these conversations sensitively.

2. **Use Resources**: Consider reaching out to organizations like the National LGBTQ Task Force or local health departments that can provide information and support.

3. **Prepare Ahead**: Write down your questions or concerns before your appointment. This can help you feel more confident during the discussion.

4. **Talk to Peers**: If you can, connect with others who are also considering PrEP. They might share their experiences and tips.

Remember, your health is important and you deserve support.",English,1
9,h0w can u find low-cost or free healthcare options for getting pr3p in my area area,"Finding low-cost or free healthcare options for PrEP can feel challenging, but there are resources available. You can start by checking with local health departments, community health clinics, or organizations focused on HIV prevention, as they often offer PrEP services on a sliding scale or for free. The CDC's website has a tool to help locate PrEP providers near you. Additionally, the Ready, Set, PrEP program provides PrEP medications at no cost for those who qualify. If you’re feeling anxious or unsure, consider reaching out to a mental health professional or support group for guidance and reassurance. You’re not alone in this journey.",English,1
10,What 5h0ulddd 1 say when I call these clinics to inquire about PEP sevrices,"When you call clinics to inquire about PEP (Post-Exposure Prophylaxis), you can start by introducing yourself and stating your reason for calling. Here’s a simple script you could follow:

“Hi, my name is [Your Name]. I’m looking for information about PEP services. Can you tell me if you provide PEP, what the process is to get it, and if there are any costs involved? I’m also interested in knowing if you offer any support for low-income individuals. Thank you!”

Feel free to adjust it to your comfort level. Remember, it’s okay to ask questions and seek the resources you need!",English,1
11,are thee spceific clinics or programs you recommend for low-income 1nd1vidu4l5 seeking Pr3P,"Yes, there are several resources available for low-income individuals seeking PrEP. Many community health centers and clinics offer PrEP services at a reduced cost or even for free, depending on your income. The Health Resources and Services Administration (HRSA) provides a website where you can find local clinics that may offer PrEP and other services.

Additionally, programs like the Ready, Set, PrEP program help provide PrEP at no cost to eligible individuals. It’s also beneficial to connect with local LGBTQ+ organizations, as they often have resources and support for those seeking PrEP. Remember, you deserve access to healthcare without stigma, and reaching out for help is a positive step.",English,1
12,What should I expect during my first visit to a clinic for PrEP?,"During your first visit for PrEP, you can expect to discuss your sexual health and any concerns you might have. A healthcare provider will likely ask about your medical history and may conduct tests for HIV and other sexually transmitted infections (STIs). They may also check your kidney function, as PrEP can affect this. You’ll learn about how PrEP works, the different options available (oral or injectable), and how to take it. Remember, your healthcare provider is there to support you, so don’t hesitate to ask questions. If you feel anxious, consider seeking support from local resources focused on mental health and wellness.",English,0
13,what resources 4r3 available for low-income individuals to afcess prep and r3la44t3d healthcare services? 🤔,"There are several resources available for low-income individuals seeking access to PrEP and related healthcare services. 

1. **Community Health Centers**: Many offer sliding scale fees based on income, and some provide PrEP services at low or no cost.

2. **State and Local Health Departments**: They often have programs specifically for PrEP access and can connect you to care.

3. **Patient Assistance Programs**: Some pharmaceutical companies offer programs to help with medication costs.

4. **Nonprofits**: Organizations like the AIDS Healthcare Foundation or PrEP4All can provide information and support.

5. **Online Resources**: Websites like GetPrEP.info can help you find local providers.

Remember, seeking help is a positive step. You deserve care and support!",English,1
14,h-how can i find a h34lthc4r3 provider who nuderstands my situation and can help me access prep without judgment?,"Finding a supportive healthcare provider is important, especially when considering PrEP. Start by looking for local clinics that specialize in sexual health or HIV prevention, as they often have experience with diverse populations. The Ryan White HIV/AIDS Program can help connect you to resources that offer services regardless of income. 

You can also reach out to organizations like the National LGBTQIA+ Health Education Center or local LGBTQ+ centers, which may have specific programs for individuals facing stigma. Remember, you deserve respectful care, and many providers are trained to understand and support your situation. If you're feeling anxious, consider talking to a mental health professional for additional support.",English,1
15,what ard 50me affordable clinics or organizations in my area th47 offer PrEP services abd support for low-income 1ndiv1du4l5? 🫠 🫠,"It's great that you're considering PrEP for HIV prevention. While I can't provide specific clinic names, I recommend checking out resources like the Health Resources and Services Administration (HRSA) website, or the Centers for Disease Control and Prevention (CDC) for affordable clinics in your area. Local health departments and LGBTQ+ organizations often have programs that offer PrEP services on a sliding scale based on income. Additionally, the PrEP Locator tool can help you find nearby providers. Don't hesitate to reach out to these organizations; they can also provide support for any concerns about stigma or mental health. You're taking an important step for your health!",English,1
16,what should u expect during my first visit to a clinic for PrEP and how cccan I uh prepare for it,"During your first visit for PrEP, you can expect a friendly healthcare provider to ask about your health history, sexual practices, and any concerns you might have. They will conduct tests for HIV and other sexually transmitted infections (STIs) and may check your kidney function, as PrEP can affect your kidneys.

To prepare, consider writing down any questions you have and bring a list of medications you're currently taking. It’s helpful to express any concerns about affordability or stigma, as many clinics have resources to support you. Remember, you deserve respectful care, and there are professionals who can help you.",English,1
17,What resources are available to help cover the cost of PrEP for someone in my situation?,"There are several resources that can help make PrEP more affordable for you. Many health departments and community health clinics offer PrEP at low or no cost, especially for those with limited income. You might also qualify for programs like the Ready, Set, PrEP program, which provides PrEP at no cost for eligible individuals. Additionally, pharmaceutical companies often have patient assistance programs that can help cover costs. Reach out to local organizations like the National Alliance of State and Territorial AIDS Directors (NASTAD) or your local health department for more specific information and support tailored to your situation. You’re not alone in this!",English,0
18,how can I find a local clinic that offers PrEP and understands my c0ncern5 uh about stigma ❓ ❓,"Finding a local clinic that offers PrEP and is sensitive to your concerns is important. You can start by visiting the CDC's website or the PrEP Locator tool, which helps identify clinics in your area. Many clinics are trained to provide compassionate care and understand the stigma surrounding HIV. 

Additionally, local LGBTQ+ organizations or community health centers often have resources and can guide you to supportive providers. If you're feeling anxious about seeking help, consider reaching out to a trusted friend or counselor for support. Remember, your health and safety are priorities, and you deserve respectful care.",English,1
19,What are the costs associated with PrEP and are there programs that can help cover them for someone in my situation?,"PrEP can vary in cost depending on insurance coverage and the specific medication used. Typically, oral PrEP can cost around $1,500 to $2,000 per month without insurance, while injectable PrEP may have different pricing. However, many programs exist to help cover costs, especially for low-income individuals. The Health Resources and Services Administration (HRSA) offers the Ryan White HIV/AIDS Program, which provides assistance regardless of immigration status. Additionally, many pharmaceutical companies have patient assistance programs. Local health departments or community organizations may also help navigate these resources. It's important to seek support; you don't have to face this alone.",English,0
20,How can I find local organizations that offer support for accessing PrEP and reducing stigma in my living situation?,"Finding local organizations that support access to PrEP and help reduce stigma is a great step. Start by checking resources like the CDC's PrEP Locator, which can help you find clinics near you. Additionally, organizations like the National Alliance of State and Territorial AIDS Directors (NASTAD) or local health departments often provide information on PrEP services and support groups. 

Consider reaching out to LGBTQ+ centers or community health organizations, as they often have resources for those facing stigma. If you're feeling anxious, talking to a mental health professional can also be beneficial. You're not alone, and there are supportive resources available.",English,0
21,"What are the costs associated with PrEP, and are there programs that can help cover those expenses?","The cost of PrEP can vary, but it’s often around $1,500 to $2,000 per month without insurance. However, many insurance plans cover PrEP, which can significantly reduce out-of-pocket expenses. There are also programs available to help with costs. For example, the Ready, Set, PrEP program provides PrEP at no cost to eligible individuals. Additionally, local health departments and community clinics may offer sliding scale fees or assistance programs. It's important to reach out to local resources that can provide support based on your situation. Don't hesitate to ask for help; you deserve access to the care you need.",English,0
22,What local resources or clinics can I reach out to for PrEP assistance in my area?,"It's great that you're interested in PrEP! To find local resources, you can start by visiting the CDC's PrEP locator website, which helps you find nearby clinics that offer PrEP. Additionally, community health centers often provide low-cost or sliding-scale options for healthcare services, including PrEP. 

You can also reach out to organizations like the National Minority AIDS Council (NMAC) or the local health department, as they might have specific programs for low-income individuals. If you're feeling anxious about seeking help, consider talking to a mental health professional or a support group. Remember, you deserve support and care!",English,0
23,What are some ways to address the stigma around seeking PrEP in my living situation?,"Addressing stigma can be challenging, but there are supportive strategies you can consider. Start by educating yourself and others about PrEP, as knowledge can help dispel myths. You might also find comfort in connecting with supportive communities, either online or in-person, where people share similar experiences. If possible, seek out healthcare providers who are known for their understanding and inclusive approach. Remember that your health is important, and seeking PrEP is a proactive step. If you're feeling anxious, talking to a mental health professional or a support group can be beneficial. They can provide a safe space to discuss your feelings and concerns.",English,0
24,what affrodable options do I have for like accessing Pr3[ while l1v1ng 1n a shelter?,"It's great that you're exploring options for PrEP! Many clinics offer sliding scale fees based on income, which can make it more affordable. Look for local health departments, community health centers, or organizations focused on HIV prevention; they often provide services regardless of income and may offer PrEP at little to no cost. Some pharmaceutical companies have programs that help with the cost of medication as well. 

If you're feeling anxious about stigma, know that many people are in similar situations, and there are supportive professionals who can help. Consider reaching out to local support groups or mental health resources for guidance.",English,1
25,what steppps can I take to find a local clinic idk that prkvides PrEP without judgmenttt,"Finding a local clinic that provides PrEP in a judgment-free environment is important. Here are some steps you can take:

1. **Online Resources**: Websites like the CDC or local health department sites often have directories of clinics offering PrEP.
2. **Local AIDS Service Organizations**: These organizations can provide guidance and may also offer PrEP services. They focus on supportive care.
3. **Hotlines**: Call a local health hotline for confidential information on nearby clinics.
4. **Community Health Centers**: These centers often provide care regardless of income and can be more understanding of your situation.

Remember, seeking care is a brave step, and you deserve support. If you ever feel overwhelmed, consider reaching out to a mental health professional or counselor.",English,1
26,What financial assistance programs are available to help cover the cost of PrEP for someone in my situation?,"It's great that you're considering PrEP for HIV prevention. There are several financial assistance programs that may help cover the cost:

1. **Patient Assistance Programs**: Many pharmaceutical companies offer programs to provide PrEP at low or no cost for eligible individuals.

2. **Ryan White HIV/AIDS Program**: This federal program provides services and support for people with HIV, including assistance with PrEP.

3. **Insurance Options**: If you're eligible, Medicaid may cover PrEP. Also, the Affordable Care Act requires most insurance plans to cover preventive services, including PrEP.

4. **Local Health Departments**: They often have resources or programs to assist with accessing PrEP.

Reaching out to a local healthcare provider or a community organization can help you explore these options further. You're not alone in this!",English,0
27,how can I find a local healthcare provider who ogfers PrEP services and .. understands my situation,"Finding a healthcare provider who offers PrEP and understands your situation can be challenging, but there are resources available. You can start by visiting the CDC's PrEP locator website, which helps you find local providers. Community health centers often offer services on a sliding scale based on income, which may make them more affordable.

Consider reaching out to local LGBTQ+ organizations or health services, as they often have staff trained to address stigma and support your needs. If you’re feeling anxious, talking to a counselor or mental health professional can also help you navigate these feelings. You deserve care that respects your circumstances and concerns.",English,1
28,What resources are available to help cover the cost of PrEP for someone with a low income?,"There are several resources to help cover the cost of PrEP for individuals with low income. Many local health departments offer PrEP at little to no cost, especially through community clinics. Programs like the Patient Assistance Program and the Ready, Set, PrEP initiative provide financial support and even free medication for eligible individuals. Additionally, some non-profits and organizations focused on HIV prevention may offer assistance and guidance to help you access PrEP. It’s also worthwhile to check if there are any local support groups or services that can help navigate these resources. Remember, you’re not alone in this, and support is available.",English,0
29,h0w can I find a local health clinic that offers free or low-cost PrEP services? 😬,"It's understandable to feel anxious about seeking healthcare, especially in your situation. To find local health clinics that offer free or low-cost PrEP services, you can start by visiting the website of the Centers for Disease Control and Prevention (CDC) or the National HIV/AIDS Strategy. They have resources to help locate clinics. Additionally, organizations like Planned Parenthood and local health departments often provide affordable PrEP services. You might also consider reaching out to local LGBTQ+ centers or community health organizations, as they can be supportive and understanding. Remember, you're not alone in this, and there are people ready to help.",English,1
30,What should I expect during my first appointment for PrEP at a clinic?,"During your first appointment for PrEP, you can expect a healthcare provider to discuss your sexual health history and assess your risk for HIV. They may conduct a physical exam and perform tests for HIV and other sexually transmitted infections (STIs). Blood tests will also check your kidney function, as it is important for PrEP. The provider will explain the different options for PrEP, including oral pills taken daily or an injectable form administered every few months. It’s a safe space to ask questions and discuss any concerns, including those about stigma or affordability. Remember, many clinics offer sliding scale fees or assistance programs.",English,0
