turn,user,bot,language,has_error
1,y-you know la prisr de la PPPrE pourrait-elle affecter ma stabilité émotionnelle,"Il est compréhensible de s'inquiéter de l'impact potentiel de la PrEP sur votre santé mentale, surtout avec un trouble bipolaire. Les études montrent que la PrEP, qu'elle soit orale ou injectable, n'a pas d'effet direct sur la stabilité émotionnelle. Cependant, chaque personne réagit différemment aux médicaments, et il est essentiel de discuter de vos préoccupations avec un professionnel de santé qui connaît bien votre historique médical. 

N'oubliez pas que le soutien est crucial. Si vous ressentez de l'anxiété ou de la stigmatisation, envisagez de parler à un thérapeute ou à un groupe de soutien. Vous n'êtes pas seule dans ce parcours.",French,1
2,Comment puis-je trouver un professionnel se santé qui comprend à la fois l4 PrEP et m0n trouble bipolaire ?,"Il est important de trouver un professionnel de santé qui a de l'expérience avec la PrEP et les troubles de santé mentale. Vous pouvez commencer par contacter des centres de santé communautaires, des cliniques spécialisées en santé sexuelle ou des psychiatres ayant une expertise en VIH. N'hésitez pas à poser des questions sur leur expérience avec la PrEP et les troubles de l’humeur. Vous pouvez également consulter des associations locales ou des ressources en ligne qui peuvent vous recommander des praticiens qualifiés. Prenez votre temps pour trouver quelqu'un avec qui vous vous sentez à l'aise. Votre santé mentale et physique est primordiale.",French,1
3,Quels sont les effets secondaires de la PrEP qui pourraient influencer ma santé mentale ?,"La PrEP, qu'elle soit orale ou injectable, peut entraîner des effets secondaires tels que des nausées, des maux de tête ou des douleurs abdominales, qui peuvent affecter votre bien-être général. Certaines personnes peuvent ressentir de l'anxiété ou des préoccupations liées à l'utilisation de la PrEP, surtout en raison de la stigmatisation. Il est important de discuter de vos inquiétudes avec un professionnel de la santé qui comprend votre situation, surtout en lien avec votre trouble bipolaire. Ils pourront vous aider à intégrer la PrEP dans votre traitement tout en tenant compte de votre santé mentale. N'hésitez pas à chercher des ressources pour le soutien psychologique si vous en ressentez le besoin.",French,0
4,Comment puis-je parler de mes préoccupations concernant la PrEP à mon médecin tout en tenant compte de mon trouble bipolaire ?,"Il est important d'aborder vos préoccupations ouvertement avec votre médecin. Vous pourriez commencer par expliquer votre trouble bipolaire et comment vous ressentez les fluctuations de votre humeur. Mentionnez vos inquiétudes spécifiques concernant l'impact potentiel de la PrEP sur votre santé mentale. Vous pouvez aussi parler de la stigmatisation que vous ressentez, afin que votre médecin puisse mieux comprendre votre situation. N'hésitez pas à poser des questions sur les options de PrEP, qu'elles soient orales ou injectables, et comment elles pourraient s'intégrer dans votre traitement global. Un professionnel de la santé mentale pourrait également vous aider à naviguer ces préoccupations.",French,0
5,quels effets secondaires de ls like PrEP pourraient ifnluencer ma santé m3n7al3 e7 mes fluctuations d'humeur ? ‼️ ‼️,"Les effets secondaires de la PrEP, qu'elle soit orale ou injectable, varient d'une personne à l'autre. Certains utilisateurs signalent des nausées, des maux de tête ou des troubles gastro-intestinaux, mais ces effets sont souvent temporaires. Il n'y a pas d'études spécifiques sur l'impact direct de la PrEP sur la santé mentale, mais il est important de surveiller comment vous vous sentez tout au long de votre traitement. Si vous avez des préoccupations concernant vos fluctuations d'humeur, je vous encourage à en parler à un professionnel de la santé. Vous méritez un soutien qui prend en compte votre santé mentale et physique.",French,1
6,Comment puis-je discuter de mes préoccupations concernant la PrEP avec mon médecin tout en prenant en compte mes troubles bipolaires ?,"Il est important d'aborder vos préoccupations avec votre médecin de manière ouverte et honnête. Vous pourriez commencer par partager vos inquiétudes concernant l'impact de la PrEP sur vos fluctuations d'humeur. Mentionnez également que vous êtes préoccupée par la stigmatisation. 

N'hésitez pas à poser des questions sur les options de PrEP, qu'elles soient orales ou injectables, et comment elles pourraient s'intégrer dans votre traitement global. Votre médecin pourra vous aider à évaluer les avantages et les risques en tenant compte de votre santé mentale. Si vous ressentez le besoin de soutien supplémentaire, envisagez de consulter un professionnel de santé mentale.",French,0
7,Quels effets secondaires de ls PrEP pourraient influencre mon humeur et mkn état mental ?,"La PrEP, qu'elle soit orale ou injectable, peut avoir des effets secondaires, mais la plupart des gens ne les ressentent pas ou les trouvent légers. Certains effets comme des nausées, des maux de tête ou une fatigue peuvent survenir. Cependant, il n’y a pas de lien direct établi entre la PrEP et des fluctuations d’humeur ou des troubles mentaux.

Il est essentiel de discuter de vos préoccupations avec un professionnel de santé qui connaît votre situation. Ils pourront vous aider à évaluer comment la PrEP pourrait s’intégrer dans votre traitement global. Si vous ressentez de l'anxiété ou de la stigmatisation, envisagez de parler avec un thérapeute ou un groupe de soutien. Prenez soin de vous.",French,1
8,Comment puis-je trouver un professionnel de santé qui comprenne les implications de la PrEP sur ma santé mentale et mon trouble bipolaire ?,Il est important de trouver un professionnel de santé qui soit à l'écoute et comprenne bien vos besoins spécifiques. Vous pouvez commencer par demander à votre médecin généraliste des recommandations. Recherchez également des cliniques spécialisées en santé sexuelle qui ont de l'expérience avec la PrEP et les questions de santé mentale. Les associations de santé mentale peuvent aussi vous orienter vers des thérapeutes qui connaissent bien le trouble bipolaire. N'hésitez pas à poser des questions sur leur expérience avec la PrEP lors de vos premiers échanges. Prenez soin de vous et sachez qu'il existe des ressources pour vous soutenir.,French,0
9,quels sont les effets secondaires de like la PrrrEP qui pourraient influencer mon humeur ku mon bien-être mental,"La PrEP, qu'elle soit orale ou injectable, peut entraîner des effets secondaires, bien que beaucoup de personnes ne les ressentent pas. Parmi les effets possibles, on trouve des nausées, des maux de tête ou des changements dans l'appétit. Ces effets ne sont généralement pas graves et diminuent souvent avec le temps. 

Il est important de discuter de vos préoccupations concernant votre santé mentale avec un professionnel de la santé qui peut vous aider à naviguer votre traitement global. Vous n'êtes pas seule dans vos inquiétudes, et il existe des ressources pour vous soutenir, notamment des thérapeutes spécialisés en santé mentale.",French,1
10,Comment puis-je parler de mes préoccupations liées à la PrEP avec mon médecin tout en abordant mon trouble bipolaire ?,"Il est essentiel d'être ouvert et honnête avec votre médecin. Vous pouvez commencer la conversation en partageant vos préoccupations concernant la PrEP et son impact potentiel sur votre santé mentale. Mentionnez spécifiquement votre trouble bipolaire et demandez comment la PrEP pourrait s'intégrer dans votre traitement. N'hésitez pas à aborder vos craintes liées à la stigmatisation ; un bon médecin comprendra et respectera vos préoccupations. Si vous vous sentez à l'aise, vous pouvez également demander à être orientée vers des ressources professionnelles, comme un thérapeute ou un groupe de soutien, pour vous aider à naviguer ces inquiétudes. Vous méritez un soutien adapté à vos besoins !",French,0
11,qu3l5 sont les effets secondaires de la PrEP sur l4 santé men74le en particulier pour les personnes ayant un trouble b1p0l41r3,"La PrEP, qu'elle soit orale ou injectable, est généralement bien tolérée, mais chaque personne peut réagir différemment. Les effets secondaires peuvent inclure des nausées, des maux de tête ou des changements d'humeur. Pour les personnes ayant un trouble bipolaire, il est important de surveiller tout changement dans l'humeur et de consulter un professionnel de santé pour discuter de vos préoccupations. 

Concernant la stigmatisation, il est naturel de ressentir de l'inquiétude, mais sachez que vous n'êtes pas seule. Des ressources comme des groupes de soutien ou des professionnels de santé mentale peuvent vous aider à naviguer ces défis. Prenez soin de vous et n'hésitez pas à poser toutes vos questions.",French,1
12,Comment puis-je discuter de la PrEP avec mon médecin sans craindre la stigmatisation liée à mon trouble bipolaire ?,"Il est compréhensible de ressentir de l'anxiété à l'idée de discuter de la PrEP, surtout en tenant compte de votre trouble bipolaire. Une approche simple est de préparer vos questions à l'avance. Vous pouvez commencer par parler de votre santé globale, notamment de vos préoccupations concernant l'impact de la PrEP sur vos fluctuations d'humeur. Rappelez-vous que votre médecin est là pour vous aider, sans jugement. Si vous ressentez de la stigmatisation, envisagez de consulter un professionnel de la santé mentale. Ils peuvent vous soutenir dans cette démarche et vous aider à naviguer dans vos préoccupations. Vous méritez un accès à des soins adaptés à votre situation.",French,0
13,quels sot les effets secondaires de la PrEP qui pourraient influencer ma ssnté mentale ?,"La PrEP, qu'elle soit orale ou injectable, peut entraîner quelques effets secondaires, mais ils varient d'une personne à l'autre. Certains effets courants incluent des nausées, des maux de tête ou des douleurs abdominales, qui peuvent affecter votre bien-être général. Cependant, des études montrent que la PrEP n'a pas d'impact direct sur la santé mentale. Il est important d'en discuter avec un professionnel de la santé qui comprend vos préoccupations liées au trouble bipolaire. Si vous ressentez de la stigmatisation ou des inquiétudes, envisagez de consulter un thérapeute ou un conseiller qui peut vous aider à naviguer ces émotions. Prenez soin de vous.",French,1
14,Comment puis-je discuter de me5 préoccupations concernant la PrEP avec mon médecin tout 3n tenant compte de mon trouble bipolaire,"Il est important d'exprimer vos préoccupations à votre médecin de manière ouverte et honnête. Vous pourriez commencer par partager vos inquiétudes concernant l'impact potentiel de la PrEP sur vos fluctuations d'humeur. Posez des questions sur les effets secondaires possibles et comment la PrEP pourrait s'intégrer dans votre traitement actuel. N'hésitez pas à discuter de la stigmatisation que vous ressentez, cela peut aider votre médecin à mieux comprendre votre situation. Si vous ressentez le besoin de soutien, envisager de parler à un professionnel de la santé mentale peut également être bénéfique. Votre bien-être est primordial.",French,1
15,Quels effets secondaires de la PrEP pourraient influencer mon trouble bipolaire ?,"Il est compréhensible de s'inquiéter des effets de la PrEP sur votre santé mentale. Les effets secondaires les plus courants de la PrEP, qu'elle soit orale ou injectable, incluent des nausées, des maux de tête et une fatigue. Bien que des études n'aient pas démontré d'impact direct sur les troubles de l'humeur, chaque personne réagit différemment. Il est important d'en discuter avec votre professionnel de santé, qui pourra vous aider à évaluer les risques et bénéfices en tenant compte de votre état. N'hésitez pas à explorer des ressources de soutien pour la santé mentale si jamais vous en ressentez le besoin. Vous n'êtes pas seule dans ce parcours.",French,0
16,comment pu15-j3 aborder le sujet xe la PdEP avec mon psychitre tout en exprimant mes préoccupations sur la stignatisation ?,"Il est tout à fait compréhensible de vouloir aborder ce sujet délicat avec votre psychiatre. Vous pourriez commencer par partager ouvertement vos préoccupations concernant la PrEP et son impact potentiel sur votre santé mentale, notamment vos fluctuations d'humeur. Il serait utile d’expliquer comment la stigmatisation liée à la PrEP et à votre état de santé vous affecte. Un bon professionnel de santé sera à l'écoute et pourra vous fournir des informations et un soutien adaptés. N’hésitez pas à poser des questions sur la façon dont la PrEP pourrait s'intégrer dans votre traitement global. Si besoin, vous pouvez également demander des ressources ou des références à des professionnels spécialisés.",French,1
17,La PrEP peut-elle aggraver mes symptômes de idk trouble bipolaire,"Il est compréhensible de s'inquiéter des effets de la PrEP sur votre santé mentale, surtout en vivant avec un trouble bipolaire. Les études sur la PrEP, tant orale qu'injectable, ne montrent pas d'impact direct sur les troubles de l'humeur. Cependant, chaque personne réagit différemment. Il est essentiel de discuter de vos préoccupations avec un professionnel de santé qui connaît bien votre situation. Cela peut vous aider à envisager comment intégrer la PrEP dans votre traitement tout en prenant en compte les obstacles à l'accès aux soins. N'oubliez pas que le soutien psychologique est important aussi; des ressources sont disponibles pour vous aider.",French,1
18,q-quels sont les effes secondaites de la PrEP qui pourraient influencer ma santé mentale,"La PrEP peut avoir des effets secondaires, mais la plupart des gens ne ressentent pas de réactions graves. Certains effets secondaires courants incluent des nausées, des maux de tête ou des douleurs abdominales, qui sont généralement temporaires. Concernant la santé mentale, il n'y a pas de preuve directe que la PrEP influence les troubles de l'humeur, mais chaque personne réagit différemment. Si vous avez des préoccupations, il serait bénéfique d'en discuter avec un professionnel de santé qui connaît votre situation. N'oubliez pas que le soutien psychologique peut aussi être précieux pour naviguer ces préoccupations.",French,1
19,Comment puis-je parler de mes préoccupations concernant la PrEP avec mon médecin tout en étant à l'aise avec ma santé mentale ?,"C'est très important d'aborder vos préoccupations avec votre médecin. Vous pourriez commencer par lui expliquer vos antécédents de santé mentale et comment vous craignez que la PrEP puisse affecter vos fluctuations d'humeur. Posez des questions sur les effets possibles et exprimez vos préoccupations concernant la stigmatisation. Un bon médecin prendra le temps d'écouter et de répondre à vos questions. N'hésitez pas à mentionner que vous souhaitez explorer comment la PrEP peut être intégrée en toute sécurité dans votre traitement global. Si vous ressentez le besoin d'un soutien supplémentaire, envisagez de consulter un professionnel de la santé mentale. Vous méritez d'être écoutée et soutenue.",French,0
20,q-queeels effets secondaires dr la PrEP pourraient exacerber mes symptômes de 7r0uble bipolaire ?,"La PrEP, qu'elle soit orale ou injectable, peut avoir des effets secondaires variés, mais il est important de noter que les réactions peuvent différer d'une personne à l'autre. Certains utilisateurs signalent des nausées, des maux de tête ou des troubles gastro-intestinaux, mais ces effets sont généralement temporaires. Concernant votre santé mentale, il est essentiel d’en discuter avec un professionnel de santé qui comprend votre historique. Ils pourront vous aider à évaluer les risques potentiels et à intégrer la PrEP dans votre traitement global. N'hésitez pas à demander un soutien psychologique si vous ressentez des inquiétudes liées à la stigmatisation ou à votre état de santé.",French,1
21,Comment la PrEP pourrait-elle interagir avec mon traitement actuel pour le trouble bipolaire ?,"Il est compréhensible de s'inquiéter des interactions entre la PrEP et votre traitement pour le trouble bipolaire. La PrEP, qu'elle soit orale ou injectable, est généralement bien tolérée, mais il est essentiel de consulter votre médecin ou un professionnel de la santé pour discuter de votre situation spécifique. Ils pourront évaluer comment la PrEP pourrait s'intégrer dans votre traitement global et répondre à vos préoccupations concernant votre santé mentale. N'hésitez pas à leur parler également de la stigmatisation que vous ressentez ; des ressources et des groupes de soutien peuvent vous aider à naviguer ces défis.",French,0
22,Quels sont les effets secondaires de la PrEP sur la santé mentale que je devrais surveiller ?,"Les études sur la PrEP ne montrent pas d'effets directs significatifs sur la santé mentale. Cependant, chaque personne est unique, et certaines pourraient ressentir des changements d'humeur ou d'anxiété. Il est important de surveiller comment vous vous sentez et d'en discuter avec votre professionnel de santé. 

Si vous ressentez de la stigmatisation ou des préoccupations liées à votre état de santé, n'hésitez pas à consulter un professionnel de la santé mentale. Ils peuvent vous apporter un soutien précieux. La PrEP, qu'elle soit orale ou injectable, peut être intégrée à votre traitement global avec le bon accompagnement.",French,0
23,cojment pui-sje parler de mes préoccupaitons concernant la PrEP avec mon médecin tout en exprimant mes inquiétudes sur la stigmatisation ? ‼️,"Il est tout à fait normal d'avoir des préoccupations concernant la PrEP et son impact sur votre santé mentale. Lorsque vous parlez à votre médecin, vous pouvez commencer par exprimer vos inquiétudes spécifiques sur les fluctuations d'humeur et la stigmatisation que vous ressentez. Vous pourriez dire quelque chose comme : « J'aimerais discuter de la PrEP, mais j'ai des craintes sur son effet sur ma santé mentale, surtout avec mon trouble bipolaire, et je me sens parfois stigmatisée. » Cela ouvre la porte à une conversation honnête. N'hésitez pas à poser des questions sur les options orales et injectables de la PrEP. Si la stigmatisation vous pèse, envisager de parler à un professionnel de la santé mentale peut également être bénéfique.",French,1
24,Quels sont les effets secondaires de la PrEP qui pourraient influencer ma santé mentale ?,"La PrEP, qu'elle soit orale ou injectable, peut avoir des effets secondaires, mais ils varient d'une personne à l'autre. Les effets secondaires les plus courants incluent des nausées, des maux de tête ou de la fatigue, qui peuvent parfois influencer l'humeur. Cependant, ces effets sont souvent temporaires. 

Concernant la santé mentale, il est important de discuter de vos préoccupations avec un professionnel de la santé qui connaît votre histoire médicale, surtout avec un trouble bipolaire. Ils pourront vous aider à évaluer comment la PrEP peut s'intégrer dans votre traitement global et à naviguer les aspects de stigma. N'hésitez pas à chercher du soutien, que ce soit à travers des groupes de discussion ou des services de santé mentale.",French,0
25,comment .a prep peut-elle interwgir avec mes 7ra173m3nt5 actuels pour l3 trouble bipolaire ? ?,"Il est compréhensible d'avoir des préoccupations concernant l'interaction entre la PrEP et votre traitement pour le trouble bipolaire. La PrEP, qu'elle soit orale ou injectable, est généralement bien tolérée, mais il est essentiel de discuter de votre situation spécifique avec un professionnel de la santé. Ils pourront évaluer vos traitements actuels et vous aider à prendre une décision éclairée. En ce qui concerne la stigmatisation, sachez que vous n'êtes pas seule, et il existe des ressources et des groupes de soutien qui peuvent offrir une écoute et des conseils. Prenez soin de vous et n'hésitez pas à chercher le soutien dont vous avez besoin.",French,1
26,Quelles sont les ressources disponibles pour m'aider à gérer la stigmatisation liée à l'utilisation de la PrEP avec mon trouble bipolaire ?,"Il est tout à fait compréhensible de ressentir des inquiétudes concernant la stigmatisation et l'impact de la PrEP sur votre santé mentale. Pour vous soutenir, plusieurs ressources sont disponibles :

1. **Associations locales** : Recherchez des groupes de soutien pour les personnes vivant avec le VIH ou utilisant la PrEP, qui peuvent partager des expériences et des conseils.

2. **Professionnels de la santé mentale** : Parler avec un thérapeute peut vous aider à explorer vos sentiments et à développer des stratégies de gestion.

3. **Lignes d'écoute** : Certaines organisations proposent des lignes d'écoute pour discuter de la stigmatisation et de la santé mentale.

N'hésitez pas à chercher de l'aide, c'est un pas important vers votre bien-être.",French,0
27,Comment la PrEP peut-elle affecter mes fluctuations d'humeur et ma santé mentale en général ?,"Il est compréhensible d'avoir des préoccupations concernant l'impact de la PrEP sur votre santé mentale, surtout avec un trouble bipolaire. Actuellement, les études ne montrent pas de lien direct entre la PrEP et l'aggravation des troubles de l'humeur. Cependant, chaque personne est unique, et il est important de communiquer avec votre professionnel de santé sur vos inquiétudes. Ils pourront vous aider à évaluer comment la PrEP s'intègre dans votre traitement global. Concernant la stigmatisation, sachez que vous n'êtes pas seule dans ce parcours. Des groupes de soutien et des ressources professionnelles peuvent offrir un espace sûr pour partager vos expériences.",French,0
28,quell35 ressources ou groupes de soutien recommandez-vous pour les p3r50nn3s vivant avec un trouble bipolaire et prenant de idk la PrEP,"Il existe plusieurs ressources et groupes de soutien pour les personnes vivant avec un trouble bipolaire et prenant de la PrEP. Voici quelques suggestions :

1. **Association française des victimes de la psychiatrie (AFVP)** - Propose des ressources et un soutien pour les personnes touchées par des troubles mentaux.
2. **Société française de santé mentale** - Offre des informations et des ressources sur la santé mentale, y compris des groupes de soutien.
3. **Bipolar France** - Spécifiquement pour les personnes vivant avec un trouble bipolaire, avec des forums et des groupes de discussion.
4. **Crisis Text Line** - Une ligne d'assistance textuelle pour un soutien immédiat sur les problèmes de santé mentale.

N’hésitez pas à contacter un professionnel de santé pour discuter de votre situation et obtenir des conseils adaptés.",French,1
29,Comment la Pr3P pourraitelle um interagir avec m35 médicaments puor le trouble bipolaire ? ❓,"Il est important de discuter de l'interaction potentielle entre la PrEP et vos médicaments pour le trouble bipolaire avec votre professionnel de santé. La PrEP, qu'elle soit orale ou injectable, est généralement bien tolérée, mais chaque personne est unique. Votre médecin pourra évaluer vos médicaments actuels et vous rassurer sur les effets possibles sur votre santé mentale. 

Si vous ressentez des inquiétudes liées à la stigmatisation ou à votre santé mentale, envisagez de parler à un professionnel de santé mentale qui peut vous offrir un soutien. Vous méritez de vous sentir en sécurité et soutenue dans votre parcours de santé.",French,1
30,Quels sont les effets secondaires de la PrEP qui pourraient influencer mon humeur ou ma santé mentale ?,"La PrEP, qu'elle soit orale ou injectable, peut avoir des effets secondaires, mais ils varient d'une personne à l'autre. Certains utilisateurs rapportent des effets tels que des nausées, de la fatigue ou des maux de tête, qui peuvent temporairement influencer l'humeur. Cependant, il n'y a pas de lien direct établi entre la PrEP et des fluctuations d'humeur significatives.

Il est important de discuter de vos inquiétudes avec un professionnel de la santé, qui pourra vous apporter des conseils adaptés. Si vous ressentez de la stigmatisation ou des inquiétudes liées à votre santé mentale, envisagez de contacter un thérapeute ou une ligne d'écoute pour vous soutenir. Votre bien-être est essentiel.",French,0
